author,id,title,selftext,subreddit,subreddit_id,created_utc,year,month
JimCalinaya,4vcgft,"Tired of the ""lesser of two evils"" phenomenon that appears and reappears in american politics? If so, please institute rank voting or approval voting in future elections.",,politics,t5_2cneq,1469891825,2016,7
sendmeyourdicks,4vcgkw,Julian Assange: We have more material on Clinton,,politics,t5_2cneq,1469891877,2016,7
Sybles,4vcgnu,Trump's decade-long record of hiring foreign guest workers,,politics,t5_2cneq,1469891917,2016,7
polymute,4vcgnw,"Khizr Khan, a day after DNC address, urges Ryan and McConnell to repudiate Trump",,politics,t5_2cneq,1469891917,2016,7
TheMagicalHindu,4vch51,Apparently now you can poop trump,,politics,t5_2cneq,1469892112,2016,7
lindalarin,4vch77,Russians 'likely responsible' for Clinton campaign hack | Fox News,,politics,t5_2cneq,1469892139,2016,7
JohnDelmont,4vch8v,"Michelle Obama, Elizabeth Warren, and Bernie Sanders have a warning for our future",,politics,t5_2cneq,1469892158,2016,7
BillTowne,4vchco,Green party candidate Jill Stein accused of 'anti-vaxxer' sympathies,,politics,t5_2cneq,1469892208,2016,7
shiva14b,4vchcx,Fox News Didn't Air That Amazing Speech By The Father Of A Fallen Muslim Soldier,,politics,t5_2cneq,1469892210,2016,7
guiltyofnothing,4vchh2,"Donald Trump sniped back at Khizr Khan, who delivered a memorable speech at the Democratic National Convention, with eight words: ""I'd like to hear his wife say something.”",,politics,t5_2cneq,1469892253,2016,7
uncertainpath,4vchlc,The Democrats' Republican moment,,politics,t5_2cneq,1469892303,2016,7
TouchMeHerePls,4vchm1,Man who says he escaped Auschwitz makes stunning admission,,politics,t5_2cneq,1469892312,2016,7
TheTrollingPakistani,4vci0o,Donald Trump Supporters Are Now Calling Him 'God Emperor',,politics,t5_2cneq,1469892479,2016,7
ruskeeblue,4vciez,Ted Cruz Embraces Preacher Who Said Jews Will Die If They Reject Christ,,uspolitics,t5_2qwlq,1469892649,2016,7
conantheking,4vciot,U.S. Intel Head: We’re ‘Not Ready’ to Say Russia Was Behind DNC Hack,,uspolitics,t5_2qwlq,1469892749,2016,7
quantumbit92,4vcitv,"President Signs Law That Overturns Vermont GMO Labeling Rules, Replaces Them With Barcodes",,politics,t5_2cneq,1469892800,2016,7
Jmk1981,4vcivx,TRUMP ANNOUNCES HIS DEBATE ESCAPE PLAN.,,politics,t5_2cneq,1469892820,2016,7
drewiepoodle,4vciy5,Nebraska Gov. Pete Ricketts calls on State Sen. Bill Kintner to resign if allegations about sexually explicit video on state computer are true,,politics,t5_2cneq,1469892847,2016,7
dianamery,4vcizn,"The battle begins: Clinton, Trump barnstorm the battlegrounds post-convention | Fox News",,politics,t5_2cneq,1469892860,2016,7
Lixard52,4vcj2l,Don't appreciate the significance of Hillary Clinton's nomination? Too bad. This moment doesn't belong to you,,politics,t5_2cneq,1469892890,2016,7
CollumMcJingleballs,4vcj7e,Hillary Clinton’s foolish Tim Kaine hedge: Democrats cannot defeat Trumpism with cautious conservatism,,politics,t5_2cneq,1469892943,2016,7
masterbob985,4vcj9w,Clinton leads Trump by 6 points after Democratic confab: Reuters/Ipsos poll | Reuters,,politics,t5_2cneq,1469892970,2016,7
iamathousandaire,4vcjl8,Jill Stein Continues Pandering to Anti-Vaxxers,,politics,t5_2cneq,1469893089,2016,7
Asparagus64,4vckag,Clinton Takes the Lead in First Post-DNC Poll,,politics,t5_2cneq,1469893372,2016,7
jpmon,4vckrq,Ann Coulter Hammered by Conservatives for Smearing US War Hero’s Dad as ‘Angry Muslim’,,politics,t5_2cneq,1469893543,2016,7
seanosul,4vckta,"Republican vice presidential candidate Mike Pence said he doesn’t believe “name calling has any place in public life,” despite serving on a ticket with a man who takes pride in his ability to insult and ridicule people.",,politics,t5_2cneq,1469893558,2016,7
sdbest,4vckup,"BREAKING: Hours After First Intelligence Briefing, Trump Likely Leaked CLASSIFIED Secrets",,politics,t5_2cneq,1469893576,2016,7
sjlearton,4vckwc,Bernie or Bust - The Audacity of Compromise,,politics,t5_2cneq,1469893596,2016,7
mutilatedlipz,4vckzk,Clinton campaign denies reports that its computer system was hacked,,politics,t5_2cneq,1469893631,2016,7
onthemarketblog,4vclcc,Clinton campaign 'hacked' along with other Democratic groups by Russia,,politics,t5_2cneq,1469893767,2016,7
TouchMeHerePls,4vclja,What The Jews (Zionist) Did To The Germans - sound familiar USA?,,politics,t5_2cneq,1469893837,2016,7
uncertainpath,4vcljg,The Democrats' Putin dilemma,,politics,t5_2cneq,1469893838,2016,7
uncertainpath,4vclz4,Sexism’s secret gift to Hillary Clinton,,politics,t5_2cneq,1469894011,2016,7
JoaquimSilva,4vcm46,"As Trump lavishes Colorado with attention, he faces resistance in GOP enclave",,politics,t5_2cneq,1469894059,2016,7
Quiglius,4vcm51,"Wall Street for Hillary?:Clinton has $48.5M in hedge fund backing, compared to Trump's $19K",,politics,t5_2cneq,1469894070,2016,7
armchair_hunter,4vcm7z,Houston Chronicle endorses Clinton,,politics,t5_2cneq,1469894101,2016,7
Trident1000,4vcm9n,Video: Hillary Clinton still can’t say that the right to bear arms is a Constitutional right,,politics,t5_2cneq,1469894119,2016,7
Myron12,4vcmfs,Clinton leads Trump by 6 points after Democratic confab,,politics,t5_2cneq,1469894190,2016,7
tea-off-03,4vcmkn,Nomination of the first female American president,,politics,t5_2cneq,1469894245,2016,7
Jmk1981,4vcmvm,This Man's Story About Hillary Clinton Is Going Viral Because It's Honestly the *Best*,,politics,t5_2cneq,1469894363,2016,7
maxp0wah,4vcn4q,Hillary Clinton's organized fraud: Bernie Sanders' delegates replaced by actors at DNC. (For Unity!),,democrats,t5_2qn70,1469894461,2016,7
Ralphdraw3,4vcndy,Sanders to Tennessee delegates: Trump 'most dangerous candidate' in modern history,,politics,t5_2cneq,1469894558,2016,7
JashinGeh,4vcnf2,"As Zika arrives in U.S., Dems who blocked funding over Planned Parenthood demand action",,politics,t5_2cneq,1469894570,2016,7
Kurapika1102,4vcnp8,"Fox &amp; Friends July 30, 2016; IRS Launches Investigation on Hillary Clint...",,politics,t5_2cneq,1469894669,2016,7
Tina61,4vcntu,Breaking FBI is Doing a Full Investigation DNC emails Leaks on Hillary,,politics,t5_2cneq,1469894716,2016,7
JashinGeh,4vco1r,Democratic Platform: Killing the Unborn Is Fine with Us,,politics,t5_2cneq,1469894806,2016,7
richienyhus,4vco2n,Hillary Clinton wants to review US strategy in Syria against Isis and Bashar al-Assad's 'murderous' regime,,politics,t5_2cneq,1469894816,2016,7
uncertainpath,4vco5t,Sexism’s secret gift to Hillary Clinton,,politics,t5_2cneq,1469894848,2016,7
dataarchaeology,4vcolr,Six Reasons Why Politicians Believe They Can Lie (Jim Taylor Ph.D.),,politics,t5_2cneq,1469895014,2016,7
sdbest,4vcooy,Meet the big-name Republicans supporting Hillary Clinton,,politics,t5_2cneq,1469895051,2016,7
Vayate,4vcotf,PA Supreme Court Affirms that Castle Doctrine is an Inherent Right: it “has always been recognized as the law in this State” and that the castle doctrine’s acceptance is “universal.”,,politics,t5_2cneq,1469895103,2016,7
contoveros,4vcpjs,Immigrants unite against Trump out of love,,politics,t5_2cneq,1469895385,2016,7
TouchMeHerePls,4vcpl8,US: Israel's settlement activity is 'corrosive to the cause of peace',,politics,t5_2cneq,1469895397,2016,7
triggered-trumpeter,4vcpsn,"Hillary Bounces Back: In First Post-DNC Survey, Clinton Regains Commanding Lead Over Trump",,politics,t5_2cneq,1469895469,2016,7
WearyTunes,4vcq3y,#BlackWomenDidThat Notes Black Achievements Before Clinton,,politics,t5_2cneq,1469895595,2016,7
PrestoVivace,4vcq4d,Wonkblog The ‘smoking gun’ proving North Carolina Republicans tried to disenfranchise black voters,,politics,t5_2cneq,1469895601,2016,7
hillary4prizon,4vcqcj,"A Red, White and Blue Fantasy at the DNC: Thousands of flags can't cover Hillary's scandals, or the latest dismal economic news",,politics,t5_2cneq,1469895688,2016,7
[deleted],4vcqga,"How slow is US economic growth? ""Close to zero""",,politics,t5_2cneq,1469895728,2016,7
blackyellow23,4vcqly,Why Peter Thiel’s endorsement of Trump actually makes perfect sense,,politics,t5_2cneq,1469895781,2016,7
NinjaDiscoJesus,4vcqmh,"7,000 Deaths in Custody - A first-ever database provides a detailed look at how people died during encounters with the criminal-justice system in Texas.",,politics,t5_2cneq,1469895787,2016,7
Actuarybrad,4vcqv9,Hillary says “We will work to get money out of politics!” on the same day she accepts a $25 million donation from George Soros,,politics,t5_2cneq,1469895881,2016,7
maxp0wah,4vcrds,Hillary says “We will work to get money out of politics!” on the same day she accepts a $25 million donation from George Soros [/All],,democrats,t5_2qn70,1469896076,2016,7
Kurapika1102,4vcrok,"Fox &amp; Friends July 30, 2016; Is Having Romney's Support A Bad Luck For T...",,politics,t5_2cneq,1469896182,2016,7
Lord_Widnes,4vcrq3,"""How was I to know, he was with the Russians too?""",,republicans,t5_2r4xl,1469896200,2016,7
LDHegemon,4vcrt0,"""I Believe That Climate Change is Real and That We Can Save Our Planet While Creating Millions of Good-Paying Clean Energy Jobs""",,politics,t5_2cneq,1469896229,2016,7
uncertainpath,4vcrvz,"McCain's Granddaughter Voting For Clinton, Cites Trump's POW Comments",,politics,t5_2cneq,1469896260,2016,7
heros2011,4vcscd,Um cabritinho desafiando um boi,,politics,t5_2cneq,1469896423,2016,7
sdbest,4vcskd,How entangled with Russia is Trump?,,politics,t5_2cneq,1469896498,2016,7
JashinGeh,4vctal,Obama Issues Executive Order That May Drive Gunsmiths Out of Business,,politics,t5_2cneq,1469896777,2016,7
Lord_Widnes,4vctc8,"""How was I to know, he was with the Russians too?""",,democrats,t5_2qn70,1469896797,2016,7
benyadams,4vcteq,Trump: I didn't produce our show -- I just showed up for the final speech,,politics,t5_2cneq,1469896824,2016,7
Funintheass,4vctfj,Election HQ - Medal of Honor recipient reacts to disrespect shown at DNC,,politics,t5_2cneq,1469896832,2016,7
leona_helmsleys_dog,4vctm3,"Hillary Lead Over Trump Surges After Reuters ""Tweaks"" Poll",,politics,t5_2cneq,1469896899,2016,7
alexrlex,4vcu0u,Assange: We have more material related to Clinton,,politics,t5_2cneq,1469897057,2016,7
Quiglius,4vcu48,Donald Trump Says He Has One of the 'Best Temperaments' of Any Presidential Candidate,,politics,t5_2cneq,1469897090,2016,7
skoalbrother,4vcueg,WikiLeaks grabs election spotlight,,politics,t5_2cneq,1469897196,2016,7
Aditya-Dabral,4vcuif,Inside the United States of Trump,,politics,t5_2cneq,1469897236,2016,7
leona_helmsleys_dog,4vcuj0,The year of 'Neither': Why Reuters/Ipsos is tweaking its U.S. presidential poll,,politics,t5_2cneq,1469897240,2016,7
uncertainpath,4vcujf,Trump on Khizr Khan's speech: 'I'd like to hear his wife say something',,politics,t5_2cneq,1469897244,2016,7
CorrectingYourRecord,4vcuml,"Clinton calling young blacks ""Super Predators"" has not been forgotten",,politics,t5_2cneq,1469897277,2016,7
recoveringmonkey,4vcuvg,The Trump Effect: The Impact of the Presidential Campaign on Our Nation's Schools,,politics,t5_2cneq,1469897357,2016,7
I_HUG_TREEZ,4vcuxy,Warning signs: Friends of Mahaulepu posted signs in May warning beachgoers of bacteria contaminated water at Mahaulepu where the Waiopili Stream meets the ocean,,politics,t5_2cneq,1469897379,2016,7
xuanlongho,4vcv3i,Melania Trump's website taken down amid controversy,,politics,t5_2cneq,1469897429,2016,7
WearyTunes,4vcv6l,Danny Devito: 'Jeremy Corbyn and Bernie Sanders are the only shining lights we have now',,politics,t5_2cneq,1469897460,2016,7
DeSangfroid,4vcv8h,"Are Donald Trump, Brexit and Putin warning signs of another world war?",,politics,t5_2cneq,1469897481,2016,7
Grandebabo,4vcvak,The Saudi Cables: Buying Silence: How the Saudi Foreign Ministry controls Arab media,,politics,t5_2cneq,1469897502,2016,7
madfrogurt,4vcvej,"Roe vs. Wade will be overturned if Donald Trump wins, Mike Pence says",,politics,t5_2cneq,1469897547,2016,7
DrJarns,4vcvfp,Battle for union vote erupts in Ohio,,politics,t5_2cneq,1469897561,2016,7
HamsterSandwich,4vcvoq,Rudy Giuliani's Presumption of Guilt,,politics,t5_2cneq,1469897659,2016,7
L1terally_jabotinsky,4vcvu5,When Haim Saban Told Hillary Clinton To Stop Shouting,,politics,t5_2cneq,1469897719,2016,7
CollumMcJingleballs,4vcvyu,Hillary Clinton talks up racial justice. Some Black Lives Matter activists aren't buying it.,,politics,t5_2cneq,1469897773,2016,7
overthrow23,4vcw3v,Sony deletes 'Ghostbusters' tweet congratulating Hillary Clinton,,politics,t5_2cneq,1469897823,2016,7
richienyhus,4vcwbs,A Hillary Clinton presidency could end up letting Isis and al-Qaeda off the hook,,politics,t5_2cneq,1469897913,2016,7
arsov21,4vcwc0,Wikileaks Just Released The Biggest Disaster For Democrats – Hillary’s Worst Nightmare!,,politics,t5_2cneq,1469897915,2016,7
carbs90,4vcwpt,For my fellow sanders supporters - it's in the beginning stages,,politics,t5_2cneq,1469898065,2016,7
spackcity12,4vcwv9,Clinton Leads Trump by 6 Points After DNC: Reuters/Ipsos Poll,,politics,t5_2cneq,1469898119,2016,7
TM1323,4vcx2d,Bernie Sanders Won't Rule Out 2020 Presidential Run,,politics,t5_2cneq,1469898192,2016,7
uncertainpath,4vcx5b,Gallup: Trump's Convention Speech Worst Numbers of Any Polled,,politics,t5_2cneq,1469898220,2016,7
Anticipator1234,4vcx6f,Hillary Clinton’s Auto-Tuned Speech,,democrats,t5_2qn70,1469898234,2016,7
DrJarns,4vcx86,Presidential Rumble Will Come Down To Debates,,politics,t5_2cneq,1469898250,2016,7
Ragnavoke,4vcxbk,Protesters Break Through DNC Security Fence On Day 4 [video],,politics,t5_2cneq,1469898289,2016,7
spackcity12,4vcxgn,Clinton leads Trump by 6 points after Democratic confab: Reuters/Ipsos poll,,politics,t5_2cneq,1469898332,2016,7
Ragnavoke,4vcxiw,Protesters Break Through DNC Security Fence On Day 4 [footage starts at 2:13],,politics,t5_2cneq,1469898352,2016,7
ehtishamjani,4vcxmn,Trump calls out fire marshal after people turned away from rally,,politics,t5_2cneq,1469898392,2016,7
Ragnavoke,4vcxp5,Protesters Break Through DNC Security Fence On Day 4 [Footage Starts At 2:13],,politics,t5_2cneq,1469898416,2016,7
Funintheass,4vcxqa,Election 2016 - Why is Hillary having trouble with white male voters,,politics,t5_2cneq,1469898427,2016,7
rocktennstock,4vcyh8,Full List of Hillary’s Planned Tax Hikes,,politics,t5_2cneq,1469898692,2016,7
amlashi,4vcynt,JCPOA; Cost of Peace or A Stage for New Political Conflicts,,politics,t5_2cneq,1469898754,2016,7
jasonzimmy,4vcysi,Clinton gets ten point convention bounce; leads by 15,,politics,t5_2cneq,1469898804,2016,7
ahbying,4vcyzb,Taiwanese Animators take on DNC and Trump,,politics,t5_2cneq,1469898884,2016,7
Son0fSun,4vcz37,Do Political Campaign Ads Actually Work? Research Suggests Not Really,,politics,t5_2cneq,1469898928,2016,7
Myron12,4vczdl,Trump to Father of Fallen Soldier: 'I’ve Made a Lot of Sacrifices',,politics,t5_2cneq,1469899037,2016,7
MrGrassroots,4vczi5,Bill Maher had enough of #BernieOrBust folks,,politics,t5_2cneq,1469899086,2016,7
_watersheds,4vcziy,National poll has Clinton six points ahead of Trump,,politics,t5_2cneq,1469899097,2016,7
TheTrollingPakistani,4vczsl,Donald Trump Supporters Are Now Calling Him 'God Emperor',,politics,t5_2cneq,1469899199,2016,7
MrHand1111,4vczwo,Merkel on the ropes: Thousands of German protesters take to the streets saying she 'Must Go' and a key coalition ally withdraws support to open-door immigration policy after terror attacks,,politics,t5_2cneq,1469899245,2016,7
ruskeeblue,4vd04a,"WikiLeaks Delivers NEW Wave Of Emails, She Is Going To Jail",,uspolitics,t5_2qwlq,1469899334,2016,7
Anticipator1234,4vd06a,Bipartisan polling firm shows Clinton has significant lead over Trump.,,democrats,t5_2qn70,1469899355,2016,7
rp-,4vd072,"Roe vs. Wade will be overturned if Donald Trump wins, Mike Pence says",,politics,t5_2cneq,1469899365,2016,7
Fancy_Snacks,4vd0iw,"Local activist files suit for access to exit polling data, Dead witness blocks path to truth",,politics,t5_2cneq,1469899484,2016,7
tlaman,4vd0o1,"Nonprofit's ID cards get recognition from police, immigrants",,politics,t5_2cneq,1469899538,2016,7
overthrow23,4vd0qu,Lil Wayne mixtape 'inspires' Clinton speech say fans,,politics,t5_2cneq,1469899569,2016,7
HiMyNameIs10,4vd0tm,A transcript of Hillary Clinton’s interview with the Washington Post on economic policy,,politics,t5_2cneq,1469899600,2016,7
mutilatedlipz,4vd0x1,100 days to go in volatile race,,politics,t5_2cneq,1469899634,2016,7
londonentertainment,4vd106,I Wish ‘We’re The Greatest!’ Weren’t Such Good Politics,,politics,t5_2cneq,1469899665,2016,7
MaxMalini,4vd13m,How Donald Trump’s 1993 comments about ‘Indians’ previewed much of his 2016 campaign,,politics,t5_2cneq,1469899699,2016,7
ruskeeblue,4vd13t,Trump Claims America Should Never Have Given Canada Its Independence,,uspolitics,t5_2qwlq,1469899701,2016,7
ElsieZhou,4vd17v,Gymnast Simone Biles stays grounded as expectations build,,politics,t5_2cneq,1469899739,2016,7
Rwby_23,4vd1p5,Trump this response has makes me hate more than any other individual.,,election2016,t5_2s8qr,1469899911,2016,7
JohnDelmont,4vd27i,Stop fanning the flames of violence against cops,,politics,t5_2cneq,1469900108,2016,7
paraconformity,4vd2fu,"2016 General Election - Clinton 46%, Trump 31% (RABA Research 7/29)",,politics,t5_2cneq,1469900196,2016,7
richienyhus,4vd2s6,Where does TPP stand in this Trump v Clinton Presidential showdown?,,politics,t5_2cneq,1469900324,2016,7
BebopRocksteady82,4vd2y3,"Schweizer: Clinton Foundation Has Large Donors With ‘Histories of Corruption,’ No Reason To Donate Other Than Buying Influence",,politics,t5_2cneq,1469900382,2016,7
queerguru,4vd3d3,DNC Our Fight Song - queerguru,,politics,t5_2cneq,1469900542,2016,7
ron4va,4vd3f8,Trump in CO: I support legal marijuana if the states want it [VIDEO],,politics,t5_2cneq,1469900563,2016,7
chearn1973,4vd3rq,Brilliant Performance By Dems At DNC Pushes Hillary Into Firm Lead In Polls (VIDEO),,politics,t5_2cneq,1469900688,2016,7
Wehzrd,4vd47d,funny c-span caller thinks trump acts like he's on drugs,,politics,t5_2cneq,1469900840,2016,7
nirad,4vd4cf,"The question I hope everyone who booed Hillary Clinton at the DNC asks themselves (And no, it has nothing to do with Donald Trump)",,politics,t5_2cneq,1469900892,2016,7
PensivePropagandist,4vd4hs,Sanders consultants head to tim canova,,politics,t5_2cneq,1469900943,2016,7
Robert6700,4vd4j9,Trump on Muslim at DNC: I'd like to 'hear his wife say something',,politics,t5_2cneq,1469900957,2016,7
MaleWithAPenis,4vd4qe,Donald Trump Wants To Legalize Marijuana,,politics,t5_2cneq,1469901029,2016,7
londonentertainment,4vd4rr,Do black lives matter in America?: US politics and Dallas aftermath,,politics,t5_2cneq,1469901040,2016,7
idmedb,4vd4tj,Hillary Clinton: A TOP TEN Breakdown,,politics,t5_2cneq,1469901059,2016,7
PensivePropagandist,4vd4y1,Jill Stein: DNC sabotaged Bernie Sanders,,politics,t5_2cneq,1469901101,2016,7
ravupadh,4vd58j,"Mike Pence is the anti-Trump on the trail, just the way the campaign wants it",,politics,t5_2cneq,1469901213,2016,7
ClitnBalls,4vd5ej,Most Americans reject Trump's e-mail call,,politics,t5_2cneq,1469901276,2016,7
zsreport,4vd5i2,Ballot measures explode across country — and so do their costs,,politics,t5_2cneq,1469901315,2016,7
ruskeeblue,4vd5n4,Emanuel - the terrorist,,uspolitics,t5_2qwlq,1469901370,2016,7
r4816,4vd5nc,Donald Trump's former ghostwriter has noticed something incredible about his insults,,politics,t5_2cneq,1469901372,2016,7
HeatherSchaeferScott,4vd5x9,Advice going forward for ImWithHer from FeelTheBern,,politics,t5_2cneq,1469901464,2016,7
ruskeeblue,4vd67v,Hillary Clinton faces mass dissent over ‘dirty tricks’ on Bernie Sanders,,uspolitics,t5_2qwlq,1469901569,2016,7
PensivePropagandist,4vd6de,Dr. Jill Stein: As a medical doctor I support vaccinations.,,politics,t5_2cneq,1469901622,2016,7
Funintheass,4vd6gn,Wikileaks Founders: We have more material related Hillary Clinton,,politics,t5_2cneq,1469901654,2016,7
Myron12,4vd6ig,Breaking News Point - The 'smoking gun' proving North Carolina Republicans tried to disenfranchise black voters,,politics,t5_2cneq,1469901670,2016,7
ruskeeblue,4vd6jp,This Sanders Delegate Unleashing on Hillary Clinton Is Going Absolutely Viral,,uspolitics,t5_2qwlq,1469901687,2016,7
truthhurts4444,4vd6pn,Will Sanders Supporters Come Around?,,politics,t5_2cneq,1469901744,2016,7
simply_there,4vd6r6,Vice President Joe Biden to guest star on 'Law &amp; Order: SVU',,democrats,t5_2qn70,1469901759,2016,7
dvorovi,4vd72q,Trump responds to Muslim DNC speaker: 'I'd like to hear his wife',,politics,t5_2cneq,1469901879,2016,7
NorbertH66,4vd72z,"Sign this petition to have the elections on paper ballots to avoid rigging! (Cough cough, Hillary)",,politics,t5_2cneq,1469901881,2016,7
JohnDelmont,4vd7ff,Despicable idiot Al Sharpton Blames Police for Dallas ambush killings,,politics,t5_2cneq,1469902010,2016,7
RealRepub,4vd7wf,[ Democratic Money Alert ] Rockefeller Fund Takes First Green Stake in Pivot From Oil,,democrats,t5_2qn70,1469902188,2016,7
ruskeeblue,4vd7yf,Child Rape case against Dnald Trump goes forward,,uspolitics,t5_2qwlq,1469902205,2016,7
fishhoncho,4vd848,"Jill Stein says she supports vaccinations, is not an anti-vaxxer",,politics,t5_2cneq,1469902261,2016,7
lovely_sombrero,4vd8pb,Why Were There Awkwardly Timed Chants Of 'Hillary' At The DNC?,,politics,t5_2cneq,1469902480,2016,7
paraconformity,4vd8ts,"Donald Trump’s slander of Captain Humayun Khan’s family is horrifying, even for Trump",,politics,t5_2cneq,1469902520,2016,7
Meatsim1,4vd90x,"Trump to father of slain soldier: I think I've made a lot of sacrifices. I work very, very hard. I've created thousands and thousands of jobs, tens of thousands of jobs, built great structures. I've had tremendous success. I think I've done a lot",,politics,t5_2cneq,1469902590,2016,7
michaelconfoy,4vd946,"Russians like Trump, but do they believe him?",,democrats,t5_2qn70,1469902632,2016,7
axpmaluga,4vd9bk,Symone Sanders on Life After Bernie,,politics,t5_2cneq,1469902707,2016,7
Crap-commentary,4vd9h1,Where is Meredith McIver and Why is Her Twitter Feed Suddenly Speaking in Russian?,,politics,t5_2cneq,1469902755,2016,7
TonyDiGerolamo,4vd9iz,U.S. Green Party leader: Clinton doesn’t care about Palestinian human rights,,politics,t5_2cneq,1469902772,2016,7
Fitbitnitwit,4vd9lq,Trump responds to Muslim DNC speaker: 'I'd like to hear his wife',,politics,t5_2cneq,1469902802,2016,7
awake-at-dawn,4vd9ml,Mark Cuban: I will vote for Clinton,,politics,t5_2cneq,1469902811,2016,7
londonentertainment,4vda0v,Islamophobia Increases Muslim American Participation in US Politics,,politics,t5_2cneq,1469902964,2016,7
AlanFranklin,4vdanw,Trump protesters turn out for rally at Wings Over the Rockies,,politics,t5_2cneq,1469903214,2016,7
anutensil,4vdayk,"Judge Strikes Down Voting Restrictions In Wisconsin, Calls Them A ‘Wretched Failure’",,democrats,t5_2qn70,1469903334,2016,7
santrikc,4vdb13,Republicans Offered Nick Jonas Millions To Perform At Convention,,politics,t5_2cneq,1469903362,2016,7
HILLARY_4_TREASON,4vdbdx,Clinton’s DNC Speech is ‘Lesson in Hypocrisy’ on Supreme Court Nominees,,politics,t5_2cneq,1469903502,2016,7
akula51,4vdbiq,"Show of hands, fellow vapers...Who else is just fed up with our Government? • [X-post from /r/Vaping]",,politics,t5_2cneq,1469903557,2016,7
dangzal,4vdblr,Draft-Dodger Trump Said Sleeping Around Was My ‘Personal Vietnam’,,democrats,t5_2qn70,1469903596,2016,7
mattseg,4vdbrw,WikiLeaks reveals DNC holds unions in contempt,,politics,t5_2cneq,1469903658,2016,7
Clinton-Kaine,4vdckd,"Obama Job Approval - Approve 53%, Disapprove 43%",,politics,t5_2cneq,1469903963,2016,7
Rakishdom,4vddaw,Trump lashes out at parents of Muslim war hero: ‘I think I’ve made a lot of sacrifices’,,democrats,t5_2qn70,1469904237,2016,7
Kenatius,4vdded,Donald Trump’s Ghostwriter Tells All - “The Art of the Deal” made America see Trump as a charmer with an unfailing knack for business. Tony Schwartz helped create that myth—and regrets it.,,politics,t5_2cneq,1469904274,2016,7
thefatoldman,4vddwz,2016 Election Forecast: Who would win an election today,,politics,t5_2cneq,1469904454,2016,7
stellasmith58,4vddzw,"A top military chief and other officials insisted Friday that the United States was not involved in the attempted military coup in Turkey, underscoring tense relations between the allies.",,politics,t5_2cneq,1469904483,2016,7
ravupadh,4vdehq,Texas Muhammad Art Attack Conspirator: My Due Process Rights Were Violated,,politics,t5_2cneq,1469904670,2016,7
DJ_Cummerbund,4vdevl,Trump Knows The Way!,,politics,t5_2cneq,1469904800,2016,7
[deleted],4vdezp,Trump: I wish Ivanka and Chelsea Clinton weren't friends,,politics,t5_2cneq,1469904839,2016,7
mattseg,4vdfih,Trump: I give Obama 'tremendous credit',,politics,t5_2cneq,1469905021,2016,7
akula51,4vdfjg,"Show of hands, fellow vapers (and others). Who else is fed up with Big Government?",,politics,t5_2cneq,1469905034,2016,7
Kenatius,4vdg57,Mark Cuban picks Clinton over Trump,,politics,t5_2cneq,1469905240,2016,7
ravupadh,4vdg93,Donald Trump and RNC attack presidential debate schedule,,politics,t5_2cneq,1469905283,2016,7
deeprogrammed,4vdh64,NATO commander agrees members should pay up,,politics,t5_2cneq,1469905604,2016,7
mattseg,4vdhfu,Rudy Giuliani: DNC the ‘Most Anti-Police’ Convention Ever,,politics,t5_2cneq,1469905713,2016,7
londonentertainment,4vdhwu,Federal probe into campaign funds latest headache for Dem Gov. Malloy,,politics,t5_2cneq,1469905889,2016,7
SrgAr,4vdi0e,LORETTA LYNN &amp; BOBBY BARE-God Bless America Again,,uspolitics,t5_2qwlq,1469905924,2016,7
Lord_Widnes,4vdi54,BFFs,,republicans,t5_2r4xl,1469905974,2016,7
canausernamebetoolon,4vdi8k,Trump Reeling As Clinton Gets 10 Point Democratic Convention Bounce And 15 Point Lead,,democrats,t5_2qn70,1469906014,2016,7
EvilPicnic,4vdifh,Extremism thrives because of cowardly collaborators,,politics,t5_2cneq,1469906078,2016,7
