author,id,title,selftext,subreddit,subreddit_id,created_utc,year,month
ReasonOz,4vb2mk,The Tale of Two Realities: MSM versus Social Media at DNC,,politics,t5_2cneq,1469862360,2016,7
iHateTheStuffYouLike,4vb2qb,"Email taken from Clinton's server with 13 ""(C)"" markings she did not understand",,politics,t5_2cneq,1469862423,2016,7
smokinbluebear,4vb2up,Clinton and Kaine leave Philadelphia on a bus bound for the heartland,,politics,t5_2cneq,1469862501,2016,7
SKSCartoon,4vb2w7,"The DNC seems to think that we are living in lah-lah-land where everything is so bright and positive, I can't say that I agree",,politics,t5_2cneq,1469862534,2016,7
ciethrenn,4vb337,The Nightly Show - Gary Johnson,,politics,t5_2cneq,1469862645,2016,7
newsandmore,4vb38m,Trump blasts fire marshal for capping rally attendance,,politics,t5_2cneq,1469862749,2016,7
BlankVerse,4vb3a7,"""For decades the Republican Party has embraced America’s open, future-oriented nationalism. But when you nominate a Silvio Berlusconi you give up a piece of that. When you nominate a blood-and-soil nationalist you’re no longer speaking in the voice of Lincoln""",,politics,t5_2cneq,1469862770,2016,7
Irmaliv111,4vb3ut,The Hillary Recession: Trump knows you can’t tax your way into prosperity,,politics,t5_2cneq,1469863145,2016,7
Trumpula,4vb3uv,Donald Trump either just made up an imaginary U.S. military base or he leaked a classified secret,,politics,t5_2cneq,1469863146,2016,7
Irmaliv111,4vb3yu,Donald Trump says he is taking the gloves off against Hillary Clinton,,politics,t5_2cneq,1469863221,2016,7
happyantoninscalia,4vb3zu,"Justin Bieber got a $5 million offer to perform at a Republican event during the GOP Convention, but turned it down after his manager considered quitting and LeBron James urged him to reject it",,politics,t5_2cneq,1469863240,2016,7
Irmaliv111,4vb424,Hillary Clinton goes to the movies while Libertarians offer a third choice,,politics,t5_2cneq,1469863277,2016,7
Irmaliv111,4vb43n,LETTERS: Hillary Clinton is the choice for the future,,politics,t5_2cneq,1469863303,2016,7
BernBro4Hillary,4vb43r,Bernie Bros Become Hillary Bros at the Democratic National Convention,,politics,t5_2cneq,1469863305,2016,7
Irmaliv111,4vb453,Hillary Clinton campaign hacked,,politics,t5_2cneq,1469863335,2016,7
Irmaliv111,4vb484,Here's why this UP village is praying for Hillary Clinton's win,,politics,t5_2cneq,1469863390,2016,7
Johnperr743,4vb4bb,Battle of the generals: Flynn blasts Allen for Clinton endorsement,,politics,t5_2cneq,1469863455,2016,7
Irmaliv111,4vb4g0,"US Poll Campaign: Hillary Clinton, Tim Kaine Begin Bus Tour",,politics,t5_2cneq,1469863548,2016,7
Irmaliv111,4vb4h8,Donald Trump to Hillary Clinton: ‘No more Mr. Nice Guy’,,politics,t5_2cneq,1469863575,2016,7
DrJarns,4vb50c,Hillary Clinton Job Application...,,politics,t5_2cneq,1469863920,2016,7
thyeyretoocute,4vb5ap,RAW: 9NEWS full interview with Donald Trump,,politics,t5_2cneq,1469864103,2016,7
Asparagus64,4vb5bf,Donald Trump tells Hillary Clinton 'no more Mr Nice Guy' after Democrat scorching,,politics,t5_2cneq,1469864114,2016,7
fredericktwo,4vb6he,Grace Meng - Vice Chair of DNC - has corruption issues too,,politics,t5_2cneq,1469864854,2016,7
mikewhoneedsabike,4vb6yn,Trump - Flip Flop On Kidding Or Not Kidding,,democrats,t5_2qn70,1469865161,2016,7
thyeyretoocute,4vb76k,Donald Trump Just Came Out In Support Of Legal Marijuana,,politics,t5_2cneq,1469865307,2016,7
michaelconfoy,4vb7a9,Trump and the Oligarch: He claims no ties to Russia. Here’s how he made millions from one of its wealthiest men.,,democrats,t5_2qn70,1469865377,2016,7
HoneyInTheDesert,4vb7hj,Come With Me To The Democrats Abroad Meeting In Dubai,,democrats,t5_2qn70,1469865519,2016,7
ElegantCossack,4vb7kg,Granny Merkel,,politics,t5_2cneq,1469865576,2016,7
ciethrenn,4vb7rx,Gary Johnson knows Exactly How to Hit Trump Where it Hurts,,politics,t5_2cneq,1469865734,2016,7
hazenthephysicist,4vb872,Trump's response to speech by fallen Muslim soldier's father: “I’d like to hear his wife say something.”,,politics,t5_2cneq,1469865986,2016,7
izzypop112,4vb88i,Wikileaks posts hacked DNC voicemails,,politics,t5_2cneq,1469866014,2016,7
ciethrenn,4vb8dj,The Nightly Show - Gary Johnson,,politics,t5_2cneq,1469866109,2016,7
Belinda_richerds,4vb8ll,Donald Trump at Denver rally: 'I’ve got to win here',,politics,t5_2cneq,1469866269,2016,7
Hugo5455,4vb96i,"With the Conventions Behind Us, Our Takeaways From Both",,politics,t5_2cneq,1469866651,2016,7
fredericktwo,4vb9ff,New Vice-Chair of DNC has corruption issues too!,,republicans,t5_2r4xl,1469866812,2016,7
suiko2fan2,4vb9o7,Hillary Clinton's reaction on Election Night as Trump Wins,,politics,t5_2cneq,1469866982,2016,7
sportscar99,4vb9og,"How Many Delegates Does Bernie Sanders Need To Block Hillary Clinton's Nomination? Well, It's Complicated",,politics,t5_2cneq,1469866986,2016,7
jimrosenz,4vb9q7,"The Guardian view on Hillary Clinton: fit for the job, but is she fit for the contest?",,politics,t5_2cneq,1469867024,2016,7
ProfoundInfo,4vb9r4,Reality Check: Why #DNCLeak Much Bigger Than Just Bernie Sanders,,politics,t5_2cneq,1469867044,2016,7
ElsieZhou,4vba26,"'We have to win this state,' Trump tells thousands at Denver rally",,politics,t5_2cneq,1469867264,2016,7
clippingretouch,4vbaau,"More Tuned in for Trump's Speech, but Democrats Won Ratings Over All",,politics,t5_2cneq,1469867426,2016,7
seanosul,4vbbap,Huckabee responds to Muslim father featured at DNC,,politics,t5_2cneq,1469868135,2016,7
Ludwig657,4vbbct,U.S. Air Force asks industry for proposals to replace nuclear missiles,,politics,t5_2cneq,1469868183,2016,7
Pocketcrow,4vbbe6,Judge Strikes Down Parts Of Wisconsin's Restrictive Voting Laws,,politics,t5_2cneq,1469868207,2016,7
bodobobo,4vbbxh,Hillary Takes In SEVEN TIMES As Much Hedge Fund Money As ’08 Obama,,politics,t5_2cneq,1469868557,2016,7
kingsize900,4vbd21,عصام حجى يؤكد ندمه على قبوله منصب مستشار الرئيس,,politics,t5_2cneq,1469869338,2016,7
Devendr74,4vbddg,Many GOP foreign policy experts see Donald Trump as unfit to be president,,politics,t5_2cneq,1469869526,2016,7
MWBartko,4vbdvp,The Politics of Solidarity: A Case for the American Solidarity Party,,politics,t5_2cneq,1469869906,2016,7
Sabti,4vbepj,Clinton's Portrayal of Trump as Dictator Aims at the Left and Right,,politics,t5_2cneq,1469870494,2016,7
Forgottopraise,4vbfkw,"DNC staffers angry about Joe telling live in MSNBC that the system is rigged, wants to complain to his producer",,politics,t5_2cneq,1469871119,2016,7
fig1newton,4vbg0y,FBI investigating reported hack of Clinton computer network,,politics,t5_2cneq,1469871427,2016,7
LindaJoyAdams,4vbg9e,Linda Joy Adams: DAILY RECAP ADDED 7/30/16 NO PROTECTION OF OUR MEDICAL RECORDS SINCE 1999. WAS THIS HILLARY'S COUP OF 2002?,,politics,t5_2cneq,1469871593,2016,7
ccbg420,4vbgmt,Fight for female vote will feature Ivanka Trump against Hillary Clinton,,politics,t5_2cneq,1469871844,2016,7
Newsfiller,4vbgwt,Concerned Over Reports Of Rising Intolerance': US,,politics,t5_2cneq,1469872032,2016,7
political_news_2016,4vbh47,Has Clinton Written Off Working-Class White Men? |,,politics,t5_2cneq,1469872162,2016,7
democraticwhre,4vbhaf,Reminder: Hillary Clinton fought for Plan B contraception during the Bush era.,,politics,t5_2cneq,1469872279,2016,7
3Suze,4vbhfq,The GOP is becoming the party of exclusion. Who wants to be a part of that?,,politics,t5_2cneq,1469872390,2016,7
dukbcaaj,4vbhjw,"Trump Press release: ""Bill Clinton helped grease a deal that allowed Foundation donors to become rich and that allowed Russia to control a large stake of the world's uranium supply""",,politics,t5_2cneq,1469872466,2016,7
cuoidukieutv,4vbhkx,đầy cảm súc với sư phụ bắc hoàng 100 con rắn hổ mang chúa,,politics,t5_2cneq,1469872481,2016,7
dukbcaaj,4vbihm,"Polls Show Americans Distrust Clinton, and Give Her Supporters Reasons to Panic",,politics,t5_2cneq,1469873129,2016,7
Dumbcaveman,4vbj43,"Computer Systems Used by Clinton Campaign Are Said to Be Hacked, Apparently by Russians",,politics,t5_2cneq,1469873567,2016,7
Forgottopraise,4vbj7t,Is it just me or is this election the most entertaining period in your life? This Tv-show has no shill.,,politics,t5_2cneq,1469873642,2016,7
JarrettJeff65,4vbjxi,It’s Always Sunny in Philadelphia,,politics,t5_2cneq,1469874118,2016,7
Perrliveard,4vbk0a,Clinton leads Trump by 6 points after Democratic confab: Reuters/Ipsos poll,,politics,t5_2cneq,1469874166,2016,7
londonentertainment,4vbl6v,Donald Trump Has Exactly 3 Positive Things To Say About America,,politics,t5_2cneq,1469874935,2016,7
veritanuda,4vblik,"As Hillary Clinton Accepts Democratic Nomination, Hundreds Protest Outside Convention Arena",,politics,t5_2cneq,1469875144,2016,7
Mex007,4vbmgd,"Bernthology - A social anthology for Bernie Sanders and the revolution he is inspiring. 730+ fan made songs, videos, and creative artworks...",,politics,t5_2cneq,1469875785,2016,7
seanosul,4vbmiu,"Trump backs his supporters' ""lock her up"" chant",,politics,t5_2cneq,1469875833,2016,7
cmit,4vbmpt,Federal Appeals Court Strikes Down North Carolina Voter ID Requirement,,politics,t5_2cneq,1469875951,2016,7
zsreport,4vbmzy,Donald Trump Says He Has One of the 'Best Temperaments' of Any Presidential Candidate,,politics,t5_2cneq,1469876156,2016,7
DncInvest,4vbn81,"Hillary Clintons Policys Will increase US debt if she gets elected, acording to DNC. Are the new progressive promises possible?",,politics,t5_2cneq,1469876328,2016,7
KevinBarksdale,4vbnle,Clinton left everybody wondering how she plans to create jobs,,politics,t5_2cneq,1469876586,2016,7
KevinBarksdale,4vbnrz,Clinton-Obama hug photo goes viral on Instagram,,politics,t5_2cneq,1469876710,2016,7
KevinBarksdale,4vbo5u,Donald Trump adorns Michael Bloomberg with Marco Rubio's former nickname in irate tweetstorm,,politics,t5_2cneq,1469876973,2016,7
KevinBarksdale,4vbocc,Gay men in the US may be allowed to donate blood in far greater numbers | VICE News,,politics,t5_2cneq,1469877092,2016,7
Skenderbeio,4vboka,AP FACT CHECK: Misfires in Hillary Clinton’s speech,,politics,t5_2cneq,1469877228,2016,7
KevinBarksdale,4vborz,Venezuela has a new 'forced labor' law that can require people to work in fields | VICE News,,politics,t5_2cneq,1469877349,2016,7
Rakishdom,4vbp33,Federal judge strikes down parts of Wisconsin voter laws,,democrats,t5_2qn70,1469877582,2016,7
Maxwellstracha,4vbpfo,Clinton's campaign was also hacked in breach of Democratic Party,,politics,t5_2cneq,1469877832,2016,7
Not_Fooled,4vbpns,Clinton Foundation breach may be Russian hackers...,,politics,t5_2cneq,1469877971,2016,7
coolcrosby,4vbq9k,Ken Paxton: Is his legal trouble motivated by politics?,,politics,t5_2cneq,1469878381,2016,7
Rakishdom,4vbqez,Bill Maher urges Hillary Clinton to become ‘super villain’ GOP thinks she is: ‘Notorious HRC’,,democrats,t5_2qn70,1469878478,2016,7
Tsing_Tao,4vbqxh,Hillary Clinton and Her Hawks,,politics,t5_2cneq,1469878782,2016,7
sarimnoor,4vbred,آرمی چیف صاحب اگر جانور(کتے) کو انصاف مل سکتا ھے تو ماڈل ٹاون میں شھید ھونے والے بھی پاکستانی تھے انکو بھی انصاف دلائیں,,politics,t5_2cneq,1469879045,2016,7
coolcrosby,4vbrhw,Cornyn Rebukes Cruz for Snubbing Trump at Republican Convention,,politics,t5_2cneq,1469879096,2016,7
Buchi001,4vbrvk,Donald Trump Is A Nigerian Politician,,politics,t5_2cneq,1469879322,2016,7
aacool,4vbs42,Mike Pence walks 10 Nuns out of the Voting Booth,,politics,t5_2cneq,1469879461,2016,7
guiltyofnothing,4vbsex,Trump floats opposition to debate schedule,,politics,t5_2cneq,1469879646,2016,7
KevinBarksdale,4vbsjq,North Carolina voter-id law overturned for targeting African Americans â Quartz,,politics,t5_2cneq,1469879727,2016,7
KevinBarksdale,4vbsqj,"Two Political Conventions, Two Distinct World Views",,politics,t5_2cneq,1469879855,2016,7
KevinBarksdale,4vbt2d,dj bravo champion lyrics,,politics,t5_2cneq,1469880073,2016,7
KevinBarksdale,4vbtrr,"Live Stream: Donald Trump Town Hall in Colorado Springs, [ AMAZING MUST WATCH ] CO FULL SPEECH HD",,politics,t5_2cneq,1469880494,2016,7
KevinBarksdale,4vbtva,"End Times News Update: WORLD GONE MAD! (Latest Events #37) Jan, 2016",,politics,t5_2cneq,1469880555,2016,7
blackyellow23,4vbu2q,"Trump's Russia Reset Ideas Alarming Allies, Many in US",,politics,t5_2cneq,1469880690,2016,7
Flicker65,4vbu2t,"Mike Pence breaks ""iron clad"" rule for a good cause",,politics,t5_2cneq,1469880690,2016,7
Mex007,4vbudy,NDP calls for election spending limits in Alberta,,politics,t5_2cneq,1469880878,2016,7
clippingretouch,4vbuwd,"Trump, Bloomberg escalate New York billionaire brawl",,politics,t5_2cneq,1469881181,2016,7
HamsterSandwich,4vbvap,The ‘smoking gun’ proving North Carolina Republicans tried to disenfranchise black voters,,politics,t5_2cneq,1469881436,2016,7
ciethrenn,4vbvay,Nirvana's Krist Novoselic: Gary Johnson can win,,politics,t5_2cneq,1469881441,2016,7
SystemsofChaos,4vbvt7,Is Trump the evangelicals’ new drug for political power?,,politics,t5_2cneq,1469881792,2016,7
fullsubmission,4vbvug,This is the movie Hillary and Bill Clinton DO NOT WANT you to see,,politics,t5_2cneq,1469881806,2016,7
GanduBaadshah,4vbw2r,"In Tribute to Son, Khizr Khan Offered Citizenship Lesson at Convention",,politics,t5_2cneq,1469881934,2016,7
greenrd,4vbw3z,The strange death of American Libertarianism in the GOP,,politics,t5_2cneq,1469881954,2016,7
Adnankhkattak1,4vbwc1,How it felt when America got a first woman presidential nominee,,politics,t5_2cneq,1469882086,2016,7
HamsterSandwich,4vbwec,Why the Bush Family Should Endorse Hillary Clinton,,politics,t5_2cneq,1469882124,2016,7
Bertha873,4vbx1f,"Court strikes down ""discriminatory"" North Carolina voter ID law",,politics,t5_2cneq,1469882487,2016,7
richienyhus,4vbxdc,"""Syria would be Mrs Clinton’s 'first key task' if elected and she will work to get President Assad “out of there"". (Clinton policy adviser)",,politics,t5_2cneq,1469882659,2016,7
d3fi4nt,4vbxfy,"Bernie Actually Won, Protests Rock DNC | Redacted Tonight",,politics,t5_2cneq,1469882690,2016,7
Jooshwa,4vby34,Cross post from r/thedonald. Emails showing DNC changing dates of contribution!,,politics,t5_2cneq,1469883044,2016,7
lolmonger,4vby8d,Donald Trump is “100 Percent” For Medical Marijuana,,politics,t5_2cneq,1469883126,2016,7
Mulberry_mouse,4vbyao,Here's Where Hillary Clinton VP Pick Tim Kaine Actually Stands on Women's Issues,,politics,t5_2cneq,1469883158,2016,7
mildweed,4vbyjm,Why Trump Supporters Think He'll Win,,politics,t5_2cneq,1469883296,2016,7
Kenatius,4vbz46,The lies Trump told this week: a Russian love-in and conspiracy theories - The Democratic convention didn’t stop Donald Trump from weighing in on everything from Putin to the JFK assassination. So what was true?,,politics,t5_2cneq,1469883639,2016,7
GeorgeWTrudeau,4vbz8o,"President Obama To Be In Atlanta on Monday; While Georgia has consistently voted Republican in recent White House elections, Clinton and Democrats insist the Peach State is in play in 2016.",,politics,t5_2cneq,1469883715,2016,7
Ralphdraw3,4vc0dc,"Real Time with Bill Maher: Interview with Bernie Sanders - July 29, 2016",,politics,t5_2cneq,1469884264,2016,7
CarrollQuigley,4vc0ew,Obama to push for TPP passage despite opposition from presidential candidates,,politics,t5_2cneq,1469884287,2016,7
mccrearymoshe,4vc0o8,The Economy And Politics Of 1968: Now Playing In Reruns,,politics,t5_2cneq,1469884417,2016,7
kaskas100,4vc0q9,Donald Trump's convention polling bump has already evaporated,,politics,t5_2cneq,1469884443,2016,7
zapichigo,4vc0ra,The economists' guide to choosing between Trump and Clinton,,politics,t5_2cneq,1469884457,2016,7
seanosul,4vc147,Democrats Eager to Woo Republicans Who Are Wary of Trump,,politics,t5_2cneq,1469884641,2016,7
haileynathan,4vc187,Week In Politics: The Democratic National Convention,,politics,t5_2cneq,1469884703,2016,7
BlairHatton,4vc1cw,Message To Obama From An Ex-Muslim,,politics,t5_2cneq,1469884768,2016,7
GeorgeWTrudeau,4vc1es,Courts strike blow to GOP voter restrictions in 3 states; The decisions followed a similar blow earlier this month to what critics said was one of the nation’s most restrictive voting laws in Texas.,,politics,t5_2cneq,1469884800,2016,7
ainbheartach,4vc2ir,Donald Trump and Russia: a web that grows more tangled all the time,,politics,t5_2cneq,1469885396,2016,7
FatLadySingin,4vc36z,What a great day for protecting voting rights in Kansas and elsewhere,,politics,t5_2cneq,1469885735,2016,7
wardsalud,4vc3g0,Hillary Clinton and Tim Kaine kick off battleground bus tour,,politics,t5_2cneq,1469885865,2016,7
Rakishdom,4vc3r7,Trump accuses Clinton of rigging debate schedule,,democrats,t5_2qn70,1469886037,2016,7
UncleSamGamgee,4vc4c7,Bernie Sanders opens up to Bill Maher about emotional moment during Philly DNC,,politics,t5_2cneq,1469886334,2016,7
dvorovi,4vc4ee,NATO Commander STUNS Media… Vindicates Trump With 1 Sentence,,politics,t5_2cneq,1469886365,2016,7
tangibleadhd,4vc4kt,Israel and U.S. are close to a deal on the biggest military aid package ever,,politics,t5_2cneq,1469886454,2016,7
CarrollQuigley,4vc4r1,"Sanders Delegate: DNC Stripped My Credentials for Holding ""No TPP"" Sign",,politics,t5_2cneq,1469886544,2016,7
conairthehairdryer,4vc50j,How Pepe the Frog Became a Nazi Trump Supporter and Alt-Right Symbol,,politics,t5_2cneq,1469886672,2016,7
Factrider,4vc5it,Fact Rider: WATCH: Donald Trump’s “THE SNAKE” Video Is Going VIRAL in Europe (Guess Who HATES This?),,politics,t5_2cneq,1469886918,2016,7
kaskas100,4vc5m7,"Licking Co. native ran for president in 1872, the first woman ever to do so",,uspolitics,t5_2qwlq,1469886963,2016,7
loki8481,4vc5sj,Hillary Clinton has a very detailed plan for the economy. That may be a problem.,,politics,t5_2cneq,1469887059,2016,7
MostlyCarbonite,4vc697,"Computer Systems Used by Clinton Campaign Are Said to Be Hacked, Apparently by Russians",,politics,t5_2cneq,1469887299,2016,7
anutensil,4vc69d,"What Trump Talks About When He Talks About the Working Class - In reflecting the diversity of America's workers, the Democratic National Convention offers an instructive contrast to Trump's rhetoric.",,democrats,t5_2qn70,1469887300,2016,7
anutensil,4vc6v3,"RNC &amp; DNC Showed There Are 2 Teams in America – Choose Wisely Conventions depicted starkly different visions of our nation. In November, we must vote for one of them.",,democrats,t5_2qn70,1469887579,2016,7
dasidog,4vc6xn,"Hillary Clinton, Tim Kaine to make stop in Pittsburgh Saturday at convention center",,politics,t5_2cneq,1469887609,2016,7
WildAnimus,4vc7ds,Bernie Sanders Won’t Rule Out Future Presidential Run,,politics,t5_2cneq,1469887823,2016,7
anutensil,4vc7hx,"Trump &amp; Russia: a web that grows more tangled all the time - Frank Mermoud, a key figure at the recent RNC, has strong business ties with Ukraine – the latest in a series of Trump staffers with worrying links to Russia and its interests, including the candidate himself",,democrats,t5_2qn70,1469887880,2016,7
Kenatius,4vc7id,Tim LaHaye is dead but his apocalyptic fact-free “vision” of an alienated alternative and utterly destructive “reality” lives on in the candidacy of Donald Trump,,politics,t5_2cneq,1469887888,2016,7
yosemite_lives,4vc80r,The Wicked Stepmother theory: Did Trump's Kids Purposely Sabotage Melania Trump's Speech?,,politics,t5_2cneq,1469888133,2016,7
gkuhl3,4vc81h,Ann Coulter Hammered by Conservatives for Smearing US War Hero’s Dad as ‘Angry Muslim’,,politics,t5_2cneq,1469888143,2016,7
lisaksucks,4vc88n,James Cameron's Climate Change Lies At The DNC,,politics,t5_2cneq,1469888243,2016,7
oranjemania,4vc8aa,"Donald Trump's Long, Fruitless Quest for Business in Russia",,politics,t5_2cneq,1469888267,2016,7
SwissT0E,4vc8dv,'They said my son intended to assassinate Donald Trump. And my world just stopped',,politics,t5_2cneq,1469888315,2016,7
Boonzies,4vc8hn,Neuroscientist: Donald Trump's meteoric rise can be explained by 4 basic human instincts,,politics,t5_2cneq,1469888368,2016,7
Mynameis__--__,4vc8j6,There's Plenty Of Time For Trump Or Clinton To Become Likable Enough,,democrats,t5_2qn70,1469888387,2016,7
gordo65,4vc8ll,Trump Accuses Fire Marshall Of Voting Clinton After Restricting Rally Goers,,politics,t5_2cneq,1469888418,2016,7
Funintheass,4vc8yo,Breaking News - IRS launches investigation of Clinton Foundation,,politics,t5_2cneq,1469888578,2016,7
xB0bL0blaw,4vc93u,How To Fix America's Presidential Debates!,,politics,t5_2cneq,1469888646,2016,7
GoldieMMA,4vc9a1,"Dem-owned-crats: Now its congressional committee is hacked (update; presidential campaign team has been hacked, too)",,politics,t5_2cneq,1469888726,2016,7
TheTrollingPakistani,4vc9lk,Jill Stein Continues Pandering to Anti-Vaxxers,,politics,t5_2cneq,1469888875,2016,7
Agedwithaview,4vc9qb,"Mugabe: When Trump Is President, U.S. Will Regret Sanctioning Me",,politics,t5_2cneq,1469888942,2016,7
HillaryShillington,4vc9ra,"“I am committed to make investments to find the causes of autism, including possible environmental causes like vaccines."" - Hillary Clinton",,politics,t5_2cneq,1469888952,2016,7
chinadaze,4vc9zs,Bernie supporters need people of color if they don't want their movement to bust,,politics,t5_2cneq,1469889069,2016,7
Tbone-Jones,4vca1m,Swimsuit mural of Hillary Clinton creates a stir in Australia,,politics,t5_2cneq,1469889092,2016,7
Robert6700,4vcadl,Donald Trump and Russia: a web that grows more tangled all the time,,politics,t5_2cneq,1469889266,2016,7
ruskeeblue,4vcar0,"Ted Cruz Walks Out of Christian Dinner: ""If you will not stand with Israel and the Jews, then I will not stand with you"" - BuzzPo",,uspolitics,t5_2qwlq,1469889439,2016,7
ruskeeblue,4vcb4l,Ted Cruz Booed Off Stage At Middle East Christian Conference [VIDEO],,uspolitics,t5_2qwlq,1469889601,2016,7
guiltyofnothing,4vcb76,"Moody's: Where Trump's Economic Policies Might Spark Recession, Clinton's Could Boost GDP And Lower Unemployment",,politics,t5_2cneq,1469889629,2016,7
anutensil,4vcbe2,Democratic Party’s congressional fundraising committee was also hacked - DCCC's website redirected donors to a fake contribution page controlled by attackers.,,democrats,t5_2qn70,1469889720,2016,7
lostnthot,4vcbg2,"""For six years, the North Carolina state government has dismantled the safeguards for our state’s air, water, land, and coastline to the detriment of North Carolinians.""",,politics,t5_2cneq,1469889742,2016,7
r4816,4vcbq4,Trump and the Oligarch: He claims no ties to Russia. Here’s how he made millions from one of its wealthiest men.,,politics,t5_2cneq,1469889868,2016,7
schadenfr3ud3,4vcbsf,"The grassroots energy of today's Democratic Party lay with Sanders' followers, the far-left wing of his party. They represent by various estimates 40% of the party. Without them, Hillary may have a tough time getting elected.",,politics,t5_2cneq,1469889892,2016,7
TheTrollingPakistani,4vccdl,Jill Stein on vaccines: People have ‘real questions’,,politics,t5_2cneq,1469890122,2016,7
kaskas100,4vcdcs,TRUMP ANNOUNCES HIS DEBATE ESCAPE PLAN.,,politics,t5_2cneq,1469890528,2016,7
Agedwithaview,4vcdcx,Poll: Clinton Has 6 Point Lead Over Trump,,politics,t5_2cneq,1469890529,2016,7
r4816,4vcde3,The return of the Luddite president. Donald Trump and Hillary Clinton would each bring a tech-challenged record to the White House.,,politics,t5_2cneq,1469890544,2016,7
HamsterSandwich,4vcdmt,North Carolina's Deliberate Disenfranchisement of Black Voters,,politics,t5_2cneq,1469890642,2016,7
IsleCook,4vcdni,Courts strike blows to GOP voter restrictions in 3 states,,politics,t5_2cneq,1469890649,2016,7
myellabella,4vce29,"Hillary Bounces Back: In First Post-DNC Survey, Clinton Regains Commanding Lead Over Trump",,politics,t5_2cneq,1469890834,2016,7
galt1776,4vceo6,North Carolina’s Voting Restrictions Struck Down as Racist,,politics,t5_2cneq,1469891089,2016,7
Netram,4vcevx,Meet the big-name Republicans supporting Hillary Clinton,,politics,t5_2cneq,1469891176,2016,7
JimCalinaya,4vceza,"Tired of the ""lesser of two evils"" phenomenon that appears and reappears in american politics? if so, please institute rank voting or approval voting in future elections.",,politics,t5_2cneq,1469891215,2016,7
DragonPup,4vcf3l,Did Donald Trump Just Break the Law and Reveal Classified Intelligence?,,politics,t5_2cneq,1469891258,2016,7
abundanceofcreation,4vcf7l,why Donald Trump is a dangerous candidate.,,politics,t5_2cneq,1469891313,2016,7
r4816,4vcf8k,"The Donald Trump-Roger Ailes Nexus: The G.O.P.’s Convention was like a four-day Fox News fest, full of fearmongering, demagoguery, xenophobia, pandering, and raw anger.",,politics,t5_2cneq,1469891324,2016,7
AStupidHippo,4vcfau,North Korea says Trump is a wise choice for president,,politics,t5_2cneq,1469891347,2016,7
Quiglius,4vcfhy,It's Official: Obama's Presidential Library Will Be In Chicago's Jackson Park,,politics,t5_2cneq,1469891434,2016,7
A4O4,4vcfph,"BREAKING: Hours After First Intelligence Briefing, Trump Likely Leaked CLASSIFIED Secrets",,politics,t5_2cneq,1469891528,2016,7
RandomCanucklehead,4vcfru,Donald Trump talked about then infant daughter Tiffany's future,,politics,t5_2cneq,1469891551,2016,7
[deleted],4vcfxt,Everybody gets a turn in liberal land. Everybody except rebel socialist Bernie Sanders.,,politics,t5_2cneq,1469891619,2016,7
chettinad,4vcg76,"Post DNC, Clinton has opened a significant lead over Republican nominee Donald Trump, now leading him by 15 points.",,politics,t5_2cneq,1469891717,2016,7
LineNoise,4vcgbf,Did Donald Trump Just Break the Law and Reveal Classified Intelligence?,,politics,t5_2cneq,1469891770,2016,7
[deleted],4vcgdu,IRS Launches Investigation Of Clinton Foundation,,politics,t5_2cneq,1469891802,2016,7
