author,id,title,selftext,subreddit,subreddit_id,created_utc,year,month
TinFoilSombrero,4veprw,Judge orders Trump’s South Florida golf course to pay his bills,,politics,t5_2cneq,1469923404,2016,7
TwoGee,4veq4u,It's Unlikely Koch Brothers Asked for Meeting With Trump as He Contends,,politics,t5_2cneq,1469923544,2016,7
MaxMalini,4veqwr,Trump Offers His Most Absurd Defense Yet For Mocking Reporter With Disability,,politics,t5_2cneq,1469923888,2016,7
Iwanttobedelivered,4verim,'We won't bury terrorists' Normandy REFUSES to give Muslim burial to priest killers,,politics,t5_2cneq,1469924146,2016,7
itwch,4verjk,How a simple Facebook chat just became a 1000-strong Jeremy Corbyn festival | The Canary,,politics,t5_2cneq,1469924157,2016,7
Chewwaka,4verkb,Why Clinton Will Win,,politics,t5_2cneq,1469924165,2016,7
DumpsterDon,4verng,NFL Says Donald Trump Is Full Of Shit; League Never Sent Him Letter About Debate Schedule,,politics,t5_2cneq,1469924211,2016,7
Nerdmangamer,4ves6f,Is Facebook hiding a SECRET bias towards Trump? Proof!,,politics,t5_2cneq,1469924455,2016,7
mahparson,4vesib,Trump Wishes Clinton Would Have Congratulated Him In Her DNC Speech,,politics,t5_2cneq,1469924602,2016,7
magenta_placenta,4vesnz,"Government Entitlements—Sixth Biggest Economy On Earth . About 110 million citizens now receive some form of means tested benefits. When social security is included, more than 160 million citizens get checks from Washington. The total cost is now $3 trillion per year and rising rapidly",,politics,t5_2cneq,1469924680,2016,7
mjk1093,4vesow,"Donald Trump consistently rates in the top 5 biggest liars of the 3,390 people and organizations that PolitFact has tracked",,politics,t5_2cneq,1469924691,2016,7
19djafoij02,4vesw0,Donald Trump - stuck in elevator - was rescued by same fire department he blasted,,politics,t5_2cneq,1469924785,2016,7
MisterBadIdea2,4vesw9,The Kochs Will Not Back Trump Or Run Anti-Clinton Ads,,politics,t5_2cneq,1469924788,2016,7
DumpsterDon,4vet6d,Diaper Baby Trump Reacts Predictably To Koch Brothers Snub,,politics,t5_2cneq,1469924920,2016,7
hillary4prizon,4vetbm,IRS launches investigation of Clinton Foundation,,politics,t5_2cneq,1469924986,2016,7
galt1776,4vetex,John McCain's granddaughter endorses Hillary Clinton: 'I've been nursing a grudge',,politics,t5_2cneq,1469925025,2016,7
Nerdmangamer,4vetic,Is Trump a Communist?,,politics,t5_2cneq,1469925069,2016,7
DownWithAssad,4vetm4,Wikileaks Posts and Deletes Anti-Semitic Tweet as it Does Putin’s Bidding For Trump,,politics,t5_2cneq,1469925118,2016,7
Ginger_the_Dog,4vetnx,I want the truth!,,politics,t5_2cneq,1469925138,2016,7
TheTrollingPakistani,4vetqk,Sanders’ Former Press Secretary Says She Experienced Racism On The Trail,,politics,t5_2cneq,1469925169,2016,7
hollywoodhank,4vetw6,NFL Calls Trump Out-of-Bounds: We Never Wrote Him About Debates,,politics,t5_2cneq,1469925232,2016,7
madam1,4vetwg,"Trump Responds To Slain Soldier's Father, Who Appeals To GOP Leaders - ""If you look at his wife, she was standing there,"" Trump said. ""Maybe she wasn't allowed to have anything to say, you tell me.""",,politics,t5_2cneq,1469925236,2016,7
coolcrosby,4vetye,NFL Denies Trump's Claim They Sent Him A Letter Complaining About Debate Schedule,,politics,t5_2cneq,1469925261,2016,7
ExcitingAds,4vetzp,SIMON PARKES 2016 An Afternoon With Simon Parkes Newcastle upon Tyne P1,,politics,t5_2cneq,1469925277,2016,7
Kaiosama,4veug9,Post-convention bump puts Hillary Clinton six points ahead of Donald Trump in new poll,,politics,t5_2cneq,1469925489,2016,7
contantofaz,4veuka,"Don't let the 'aw, shucks' fool you: Tim Kaine is a force for Clinton on campaign trail",,politics,t5_2cneq,1469925536,2016,7
zackj24,4veuyw,I just received my paperwork to volunteer as an Election Day Official. Thank you Bernie for the inspiration to become more involved!,,politics,t5_2cneq,1469925721,2016,7
TheTrollingPakistani,4vev6m,Bernie supporters need people of color if they don't want their movement to bust - Vox,,politics,t5_2cneq,1469925826,2016,7
madam1,4vevf7,"Judge Strikes Down Voting Restrictions In Wisconsin, Calls Them A ‘Wretched Failure' - “To put it bluntly, Wisconsin’s strict version of voter ID law is a cure worse than the disease,” Peterson wrote in his opinion.",,politics,t5_2cneq,1469925923,2016,7
riddock57,4vevqn,US Election: Hillary Clinton Ready to Takeoff,,politics,t5_2cneq,1469926059,2016,7
Zaylyn,4vevrx,Pissed Off At Insider Clinton's Big Speech Paydays? Just Wait 'Til You Learn How Much Trump Is Paid For Appearances,,politics,t5_2cneq,1469926072,2016,7
Kayfabe666,4vevwz,NFL Says Donald Trump is Full of Shit; League Never Sent Him Letter About Debate Schedule,,politics,t5_2cneq,1469926125,2016,7
Arzados,4vevy9,Why I fear a Clinton Presidency,,politics,t5_2cneq,1469926144,2016,7
Kayfabe666,4vewnb,Donald Trump caught in lie about NFL,,politics,t5_2cneq,1469926467,2016,7
Ducreux4U,4vewru,"""While I still feel okay saying Stein is not 'anti-vaccine' I cannot confidently say she is not anti-science and that she does not overly pander to the anti-science and anti-vaccine crowd. A leader needs to stand up against the movement that is killing children, not court their vote.""",,politics,t5_2cneq,1469926517,2016,7
thinkB4WeSpeak,4vewwk,"Despite Objections, Pentagon Takes Step Toward Buying New Nuclear Weapons",,politics,t5_2cneq,1469926578,2016,7
Iwanttobedelivered,4vewzx,GOING VIRAL: 'CLINTON CASH' MOVIE VERSION,,politics,t5_2cneq,1469926614,2016,7
ImWithAmericans,4vexg5,Melania Trump like you’ve never seen her before,,politics,t5_2cneq,1469926813,2016,7
zazzlekdazzle,4vext1,"Trump seems especially mad at Mike Bloomberg, and any New Yorker could tell you why",,politics,t5_2cneq,1469926979,2016,7
awake-at-dawn,4veycy,Donald Trump is mad that he has to compete with the Atlanta Falcons for ratings,,politics,t5_2cneq,1469927218,2016,7
freakincampers,4veyit,Koch brothers network rules out anti-Clinton ads,,politics,t5_2cneq,1469927280,2016,7
freakincampers,4veyl2,Donald Trump Goes After Grieving Mother Of Killed American Soldier,,politics,t5_2cneq,1469927306,2016,7
MolestedConservative,4veyvg,"Why ""white trash"" Americans are Flocking to Donald Trump",,politics,t5_2cneq,1469927431,2016,7
oliverblog,4vez8y,The Democrats’ Republican moment,,politics,t5_2cneq,1469927592,2016,7
CollumMcJingleballs,4vezer,Trump: trying to end new Cold War?,,politics,t5_2cneq,1469927665,2016,7
DumpsterDon,4vezki,Trump Busted For Huge Lie About Helping To Build The Vietnam War Memorial,,politics,t5_2cneq,1469927737,2016,7
blackyellow23,4vezq2,"Trump's Locked Down Reddit AMA Was Part Waste of Time, Part Disaster",,politics,t5_2cneq,1469927809,2016,7
zapichigo,4vezv0,Sherrod Brown Teaches Democrats How to Demolish Trump’s False-Prophet Populism,,politics,t5_2cneq,1469927860,2016,7
guiltyofnothing,4vezw2,"""Interim chair of the Democratic National Committee Donna Brazile said she would impose tougher standards on staff going forward after email leaks showed some party leaders plotted to undermine the insurgent campaign of Sen. Bernie Sanders.""",,politics,t5_2cneq,1469927873,2016,7
newsetma,4vf07u,Chelsea Clinton displays a side of her mother never seen before,,politics,t5_2cneq,1469928004,2016,7
freakincampers,4vf0ey,Donald Trump Goes After Grieving Mother Of Killed American Soldier,,politics,t5_2cneq,1469928090,2016,7
ruskeeblue,4vf0pg,Clinton's support drops 16% among youth in a year: poll,,uspolitics,t5_2qwlq,1469928220,2016,7
readerseven,4vf187,Reports: Trump rescued from elevator ahead of Colorado rally,,politics,t5_2cneq,1469928457,2016,7
Jailout2000,4vf19p,Clinton &amp; Trump - Lying To Get Elected - The David Icke Videocast/Podcast Trailer,,politics,t5_2cneq,1469928477,2016,7
DumpsterDon,4vf1db,Here are the 2016 candidates’ Secret Service code names — and your own,,politics,t5_2cneq,1469928527,2016,7
lajssd,4vf1kk,A Look At Where Bernie Sanders' Movement Goes From Here,,politics,t5_2cneq,1469928621,2016,7
ritchiepage2001,4vf1l6,Media shuns Bernie supporter for Hillary supporter,,politics,t5_2cneq,1469928628,2016,7
ruskeeblue,4vf1su,Does Debbie Wasserman Schultz’s Fall Signal Sea Change in Jewish Influence With Democrats?,,uspolitics,t5_2qwlq,1469928732,2016,7
[deleted],4vf1ur,"The difference between Trump and Brexit is Trade. The British know they need access to the European markets because of exports. Trump is still living in protectionist world, when most customers live outside the United States",,politics,t5_2cneq,1469928756,2016,7
PM_ME_YOUR_TAPEWORMS,4vf1xu,Cover Up - Obama Sex Settlement at Harvard,,politics,t5_2cneq,1469928791,2016,7
ruskeeblue,4vf25w,Poll! Will You be With Bernie If He Chose Progressive Independent Party,,uspolitics,t5_2qwlq,1469928896,2016,7
RIDEO,4vf2he,"Radical Rant: If You Like Legal Marijuana, You Must Vote for Hillary (Sorry)",,politics,t5_2cneq,1469929040,2016,7
DncInvest,4vf2ix,CTRs Hillary bots has taken over R/politics and downvotes all negative Hillary posts. How can we work with the mods to stop trolls on both sides?,,politics,t5_2cneq,1469929057,2016,7
jaeyukgui,4vf2ql,Need to Share News: What We Saw on the Headstones When We Visited Arlington National Cemetery Last Time,,politics,t5_2cneq,1469929152,2016,7
Funintheass,4vf31q,JER - Trump Closes In On Clinton In Polls With Post Convention Bounce,,politics,t5_2cneq,1469929311,2016,7
TheTrollingPakistani,4vf36h,Donald Trump's convention polling bump has already evaporated,,politics,t5_2cneq,1469929367,2016,7
ruskeeblue,4vf3bg,The Numbers Are In From Hillary Clinton's Speech And It Doesn't Look Good For Democrats,,uspolitics,t5_2qwlq,1469929436,2016,7
packawolves,4vf3t5,Bill Clinton and Tim Kaine: Trump lacks empathy for Khans,,politics,t5_2cneq,1469929650,2016,7
scrabbleddie,4vf3v6,Ralph Nader: Hillary's Convention Con,,politics,t5_2cneq,1469929673,2016,7
JennysDad,4vf3w7,Moody's: Clinton economy would create 10 million jobs,,politics,t5_2cneq,1469929688,2016,7
mehboobiub,4vf3zb,Hillary Clinton gains 10 points in first post-convention poll,,politics,t5_2cneq,1469929728,2016,7
geraldinepages,4vf48s,8 Terrible Things About the TPP,,politics,t5_2cneq,1469929844,2016,7
Funintheass,4vf4et,Undercover CIA Will Hurd Pissed at James Comey FBI Director on Hillary C...,,politics,t5_2cneq,1469929922,2016,7
spacemonkeey,4vf4fn,Guccifer 2.0 mum on latest hack of Democrats,,politics,t5_2cneq,1469929932,2016,7
RC1206-Fierfek,4vf4l5,NFL refutes Trump claim that it sent him a letter bashing debate schedule,,politics,t5_2cneq,1469930006,2016,7
CarrollQuigley,4vf4vl,Sen. Dianne Feinstein opposes ballot measure to legalize pot,,politics,t5_2cneq,1469930136,2016,7
sunkaoyate,4vf4wu,"The US government is literally arming the world, and nobody's even talking about it",,politics,t5_2cneq,1469930151,2016,7
Work_Account69,4vf5pc,President Trump's Hair,,politics,t5_2cneq,1469930522,2016,7
Oopsifartedsorry,4vf5q5,NFL Denies Donald Trump's Claim They Sent Him a Letter Regarding Debate Scheduling Conflict,,politics,t5_2cneq,1469930530,2016,7
kstinfo,4vf5zu,Stephen Hawking: Being stinking rich shouldn't be our dream,,politics,t5_2cneq,1469930630,2016,7
JohnDelmont,4vf67n,"My God, She’s Running as Hillary Clinton",,politics,t5_2cneq,1469930724,2016,7
balmergrl,4vf67v,How Democrats plan to rebuild after losing hundreds of seats nationwide,,politics,t5_2cneq,1469930726,2016,7
CornCobbDouglas,4vf6v1,[NSFW] Melania Trump Like You've Never Seen Her Before,,politics,t5_2cneq,1469931039,2016,7
1stLeaf,4vf6xy,"1,000s Turkish forces surround NATO’s Incirlik air base for ‘inspection’ amid rumors of coup attempt",,politics,t5_2cneq,1469931074,2016,7
GaryHartman,4vf74f,"Trump's plan would cause 3.5 million job losses, Moody's says",,politics,t5_2cneq,1469931166,2016,7
OBAMAS_BROTHER,4vf757,"Russia Expert Stephen Cohen: Trump Wants To Stop The New Cold War, But The America Media Just Doesn't Understand",,politics,t5_2cneq,1469931176,2016,7
[deleted],4vf79y,"Coulter: 'If Trump doesn't win, it's over'",,politics,t5_2cneq,1469931234,2016,7
Funintheass,4vf7nb,Bernie Sanders supporter speaks out about decision to back Trump,,politics,t5_2cneq,1469931391,2016,7
ResearchReviewer,4vf7zj,Donald Trump rescued from stalled elevator in Colorado city,,politics,t5_2cneq,1469931549,2016,7
Helpfuluser2,4vf8a2,@DrJillStein As a medical doctor of course I support vaccinations. I have a problem with the FDA being controlled by drug companies.,,politics,t5_2cneq,1469931683,2016,7
ezaspie03,4vf8dv,Charles Koch warns politicians are offering ‘frightening’ answers to improve society,,politics,t5_2cneq,1469931733,2016,7
Alexhasskills,4vf8ly,Donald Trump and RNC Attack Debate Schedule,,politics,t5_2cneq,1469931841,2016,7
mycourage,4vf8ph,Reddit Admins Accused Of Censoring Donald Trump AMA,,politics,t5_2cneq,1469931884,2016,7
DncInvest,4vf8r5,(Old video) Hillary says Us need to secure border physical infrastructure against Mexican immigrants.,,politics,t5_2cneq,1469931907,2016,7
IDUnavailable,4vf8rk,Clinton Image Improves Following Conventions; Leads Trump by 5,,politics,t5_2cneq,1469931911,2016,7
doyoufeelitnow,4vf92e,NFL Denies Sending Donald Trump Letter About Debate Schedule,,politics,t5_2cneq,1469932049,2016,7
Intellectuallygifted,4vf9an,How TV Networks Can Force Trump to Release His Tax Returns,,politics,t5_2cneq,1469932161,2016,7
GaryHartman,4vf9vs,"AG faces sexist, antigay slurs after imposing gun ban - The Boston Globe",,politics,t5_2cneq,1469932441,2016,7
johnnyjohnson12346,4vf9x1,"Hillary, or, stupid-uh-ree?",,politics,t5_2cneq,1469932455,2016,7
DoremusJessup,4vf9yq,Trump Cites Own Sacrifices in Retort to Muslim War Hero Dad,,politics,t5_2cneq,1469932476,2016,7
Warhunt007,4vfaro,Clinton Cash,,politics,t5_2cneq,1469932833,2016,7
[deleted],4vfbvc,Green Party's Jill Stein: People Don't Trust Vaccine Oversight,,politics,t5_2cneq,1469933370,2016,7
GaryHartman,4vfces,"AG faces sexist, antigay slurs after imposing gun ban - The Boston Globe",,politics,t5_2cneq,1469933647,2016,7
helpmeredditimbored,4vfcgp,Trump says NFL complained to him about debate schedule; NFL says it didn't,,politics,t5_2cneq,1469933676,2016,7
trevor5ever,4vfcha,"Trump Responds To Slain Soldier's Father, Who Appeals To GOP Leaders",,democrats,t5_2qn70,1469933682,2016,7
Mushroomer,4vfckw,"Public Policy Polling : ""Support for President: Gary Johnson 6%, Harambe 5%, Jill Stein 2%""",,politics,t5_2cneq,1469933724,2016,7
trevor5ever,4vfcwr,U.S. Navy To Honor Gay Rights Icon Harvey Milk,,democrats,t5_2qn70,1469933873,2016,7
michaelconfoy,4vfczj,"One group Trump donated to benefits fundraisers, not veterans",,democrats,t5_2qn70,1469933906,2016,7
SoulHealer7,4vfdg3,Trump to Khizr Khan: 'I've made a lot of sacrifices',,politics,t5_2cneq,1469934125,2016,7
EnoughTrumpSpam,4vfdga,"Democrats Committed To Climate Action At The DNC, While Republicans Doubled Down On Denial",,politics,t5_2cneq,1469934128,2016,7
trevor5ever,4vfdqa,"Gay Talk Show ""Feast of Fun"" – The Case for President Hillary Clinton",,democrats,t5_2qn70,1469934250,2016,7
londonentertainment,4vfej1,Charles Koch Calls on Donors to Reduce Focus on Politics,,politics,t5_2cneq,1469934659,2016,7
Shitposter123456789,4vfeo6,Muslim Family of Fallen Army Captain Responds to Trump: 'Shame on Him',,politics,t5_2cneq,1469934745,2016,7
alleycatzzz,4vfezj,The Trouble for Hillary,,politics,t5_2cneq,1469934902,2016,7
helpmeredditimbored,4vffbq,"Khizr Kahn is asking the Republican Party to reject Trump: ""Say something, Disassociate with the hijacking of a good, wonderful political party.""",,politics,t5_2cneq,1469935074,2016,7
youdidntreddit,4vfflc,"Trump: ""Mr. Khan, who has never met me, has no right to stand in front of millions of people and claim I have never read the Constitution""",,politics,t5_2cneq,1469935218,2016,7
packawolves,4vfgdg,"He is Void of Decency, He Has a Dark Heart.",,politics,t5_2cneq,1469935630,2016,7
Factrider,4vfgxi,Fact Rider: Has Wikileaks Won Donald Trump The General Election?,,politics,t5_2cneq,1469935929,2016,7
DrJarns,4vfgza,Why didn’t the Democrats even mention the Clinton Foundation?,,politics,t5_2cneq,1469935960,2016,7
cos,4vfh9j,The Path to Prosperity Is Blue,,uspolitics,t5_2qwlq,1469936106,2016,7
zschultz,4vfhbk,NATO commander agrees members should pay up,,politics,t5_2cneq,1469936133,2016,7
I_F_your_mom,4vfhos,John Kasich throwing shade at Donald Trump,,politics,t5_2cneq,1469936321,2016,7
newocean,4vfhyp,"Donald Trump Criticizes Muslim Family of Slain U.S. Soldier, Drawing Ire",,politics,t5_2cneq,1469936449,2016,7
spooed,4vfi3c,"Move Over, Jill Stein: Dead Gorilla Polling 2.5x Higher Than Green Party Nominee",,politics,t5_2cneq,1469936521,2016,7
alleycatzzz,4vfiaa,"The THREE signs someone's lying to you - according to the FBI (Oh, the Irony...)",,politics,t5_2cneq,1469936629,2016,7
michaelconfoy,4vfiiz,"Matt Flegenheimer (Reporter, @nytimes) on Twitter: ""Mark Cuban begins his remarks at Clinton rally by saying hello to Donald Trump...in Russian.""",,democrats,t5_2qn70,1469936747,2016,7
Actuarybrad,4vfisi,"Harry Reid admits to violating election law, but FEC won't prosecute",,politics,t5_2cneq,1469936870,2016,7
Al_2015,4vfjc4,'Shame on Him': Father of Muslim Soldier Killed in Iraq Responds to Trump,,politics,t5_2cneq,1469937118,2016,7
ritchiepage2001,4vfk03,Motörhead - Just 'Cos You've Got The Power Live Full-HD,,politics,t5_2cneq,1469937466,2016,7
oranjemania,4vfk4b,‘The Making of Donald Trump’ reveals how billionaire’s attempt to woo mobster’s daughter ended when he told him he’d ‘pull your balls from your legs’,,politics,t5_2cneq,1469937530,2016,7
Evolve_or_Bye,4vfknw,Hillary Clinton receives millions in hedge fund backing,,politics,t5_2cneq,1469937782,2016,7
USAOne,4vfl2t,Donald Trump had to be rescued from stuck elevator in Colorado,,politics,t5_2cneq,1469937962,2016,7
TonyDiGerolamo,4vfl5z,Hillary Clinton and Her Hawks,,uspolitics,t5_2qwlq,1469938003,2016,7
annajanek,4vfm6e,Putin crushes CNN smartass Fareed Zakaria on Donald Trump and US elections,,politics,t5_2cneq,1469938499,2016,7
michaelconfoy,4vfm7s,"Bill Browder (CEO Hermitage Capital) on Twitter: ""What more needs to be said. Trump/Putin 2016""",,democrats,t5_2qn70,1469938517,2016,7
arslan999pk,4vfn2b,"Mark Cuban endorses Hillary Clinton, calls Donald Trump 'bats--- crazy'",,politics,t5_2cneq,1469938973,2016,7
michaelconfoy,4vfnky,"Daniel Burke (Religion Editor @CNN) on Twitter: """"I didn't feel anything except the pain,"" said Ghazala Khan about Trump's insinuations. -- Let that sink in.""",,democrats,t5_2qn70,1469939248,2016,7
RoomPooper,4vfnkz,"Gary Johnson Would ""Look Seriously At"" Pardoning Ross Ulbricht, Edward Snowden, Chelsea Manning",,politics,t5_2cneq,1469939249,2016,7
Saanvi99,4vfojx,"Billionaire Mark Cuban Endorses Hillary Clinton, Rips Trump",,politics,t5_2cneq,1469939761,2016,7
JBTVSHOW,4vfolv,The Hillary Clinton-Ted Cruz Connection: How they are plotting to take d...,,politics,t5_2cneq,1469939794,2016,7
GaryHartman,4vfouc,The new political divide,,politics,t5_2cneq,1469939924,2016,7
eyefish4fun,4vfowx,Snopes Caught Lying About Lack Of American Flags At Democratic Convention,,politics,t5_2cneq,1469939964,2016,7
michaelconfoy,4vfplr,"Meghan McCain on Twitter: ""I would ask what kind of barbarian would attack the parents of a fallen soldier, but oh yeah it's the same person who attacks POW's.""",,democrats,t5_2qn70,1469940332,2016,7
Thats_so_Bogus,4vfpvv,Had fun making this. :),,politics,t5_2cneq,1469940458,2016,7
TinFoilSombrero,4vfpyz,"A judge has ordered Donald Trump's South Florida golf course to pay nearly $300,000 in attorney's fees to a local paint shop for a lawsuit over unpaid bills.",,politics,t5_2cneq,1469940507,2016,7
JBTVSHOW,4vfq95,Loretta Lynch KNEW Hillary Clinton was GUILTY and James Comey was likely...,,politics,t5_2cneq,1469940656,2016,7
ehtishamjani,4vfr68,Video from all angles of ¿gruesome arrest¿ of black man in Canada,,politics,t5_2cneq,1469941178,2016,7
never-ever-post,4vfr7b,Houston Chronicle endorses Hillary,,politics,t5_2cneq,1469941196,2016,7
michaelconfoy,4vfrsi,"Rick Wilson (GOP Media Consultant) on Twitter: ""If I were the Clinton campaign, I'd have the Khan family sitting front row at the debates.""",,democrats,t5_2qn70,1469941517,2016,7
boyaratti,4vfstw,Trump rescued from stalled elevator,,politics,t5_2cneq,1469942117,2016,7
HillHeartsHuma,4vfsuf,"the media is full of what only can be called ""neo-Mccarthyite charges""... The real Danger is What's Being Done to our Own Political Process",,politics,t5_2cneq,1469942125,2016,7
phrostyphace,4vfsyh,"Obama: ""Hillary Clinton is a LIAR""",,politics,t5_2cneq,1469942174,2016,7
Saanvi99,4vfszk,Oklahoma Watch: Trump surpasses Clinton in Oklahoma fundraising for first time in June,,politics,t5_2cneq,1469942191,2016,7
ravupadh,4vft71,Trump: Clinton's Pennsylvania stop like a 'robber visiting their victim',,politics,t5_2cneq,1469942304,2016,7
[deleted],4vfth4,"No, the Constitution Does Not Bar ‘Religious Tests’ in Immigration Law",,politics,t5_2cneq,1469942454,2016,7
DncInvest,4vftmb,"Online poll, who would you vote for?",,politics,t5_2cneq,1469942535,2016,7
conantheking,4vftuc,Hillary Clinton 'loves' the idea of appointing Obama to Supreme Court,,uspolitics,t5_2qwlq,1469942660,2016,7
RandomCollection,4vftx2,Thomas Frank: When did the Democrats stop being the party of the working class?,,politics,t5_2cneq,1469942704,2016,7
GAforTrump,4vfu0d,"""Trump Campaign Releases Full Transcript of Khizr Khan Answer Ahead of Mr. Trump’s ABC This Week Sunday Interview With George Stephanopoulos”",,politics,t5_2cneq,1469942759,2016,7
packawolves,4vfu92,Today Is a Great Day for Voting Rights,,politics,t5_2cneq,1469942910,2016,7
GarrioValere,4vfuqi,Leaks show DNC asked White House to reward donors with slots on boards and commissions,,politics,t5_2cneq,1469943203,2016,7
Saanvi99,4vfuwn,Los ‘hackers’ del DNC también piratearon la campaña de Clinton,,politics,t5_2cneq,1469943317,2016,7
LindaJoyAdams,4vfvem,Linda Joy Adams: DAILY RECAP ADDED 7/31/16 VIOLATIONS OF CIVIL RIGHTS PAGE 5 -GOVERNMENT CONTRACTS CANNOT BE ENFORCED,,politics,t5_2cneq,1469943639,2016,7
michaelconfoy,4vfvf2,Khizr Khan responds to the latest from Trump: “Typical of a person without a soul”,,democrats,t5_2qn70,1469943646,2016,7
pk666,4vfvwo,PJ O'Rourke says Clinton over Trump.,,politics,t5_2cneq,1469943927,2016,7
Claeyt,4vfw4j,Khan: GOP leaders should repudiate Trump,,politics,t5_2cneq,1469944050,2016,7
DoubleLift,4vfwn5,Khizr Khan responds to the latest from Trump: ‘Typical of a person without a soul’,,politics,t5_2cneq,1469944387,2016,7
ma582,4vfx87,Khizr Khan responds to the latest from Trump: ‘Typical of a person without a soul’,,politics,t5_2cneq,1469944736,2016,7
Bearracuda,4vfy5g,Seven Key Ways Jill Stein Is Not Ralph Nader,,politics,t5_2cneq,1469945305,2016,7
drewiepoodle,4vfy77,Moody's: Hillary Clinton's economy would create 10.4 million jobs in 4 years,,politics,t5_2cneq,1469945340,2016,7
DoubleLift,4vfyko,Muslim Family of Fallen Army Captain Responds to Trump: 'Shame on Him',,politics,t5_2cneq,1469945587,2016,7
jetpackswasyes,4vfytv,Fire crews rescue Trump from elevator during Springs visit,,politics,t5_2cneq,1469945771,2016,7
DoubleLift,4vfzlh,Trump attacks parents of Muslim-American war hero,,politics,t5_2cneq,1469946293,2016,7
trueslicky,4vfzx8,Democrats want reform--but court big money in the meantime,,politics,t5_2cneq,1469946522,2016,7
sjwsruinedreddit,4vg003,"Hillary Clinton, Underdog",,politics,t5_2cneq,1469946579,2016,7
Davidieds2,4vg01x,Assange: 'We have more material related to the Hillary Clinton campaign',,politics,t5_2cneq,1469946618,2016,7
DoubleLift,4vg05l,Backlash for Trump after he lashes out at the Muslim parents of a dead U.S. soldier,,politics,t5_2cneq,1469946682,2016,7
Hetalbot,4vg09q,"“Mr. Khan who has never met me, has no right to stand in front of millions of people and claim I have never read the Constitution.”",,politics,t5_2cneq,1469946768,2016,7
jetpackswasyes,4vg0bc,"Mark Cuban endorses Hillary Clinton, calls Donald Trump 'bats--- crazy'",,politics,t5_2cneq,1469946793,2016,7
macredsmile,4vg0dq,"Julian Assange on the TPP: Secretive Deal Isn’t About Trade, But Corporate Control.",,politics,t5_2cneq,1469946834,2016,7
DrJarns,4vg0t2,"Endorsing Clinton, Mark Cuban calls Trump a 'jagoff'",,politics,t5_2cneq,1469947110,2016,7
brashendeavors,4vg17n,Special Report: The Hillary Clinton Problem,,politics,t5_2cneq,1469947419,2016,7
DoubleLift,4vg1f9,Donald Trump to Khizr Khan: I’ve made sacrifices!,,politics,t5_2cneq,1469947577,2016,7
mello_geek,4vg20m,NFL Denies It Sent Letter to Trump Over Debate Schedule,,politics,t5_2cneq,1469947977,2016,7
michaelconfoy,4vg21m,How And Why Trump Will Try to Ditch the Debates,,democrats,t5_2qn70,1469947995,2016,7
RSCutty,4vg282,Nancy Pelosi keeps sending me fire and brimstone emails. Help!!,,politics,t5_2cneq,1469948104,2016,7
loveyoufu,4vg29q,WOW! Miss Nigeria Beauty Pageant in USA 2016,,politics,t5_2cneq,1469948136,2016,7
brashendeavors,4vg2xw,"DNC Installed White Noise Machines to Drown Out Sanders Supporters, Gave Away Their Seats to DNC Fillers",,politics,t5_2cneq,1469948612,2016,7
hillary4prizon,4vg3f7,"""Republican presidential candidate Donald Trump says he doesn't like going up against NFL games when he debates Democratic opponent Hillary Clinton this fall and that the football league complained to him about the debate schedule in a letter""",,politics,t5_2cneq,1469948931,2016,7
brashendeavors,4vg3gf,White Noise? What White Noise? - Hot Air,,politics,t5_2cneq,1469948953,2016,7
michaelconfoy,4vg3mw,A Few Simple Truths on Immigration: Careful examination of the facts undermines the claims of Donald Trump and his allies.,,democrats,t5_2qn70,1469949070,2016,7
abourne,4vg4a0,U.S. Constitution becomes Amazon best-seller after father's powerful rebuke of Trump,,politics,t5_2cneq,1469949548,2016,7
