author,id,title,selftext,subreddit,subreddit_id,created_utc,year,month
Final_Senator,4v9tqz,Trump: 'No more Mr. Nice Guy’,,politics,t5_2cneq,1469840463,2016,7
GaryHartman,4v9trv,Michelle Obama: Don't Let Anyone Tell You America Isn't Great,,politics,t5_2cneq,1469840476,2016,7
Crazey4wwe,4v9ua4,"oof. messed around with the electoral map based on what I think happens, got A Tie. how much crazier can it get??",,politics,t5_2cneq,1469840697,2016,7
sunkaoyate,4v9uh6,“The Two-Party System Is the Worst Case Scenario” – An Interview With the Green Party’s Jill Stein,,politics,t5_2cneq,1469840785,2016,7
steve42089,4v9uq1,The Empire Strikes Barack #fbf,,politics,t5_2cneq,1469840882,2016,7
NewsNeck,4v9ure,Scars of Ferguson Protests Shape Missouri Governor's Race,,politics,t5_2cneq,1469840898,2016,7
GaryHartman,4v9usn,FULL: General John Allen (ret. USMC) - Democratic National Convention,,politics,t5_2cneq,1469840912,2016,7
areyouforreal2,4v9v0x,Tim Kaine under scrutiny for abortion comment,,politics,t5_2cneq,1469841013,2016,7
madam1,4v9v3g,"North Carolina's Deliberate Disenfranchisement of Black Voters - If the law is not in effect in November, it could have a major impact. McCrory is locked in a tight reelection race against Democrat Roy Cooper. Senator Richard Burr is expected to face a tight battle to hold his seat",,politics,t5_2cneq,1469841044,2016,7
londonentertainment,4v9v5m,Tim Cook reportedly hosting Hillary Clinton fundraiser next month following Paul Ryan event,,politics,t5_2cneq,1469841072,2016,7
bestpint,4v9v73,"Clinton, Kaine kick off battleground bus tour at Pennsylvania rally",,politics,t5_2cneq,1469841092,2016,7
restore_democracy,4v9vd2,Seven Minutes That Shook the Convention,,politics,t5_2cneq,1469841150,2016,7
sjleader,4v9vl2,Trump May Have Just Leaked Classified Info ON HIS FIRST DAY Getting Intelligence Briefings,,politics,t5_2cneq,1469841240,2016,7
rcrevolution13,4v9vyb,Representatives From Ten States Have Endorsed Gary Johnson For President,,politics,t5_2cneq,1469841390,2016,7
Pineapple_Rampage,4v9wny,"Clinton Campaign Computers Are Said to Be Hacked, Apparently by Russians",,politics,t5_2cneq,1469841722,2016,7
BDB_JCD,4v9wt1,Moody's: Clinton economy would create 10 million jobs,,democrats,t5_2qn70,1469841791,2016,7
TotallyLiberal,4v9wvd,Donald Trump Defends Joel After Crowd Man Handles Him For Asking Inappropriate Questions at NC Speech,,politics,t5_2cneq,1469841822,2016,7
coolbern,4v9x17,American psycho: Is Donald Trump clinically deranged?,,politics,t5_2cneq,1469841901,2016,7
exploration_guy,4v9x72,Who Are The Ten Most Honest and Lying American Politicians?,,politics,t5_2cneq,1469841974,2016,7
bomphcheese,4v9xag,Analysis and comparison of words used by Clinton and Trump in major speeches.,,politics,t5_2cneq,1469842008,2016,7
Vrenny,4v9xdk,"Clinton Campaign Computers Are Said to Be Hacked, Apparently by Russians",,politics,t5_2cneq,1469842047,2016,7
BillTowne,4v9xid,The Democrats Win the Summer,,politics,t5_2cneq,1469842109,2016,7
simply_there,4v9xjs,Senate Dems: Cancel recess to deal with Zika 'emergency',,democrats,t5_2qn70,1469842123,2016,7
NewsNeck,4v9xlh,"Democratic National Convention Night 4 early ratings soft compared to 2012, on par with 2016 RNC",,politics,t5_2cneq,1469842140,2016,7
mushimow,4v9xos,The democratic party no longer exists,,politics,t5_2cneq,1469842176,2016,7
[deleted],4v9y37,"Donald Trump's threat to dismantle America's strongest alliance, explained",,politics,t5_2cneq,1469842350,2016,7
NewsNeck,4v9y3p,Computers Hacked at Democrats' House Campaign Committee,,politics,t5_2cneq,1469842360,2016,7
TwoGee,4v9y5b,"Donald Trump's flurry of offhand remarks and abrupt zingers on Russia - praising Vladimir Putin, dismissing NATO - have jolted the world, not to mention the U.S. presidential campaign.",,politics,t5_2cneq,1469842381,2016,7
svanhildastrid,4v9yfq,TV Ratings: Hillary Clinton’s Speech Falls to Trump’s Coronation in DNC Night 4 Final Numbers,,politics,t5_2cneq,1469842517,2016,7
guiltyofnothing,4v9yw8,Sanders delegates fault Bernie for DNC chaos,,politics,t5_2cneq,1469842718,2016,7
[deleted],4v9yys,Inside the Indian Office Building Where 'Trolls' Post On Social Media In Support Of Hillary Clinton,,politics,t5_2cneq,1469842753,2016,7
Thringo,4v9z2k,Hillary Clinton Got the Big Stuff Right in Her DNC Speech — Not That It Will Win Over Any Conservatives,,politics,t5_2cneq,1469842798,2016,7
mattseg,4v9z8a,O'Malley: DNC 'clearly hurt my odds of succeeding',,politics,t5_2cneq,1469842875,2016,7
RIDEO,4va0qi,Trudeau stays polite as Trump rages against NATO and NAFTA,,politics,t5_2cneq,1469843500,2016,7
restore_democracy,4va0ty,"In Tribute to Son, Khizr Khan Offered Citizenship Lesson at Convention",,politics,t5_2cneq,1469843544,2016,7
Tbone-Jones,4va0x0,"David Brooks: Clinton Can Make You ""Warm And Fuzzy"" When You Hear Her",,politics,t5_2cneq,1469843582,2016,7
prime_nommer,4va19s,Revealed: AARP Is Funding ALEC,,politics,t5_2cneq,1469843739,2016,7
mattseg,4va1b7,Feinstein: Hillary Hasn't Had News Conferences Because Questions Are Always About Emails and Benghazi,,politics,t5_2cneq,1469843756,2016,7
areyouforreal2,4va1c5,"Rev. Samuel Rodriguez: Democrats, you have failed Hispanics, too",,politics,t5_2cneq,1469843765,2016,7
TheYearTwentySixteen,4va1td,The Democrats’ Patriotic Night Of Hope,,politics,t5_2cneq,1469843974,2016,7
bfwilley,4va1uv,Venezuela's new decree: Forced farm work for citizens,,politics,t5_2cneq,1469843992,2016,7
mattseg,4va1ym,"North Carolina Voting Restrictions Violate Voters’ Rights, Federal Court Finds",,politics,t5_2cneq,1469844040,2016,7
bfwilley,4va22f,Twitter is Censoring Donald Trump to Block Fundraising Efforts,,politics,t5_2cneq,1469844081,2016,7
CornCobbDouglas,4va292,Poll: Clinton up by 6 nationally,,politics,t5_2cneq,1469844164,2016,7
Mynameis__--__,4va2c8,Hurry Up And Wait,,democrats,t5_2qn70,1469844196,2016,7
wynomite,4va2vl,Donald Trump: STAR Exemption and Tax Returns,,politics,t5_2cneq,1469844404,2016,7
ravupadh,4va3ln,Do we know enough about the candidates' health?,,politics,t5_2cneq,1469844717,2016,7
chocolategirl,4va3s2,They could have picked...,,politics,t5_2cneq,1469844795,2016,7
ruskeeblue,4va3t7,Democrats Erase the Second Amendment From Their Platform,,uspolitics,t5_2qwlq,1469844805,2016,7
RIDEO,4va3u4,We Need To Talk With America Before It's Too Late,,politics,t5_2cneq,1469844817,2016,7
avivi_,4va4e1,How the US can retaliate if Kremlin hackers tried to influence the presidential election,,politics,t5_2cneq,1469845071,2016,7
ruskeeblue,4va4e2,Election Justice USA Study Finds that Without Election Fraud Sanders Would Have Won by Landslide,,uspolitics,t5_2qwlq,1469845071,2016,7
HILLARY_4_TREASON,4va4gm,Media Silent On Bill Clinton Double Rape Bombshell,,politics,t5_2cneq,1469845105,2016,7
Trump_Stumps_All,4va4yg,Hillary Obstructed Boko Haram's Terror Designation as Clinton Allies Cashed In,,politics,t5_2cneq,1469845334,2016,7
Citizen00001,4va531,Steve Guttenberg: What Bill Clinton saw in 'Police Academy',,politics,t5_2cneq,1469845398,2016,7
MankatoSioux,4va5ci,Ricketts calls for resignation amid allegations Sen. Kintner had explicit video on state computer,,politics,t5_2cneq,1469845524,2016,7
areyouforreal2,4va5cm,This Cartoon Captures All You Need To Know About Trump And Clinton In 2016,,politics,t5_2cneq,1469845525,2016,7
nuggets510,4va5ep,Open Letter to Bernie Sanders from Former Campaign Staffers,,politics,t5_2cneq,1469845557,2016,7
desnudopenguino,4va5rm,Politics in the Animal Kingdom,,politics,t5_2cneq,1469845720,2016,7
NewsNeck,4va5s3,The Country’s Worst Anti-Voting Law Was Just Struck Down in North Carolina,,politics,t5_2cneq,1469845725,2016,7
idlevalley,4va5vj,Anybody else seeing uncomfortable parallels to the 1962 Manchurian Candidate? Except nobody had to hypnotize Trump.,,politics,t5_2cneq,1469845762,2016,7
MrGrassroots,4va5x3,North Carolina 'voter restriction law' struck down as being 'discriminatory',,politics,t5_2cneq,1469845779,2016,7
MolestedConservative,4va60r,President Trump could be Putin Appeaser,,politics,t5_2cneq,1469845825,2016,7
19djafoij02,4va645,The Kremlin don’t have much confidence in Trump keeping any of his promises on Russia.,,politics,t5_2cneq,1469845861,2016,7
ravupadh,4va67s,Trump set to break GOP's record in winning LGBTQ vote,,politics,t5_2cneq,1469845913,2016,7
GaryHartman,4va6bi,Shonda Rhimes And Morgan Freeman Help Share Hillary Clinton's Inspiring Story,,politics,t5_2cneq,1469845955,2016,7
inexorabledonger,4va6i6,Donald Trump Just Came Out In Support Of Legal Marijuana,,politics,t5_2cneq,1469846039,2016,7
michaelconfoy,4va6xk,"Seven Minutes That Shook the Convention: How the father of slain Muslim soldier shamed Donald Trump, upstaged Hillary Clinton—and did it without notes.",,democrats,t5_2qn70,1469846209,2016,7
misterpantsz,4va73u,Mike Pence: Trump campaign to discuss lifting media blacklist,,politics,t5_2cneq,1469846277,2016,7
thematterasserted,4va74c,New evidence confirms what gun rights advocates have said for a long time about crime,,politics,t5_2cneq,1469846283,2016,7
cl33t,4va755,How Donald Trump Made the U.S. a Target For Russia’s New Brand Of Warfare,,politics,t5_2cneq,1469846293,2016,7
ruskeeblue,4va7mi,Libertarian candidate Gary Johnson: A vote for Clinton or Trump is wasted,,uspolitics,t5_2qwlq,1469846501,2016,7
benyadams,4va7y8,Trump to Clinton: 'No more Mr. Nice Guy',,politics,t5_2cneq,1469846630,2016,7
Vega62a,4va8ea,Moody's: Hillary Clinton's economic plans would create 10 million jobs. Trump's would lose 3.4 million,,politics,t5_2cneq,1469846820,2016,7
danielpetty,4va8xz,Former Illinois governor Rod Blagojevich has started a rock band in Colorado prison,,politics,t5_2cneq,1469847044,2016,7
SsutSsut,4va91m,The Condescending Media,,politics,t5_2cneq,1469847093,2016,7
ironwkr1,4va9m9,Estonia-1. Trump-0,,politics,t5_2cneq,1469847342,2016,7
BernBro4Hillary,4va9so,Billionaire Michael Bloomberg Tames the Bernie Bros at DNC 2016,,politics,t5_2cneq,1469847421,2016,7
seshfan,4va9uc,Paul Manafort explains to Chris Matthews why women will vote for Trump: “Their husbands can’t afford to be paying for the family bills”,,politics,t5_2cneq,1469847438,2016,7
AllHailKingJeb,4vaafs,"Gary Johnson: “I asked her to marry me while we were on a chair lift at Taos. At one point, early in our time together, Kate asked me about my politics and political philosophy. What it was, how I'd come to it. I gave her a copy of ""Atlas Shrugged.""”",,politics,t5_2cneq,1469847694,2016,7
hillary4prizon,4vaam1,DA: Stockton Mayor’s Stolen Gun Used in Murder of 13-year-old,,politics,t5_2cneq,1469847773,2016,7
mattseg,4vab5u,It sure as hell seems like WWE’s Glenn “Kane” Jacobs is going to run for office,,politics,t5_2cneq,1469847994,2016,7
modurhead,4vabc2,The Worst Person in Tennessee: Jeremy Durham | Full Frontal with Samanth...,,politics,t5_2cneq,1469848064,2016,7
guiltyofnothing,4vabf2,Donald Trump went after a fire marshall at his Colorado Springs event on Friday afternoon and suggested he was a Clinton supporter because he wouldn’t let more people into the venue,,politics,t5_2cneq,1469848102,2016,7
hotrodfantasy,4vabhw,"Clinton to ‘Reset’ Syria War, Focus on Ousting Assad -- News from Antiwar.com",,politics,t5_2cneq,1469848129,2016,7
cyrjumper,4vabif,"Best 'clicker' games on iOS, Android: explore dank memes, US politics, and capitalism's basic rights",,uspolitics,t5_2qwlq,1469848138,2016,7
edmondsonkoger,4vabrw,Russia wouldn't be the first country to meddle in US politics — here are 4 other times it's happened,,uspolitics,t5_2qwlq,1469848250,2016,7
wynomite,4vabs7,"In Tribute to Son, Khizr Khan Offered Citizenship Lesson at Convention",,politics,t5_2cneq,1469848253,2016,7
Samdi,4vabso,Bill Clinton looking rather ill during Hillary speech applause,,politics,t5_2cneq,1469848260,2016,7
TimmyMcRumbleButt,4vac2j,Keep in mind that much Pro-Hillary discussion is 'Stealth marketing' AKA shilling,,politics,t5_2cneq,1469848383,2016,7
mikeright25,4vaci6,Bernie Sanders may run green party ticket.,,politics,t5_2cneq,1469848581,2016,7
whooooooooo0oooooosh,4vaco2,Fear and hope in Philadelphia: Some of city’s Muslims see election as ‘life-or-death situation’,,politics,t5_2cneq,1469848660,2016,7
Zombi_Sagan,4vacx5,6 Times Hillary Clinton Took Great Risks To Do The Right Thing For LGBTQ,,politics,t5_2cneq,1469848775,2016,7
NewsNeck,4vaduf,Sherrod Brown Teaches Democrats How to Demolish Trump’s False-Prophet Populism,,politics,t5_2cneq,1469849189,2016,7
Simi510,4vadw7,Slain soldier’s dad: GOP should call out Trump,,politics,t5_2cneq,1469849216,2016,7
TehDonald,4vae8n,Gary Johnson’s VP: We’d be looking to appoint Supreme Court justices like Stephen Breyer and Merrick Garland - Hot Air,,republicans,t5_2r4xl,1469849390,2016,7
LordPennyfarthington,4vae9x,Jill Stein: Green Party is 'not some irrelevant footnote',,politics,t5_2cneq,1469849408,2016,7
michaelconfoy,4vaf2j,"Clinton Campaign Computers Are Said to Be Hacked, Apparently by Russians: Clinton Campaign Computers Are Said to Be Hacked, Apparently by Russians: A federal law enforcement official said the intrusion appeared to have come from that country’s intelligence services.",,democrats,t5_2qn70,1469849738,2016,7
PARK_THE_BUS,4vaf7c,Computer systems used by Hillary Clinton’s presidential campaign were hacked in an attack that appears to have come from Russia’s intelligence services,,politics,t5_2cneq,1469849787,2016,7
LDHegemon,4vaf7g,"""Overcoming Adversity, Refusing to Let Us Be Defined by Our Base Fears Rather Than Our Ambitions — These Are The Things, Biden Argues, That Truly Make America Great.""",,politics,t5_2cneq,1469849789,2016,7
Trumfkortet,4vag3q,Hackers post anti-Hillary Clinton messages to University City’s Twitter account,,politics,t5_2cneq,1469850187,2016,7
backpackwayne,4vagrv,Next step: The Debates - Dates announced,,democrats,t5_2qn70,1469850495,2016,7
Mynameis__--__,4vah0s,The Fundamental Choice In This Election Is Between Trump’s “I” And Hillary’s “We.”,,democrats,t5_2qn70,1469850609,2016,7
Kurapika1102,4vahp3,Reality will catch up with Hillary Clinton - Reince Priebus,,politics,t5_2cneq,1469850909,2016,7
TheSubtleSaiyan,4vai03,"How much damage could Donald Trump really do, after all?",,politics,t5_2cneq,1469851048,2016,7
seblog10,4vaipk,Russian Spies Said to Hack Systems Used in Clinton’s Run,,politics,t5_2cneq,1469851349,2016,7
michaelconfoy,4vaizz,Watch: #KhizrKhan asks Mitch McConnell and Paul Ryan to repudiate Trump.,,democrats,t5_2qn70,1469851466,2016,7
LordPennyfarthington,4vaj2y,Why women shouldn’t vote for Hillary Clinton,,politics,t5_2cneq,1469851500,2016,7
Kurapika1102,4vajnd,Special Report - Dems worried Clinton not pulling ahead of Trump,,politics,t5_2cneq,1469851756,2016,7
zs3397,4vajr3,Is Trump trying to get out of the debate?,,politics,t5_2cneq,1469851796,2016,7
[deleted],4vajuv,Donald Trump discusses Putin relationship in 2013,,politics,t5_2cneq,1469851844,2016,7
DoremusJessup,4vak3f,"Kansas must count potentially thousands of votes in state and local races from people who've registered without providing citizenship documents, a county judged ruled on Friday",,politics,t5_2cneq,1469851956,2016,7
finalin,4vakwf,"It is possible that Hillary will lose because of this fervent anti-establishment sentiment throughout America. She is, after all, pure establishment.",,politics,t5_2cneq,1469852371,2016,7
coffee_dude08,4val19,"Trump Could Win Pennsylvania, May Not Debate, Rendell Says",,politics,t5_2cneq,1469852430,2016,7
Funintheass,4valaz,"The Kelly File - Full July 29, 2016; DNC Speeches, Trump Attacks &amp; Gener...",,politics,t5_2cneq,1469852558,2016,7
Pudgebrownies7,4valng,Sanders: Trump doesn't understand the Constitution,,politics,t5_2cneq,1469852737,2016,7
[deleted],4vamgw,The mood of the country's emerging electorate is NOT conservative. I have decided to pivot.,,politics,t5_2cneq,1469853157,2016,7
loki8481,4vamn1,Trump accuses Clinton of rigging debate schedule,,politics,t5_2cneq,1469853235,2016,7
michaelconfoy,4vamry,"Despite denial, Trump's connections to Russia go back years",,democrats,t5_2qn70,1469853308,2016,7
ehtishamjani,4van3h,Trump says he wishes Ivanka didn't like Chelsea,,politics,t5_2cneq,1469853490,2016,7
Funintheass,4van3z,"Fox News On the Record - Full July 29, 2016;",,politics,t5_2cneq,1469853498,2016,7
PensivePropagandist,4van9i,Debbie Wasserman Schultz Opponent Tim Canova Calls for Debate,,politics,t5_2cneq,1469853577,2016,7
DrJarns,4vane0,FBI gives thousands of Clinton documents to State,,politics,t5_2cneq,1469853642,2016,7
scarlyle1,4vao33,Liberals Put Corporate Democrats On Blast Over Trans-Pacific Partnership,,politics,t5_2cneq,1469853993,2016,7
ArkansasProject,4vao66,New on TAP: Taxpayers Shouldn’t Celebrate Back-To-School Sales Tax Holiday,,politics,t5_2cneq,1469854035,2016,7
thegarbagebag,4vaodd,Socialism makes people selfish,,politics,t5_2cneq,1469854130,2016,7
KatiePuss,4vaoir,2016 general election debate schedule,,politics,t5_2cneq,1469854217,2016,7
DrJarns,4vaopi,Hacked! Clinton Campaign Admits Campaign Data Compromised,,politics,t5_2cneq,1469854324,2016,7
Schaariaol,4vap1d,"Mike Pence Has First Run-In With Protesters in Lima, Ohio",,politics,t5_2cneq,1469854501,2016,7
DrJarns,4vap20,Mitt Romney Thinks Donald Trump Could Win The Election,,politics,t5_2cneq,1469854510,2016,7
PensivePropagandist,4vap8i,Jill Stein: The Answer To TrumpNeo-Fascism Is Stopping Neo-Liberalism,,politics,t5_2cneq,1469854610,2016,7
Colorado688,4vaq02,Police fatality report: Car accidents among top cause of death,,politics,t5_2cneq,1469855003,2016,7
Robert6700,4vaqgk,Trump Accuses Hillary Of Rigging Debate Schedule That’s Been Set Since September,,politics,t5_2cneq,1469855209,2016,7
lilac2481,4vaqod,"Unnerved by Donald Trump, European Diplomats Seek Reassurance From Democrats",,politics,t5_2cneq,1469855334,2016,7
Nfgiven,4vaqub,Is Hillary Healthy Enough to Lead?,,politics,t5_2cneq,1469855433,2016,7
ThisIsItYall,4var26,"DNC emails reveal growing anxiety over former Bernie Sanders supporters turning to Jill Stein: ""We can't let this happen, push the Homeopathy angle""",,politics,t5_2cneq,1469855540,2016,7
MrGrassroots,4var6z,#MothersOfTheMovement give moving speeches,,politics,t5_2cneq,1469855615,2016,7
ruskeeblue,4var93,NJ township urges investigation of haredi 'blockbusting',,uspolitics,t5_2qwlq,1469855642,2016,7
ohhaiialex,4varpd,DNC Wikileaks Email Hack Confirms CNN is in Bed With The Democratic Party,,politics,t5_2cneq,1469855878,2016,7
ruskeeblue,4vart8,Report: Bill Clinton May Have Encouraged Donald Trump to Run for Presi,,uspolitics,t5_2qwlq,1469855931,2016,7
jimrosenz,4varx4,Donald Trump speaks to the gut – and progressives need to do the same,,politics,t5_2cneq,1469855992,2016,7
Davidmayn,4varyc,Bill Maher Tears Into Cornel West For His Refusal to Support Hillary Clinton,,politics,t5_2cneq,1469856011,2016,7
michaelconfoy,4vas78,Why we need a President Clinton: A Trump White house would open doors to more of the world’s Putin-like authoritarians.,,democrats,t5_2qn70,1469856168,2016,7
Plymouth03,4vasdx,DemExit: Bernie Sanders Supporters Opt to Vote for Green Party’s Jill Stein,,politics,t5_2cneq,1469856270,2016,7
[deleted],4vasid,U.S. Green Party leader: Clinton doesn’t care about Palestinian human rights,,politics,t5_2cneq,1469856333,2016,7
PadmanJack,4vastk,"White Cop, Black Suspect. Does it really matter?",,politics,t5_2cneq,1469856497,2016,7
Adnankhkattak1,4vat0p,What will Obama do after the presidency?,,politics,t5_2cneq,1469856616,2016,7
Tbone-Jones,4vat8q,Hillary’s With Us…If You’re A Clinton Foundation Donor (Russia Edition),,politics,t5_2cneq,1469856752,2016,7
GonzoNation,4vatgc,"Kean laughs off Trump gaffe, but not threat of cyberattacks",,politics,t5_2cneq,1469856872,2016,7
yourmomlikesanal,4vatxy,Hillary’s With Us…If You Want A Destabilized World (Libya Edition),,politics,t5_2cneq,1469857147,2016,7
Aeon_Prime,4vatyd,Putin crushes CNN smartass Fareed Zakaria on Donald Trump and US elections,,politics,t5_2cneq,1469857152,2016,7
yourmomlikesanal,4vatzd,Hillary’s With Us…If You Want A Destabilized World (ISIS Edition),,politics,t5_2cneq,1469857166,2016,7
yourmomlikesanal,4vau0t,Hillary’s With Us…If You Break The Rules (Lying Edition),,politics,t5_2cneq,1469857186,2016,7
yourmomlikesanal,4vau29,Hillary’s With Us…If You’re Part Of The Status Quo (Rigged System Edition),,politics,t5_2cneq,1469857204,2016,7
yourmomlikesanal,4vau3e,Hillary’s With Us…If You’re A Clinton Foundation Donor (Human Rights Abuse Edition),,politics,t5_2cneq,1469857223,2016,7
yourmomlikesanal,4vau4j,​Hillary’s With Us…If You Sell Out American Workers (Bad Trade Deals Edition),,politics,t5_2cneq,1469857242,2016,7
yourmomlikesanal,4vau5s,Hillary’s With Us…If You’re A Clinton Foundation Donor (UBS Edition),,politics,t5_2cneq,1469857261,2016,7
yourmomlikesanal,4vau6w,​Hillary’s With Us…If You're Part Of The Status Quo (Broken VA Edition),,politics,t5_2cneq,1469857278,2016,7
heartakabeat,4vau7i,Hillary Gave Dnc Speech On Her Historic Nomination As First Woman For The Potus,,politics,t5_2cneq,1469857289,2016,7
Davidmayn,4vaugn,Maher: Clinton Should Become the Supervillain Conservatives Say She Is — ‘The Notorious H.R.C’,,politics,t5_2cneq,1469857431,2016,7
ThisIsItYall,4vauq7,Here's Why the (((Globalists))) Fear Trump,,politics,t5_2cneq,1469857575,2016,7
yourmomlikesanal,4vauwh,Hillary’s With Us…If You Want A Destabilized World (Open Borders Edition),,politics,t5_2cneq,1469857662,2016,7
yourmomlikesanal,4vauyq,​Hillary’s With Us…If You’re Part Of The Status Quo (Lobbying Edition),,politics,t5_2cneq,1469857708,2016,7
brashendeavors,4vav50,"Truth About Deception: What is the Difference Between a Sociopath, a Compulsive, a Pathological, a Chronic, and a Habitual Liar?",,politics,t5_2cneq,1469857805,2016,7
ciethrenn,4vav6m,Voting for Trump to prevent Clinton from office is like slitting your throat instead of your wrists. Voting for Gary is fighting to live,,politics,t5_2cneq,1469857831,2016,7
conuly,4vavbe,Courts deal setbacks to GOP voting restrictions in 3 states,,democrats,t5_2qn70,1469857911,2016,7
ThisIsItYall,4vavx4,MSM Ignore Day Four of Democratic National Convention Protests,,politics,t5_2cneq,1469858275,2016,7
vipartem,4vaw9p,"Erdogan to US general: It’s none of your business, who you are?",,politics,t5_2cneq,1469858484,2016,7
ciethrenn,4vawd0,Gary Johnson knows EXACTLY How to Hit Trump Where it Hurts,,politics,t5_2cneq,1469858540,2016,7
izzypop112,4vawsh,Debbie Wasserman Schultz Says She 'Took One for the Team' by Resigning,,politics,t5_2cneq,1469858750,2016,7
ciethrenn,4vawtu,The Nightly Show - Gary Johnson,,politics,t5_2cneq,1469858771,2016,7
bluefoot3,4vax1a,Khizr Khan makes Emotional Appeal To Mitch McConnell and Paul Ryan to Repudiate Donald Trump,,politics,t5_2cneq,1469858892,2016,7
Aeon_Prime,4vaxsu,Putin crushes CNN smartass Fareed Zakaria on Donald Trump and US elections,,politics,t5_2cneq,1469859356,2016,7
NewsNeck,4vaxum,Trump Says He Will No Longer Be Nice to Hillary Clinton,,politics,t5_2cneq,1469859382,2016,7
BlankVerse,4vaxx5,Why Democrats are calling gun violence a 'public health crisis',,democrats,t5_2qn70,1469859419,2016,7
michaelconfoy,4vaxxu,Who Loves America? -- Republicans’ flag-waving has nothing to do with patriotism.,,democrats,t5_2qn70,1469859431,2016,7
avivi_,4vayc6,Ukraine: Journalist's murder is the latest in a long line of violent attacks,,politics,t5_2cneq,1469859667,2016,7
pressbrief24x7,4vayc7,Rahul Gandhi to interact with Congress workers in Lucknow,,politics,t5_2cneq,1469859668,2016,7
morgoon,4vaykl,Why did hillary waive this requirement?,,politics,t5_2cneq,1469859826,2016,7
hintong,4vaylv,In protest DNC delegates walkout of the DNC Convention,,politics,t5_2cneq,1469859850,2016,7
Adnankhkattak1,4vaz70,Chelsea Clinton embraces role in her mother's campaign,,politics,t5_2cneq,1469860213,2016,7
ProductofUnreality,4vaz7u,"Trump talks Clinton, fracking, marijuana",,politics,t5_2cneq,1469860224,2016,7
[deleted],4vazao,Catastrophic Growth Numbers Undermine Clinton's Convention Speech Demanding Status Quo,,politics,t5_2cneq,1469860269,2016,7
Visionary_1,4vazfi,Bill Clinton - The Woman I know - Full Speech DNC 2016,,politics,t5_2cneq,1469860345,2016,7
62FenderJazz,4vazi0,Republican-authored voting laws in Wisconsin and Kansas overturned,,politics,t5_2cneq,1469860382,2016,7
drew418,4vb06o,Trump picks up unlikely ratings victory over Hillary,,politics,t5_2cneq,1469860834,2016,7
kaskas100,4vb0nh,Fox News Contributor Savaged On Twitter After Scolding Hillary For Not Wearing Flag Pin,,politics,t5_2cneq,1469861155,2016,7
SmallHandsThinSkin,4vb0pu,"New Mexico’s former top cop endorses Gary Johnson; Republican Darren White, the state’s former top cop and ex-sheriff of Bernalillo County, is supporting Libertarian Gary Johnson for president – 17 years after he abruptly left Johnson’s administration because of differences over drug legalization.",,politics,t5_2cneq,1469861193,2016,7
Idaho542,4vb17b,Appeals court refuses to toss charges against Sen. Menendez,,politics,t5_2cneq,1469861475,2016,7
Davide546,4vb17y,"White House invites Trump, Clinton reps for transition meetings",,politics,t5_2cneq,1469861486,2016,7
smokinbluebear,4vb1hh,DNC 2016: Bill Clinton's ‘love story’ speech missed out all of his sex scandals,,politics,t5_2cneq,1469861654,2016,7
Daniela2457,4vb1nx,Clinton Campaign Says Hackers Accessed Data Program It Used,,politics,t5_2cneq,1469861775,2016,7
Wargala,4vb1qe,"Evidence Clinton Foundation “Paid Off” Voting Machine Companies, STOLE PRIMARY",,politics,t5_2cneq,1469861808,2016,7
NewsAroundTheWorld,4vb23e,CIA Director Expresses Pessimism on Syria,,politics,t5_2cneq,1469862045,2016,7
randomdream,4vb2bv,The sadness on Bernie's face during Hillary's DNC Speech says it all,,politics,t5_2cneq,1469862182,2016,7
