author,id,body,subreddit,subreddit_id,created_utc,score,year,month,sentiment
trevor5ever,d47nemm,"If his only statement was ""**** you"" then why would he drive two hours out of his way to make it? There's no shortage of straight clubs in the area. 

Why would his father say that he had a particular hatred toward the LGBT individuals? 

Why would his coworkers say the same?

This guy's motivation was homophobia. Plane and simple. The ISIS rhetoric was just a convenient home for his underlying hatred.

You know who uses similar rhetoric regarding the LGBT community? The religious conservative right wing.",Liberal,t5_2qxt5,2016-06-13 18:42:53,-2,2016,6,-0.8823
Bartman383,db3lq28,"Atlas: rock solid, very adaptable with different leg lengths and pad/spike feet.  Great if you throw your rifle around a lot and want bombproof bipod. Expensive though.

Harris: Good for everything else.  Not as adaptable as the Altas, but still a quality product that will get the job done for a third of the price.",guns,t5_2qhc8,2016-12-12 15:17:33,14,2016,12,0.6059
deathbychocolate1,dbs7hmj,I've purposely delayed the annulment so that he has a harder time getting the waiver. It limits his options.,immigration,t5_2qvj0,2016-12-30 04:00:22,1,2016,12,-0.2263
BalanceCoil,d8499l8,Yes he was there second row I think. He went on Fox after and got majorly  stumped by a guy that knew what he was talking about. ,The_Donald,t5_38unr,2016-09-27 16:17:29,2,2016,9,-0.4019
shadowmountain1776,d7ooq77,Man that was absolutely awesome.,Libertarian,t5_2qh63,2016-09-16 01:51:40,6,2016,9,0.659
Vayate,5fxrpg,Magazine behind UVA rape hoax begs Obama to do something about fake news ,The_Donald,t5_38unr,2016-12-01 17:16:29,73,2016,12,-0.872
numrakhan,519zgt,WOMEN Please Take This Serious! Because These Are The Earliest Signs Of Breast Cancer ,healthcare,t5_2qkih,2016-09-05 15:44:27,1,2016,9,0.5707
yo2sense,cyy4vyh,"Oh look, now you have the chance to explain exactly how /u/gordo65 misrepresented the President's statements. 

No doubt he joins me in waiting with bated breath. ",AmericanPolitics,t5_2qied,2016-01-14 17:53:14,1,2016,1,-0.4019
yourmeds24x7,5i32el,Feeling Run down due to Pain use Soma 350mg ,healthcare,t5_2qkih,2016-12-13 11:19:41,1,2016,12,-0.4215
ap76,4b43ev,Biden on election year supreme court nominations. ,Republican,t5_2qndt,2016-03-19 18:07:53,1,2016,3,0.5574
Kielm,d4azpwb,"Very useful information on suicide rates - insightful and speaks volumes about cultural differences. 


&amp;nbsp;


Regarding violent crime: The UK and the US have *vastly* different definitions. Briefly:

UK:
&gt;*“Violent crime contains a wide range of offences, from minor assaults such as pushing and shoving that result in no physical harm through to serious incidents of wounding and murder. Around a half of violent incidents identified by both BCS and police statistics involve no injury to the victim.”",guncontrol,t5_2rdus,2016-06-16 01:01:54,1,2016,6,0.9896
madmac100,40aq85,"question about ted Williams model 200 12 gauge will this kit for a Winchester model 1200 fit on my ted Williams model 200

 http://www.amazon.com/Ultimate-Arms-Gear-Winchester-Stock/dp/B00X2WZGFW/ref=sr_1_2?ie=UTF8&amp;qid=1452418356&amp;sr=8-2&amp;keywords=winchester+1200+kits",guns,t5_2qhc8,2016-01-10 09:46:21,1,2016,1,-0.3612
nukedukem86,4n786c,TOP KEK ,The_Donald,t5_38unr,2016-06-08 20:39:49,56,2016,6,0.2023
cvillemade,d0y0p9a,Wow...,democrats,t5_2qn70,2016-03-13 07:10:14,2,2016,3,0.0
AflacHobo1,d0kf1f5,"Yep. I think of it like sports. If you're into a certain sports league, NFL for example, you could probably name 100 or so players, their positions and feats. Politicians become the same thing if you're into that. ",democrats,t5_2qn70,2016-03-02 06:00:10,3,2016,3,0.7003
gometrule,d17i5ga,"How? He is saying that people in states he won should feel compelled to vote for him, rather than vote for who they believe the stronger candidate is. Then he says that the people in states Hillary has won should consider voting for him if they think he's the stronger candidate. It's pretty clearly contradictory. 

And people's motivations are pretty straightforward here. He said something that's contradictory. They're calling him out for it. Not everything is a conspiracy.

And just because he said somethi",politics,t5_2cneq,2016-03-21 04:01:53,1,2016,3,-0.9632
wiseprogressivethink,3ztgd4,Vice President Joe Biden Regrets Not Running For President 'Every Day' ,AmericanPolitics,t5_2qied,2016-01-07 02:56:22,0,2016,1,0.3612
atl2ptown,d3s9ogq,"83%????!

This isn't r/politics",Economics,t5_2qh1s,2016-06-01 21:21:39,4,2016,6,-0.0
madtowneast,cz7130n,"I know getting the long form birth certificate is more work and more expensive. I don't think you want to play bureaucratic ping-pong though. 

Put yourself in the mind of someone trying to assess whether you are a US citizen. You need to show them that your is your mother, she is the same person as in the other documents, and she is a US citizen. The short form birth certificate will tell them you were born in some city in Canada, on some day, and your name. How will telling him/her that you were born on s",immigration,t5_2qvj0,2016-01-21 22:01:05,1,2016,1,-0.291
FF00A7,cz7ctwt,I liked it very much. His next book on population is awesome too.,environment,t5_2qh1n,2016-01-22 03:14:08,1,2016,1,0.7845
NewAlexandria,d4fnylq,it gave you the drug cancer trial cartel jimmies or shink-stopped them??,healthcare,t5_2qkih,2016-06-19 19:23:24,1,2016,6,-0.6966
MarkTube,54dih0,"Can I buy an island or atoll from the French Polynesia or Pitcairn Islands and try to make it my country? Would it be possible to buy an island or atoll from the French Polynesia or Pitcairn Islands, and this island will be pretty far from other islands and try to make it my country? Maybe there are other islands from other countries in the Pacific which might make this possible. If you have any ideas let me know! Thanks!",PoliticalDiscussion,t5_2sfmf,2016-09-25 03:22:58,39,2016,9,0.7932
Underoath2981,5h3kkq,Four myths about the supposed oil and gas bonanza in the Arctic ,environment,t5_2qh1n,2016-12-08 00:02:46,6,2016,12,-0.0
alvinwirtz,4c2a9a,Best Map to Understand the Democratic Primary ,democrats,t5_2qn70,2016-03-26 18:35:34,1,2016,3,-0.6369
DonManuel,4axbmu,NPT (Non-Proliferation Treaty) and Nuclear Security Risks' Exposed by Secret Plutonium Shipment: NGOs ,environment,t5_2qh1n,2016-03-18 07:34:12,9,2016,3,-0.0
Ziapolitics,d1hsgz4,Bernie Sanders did the same thing...,democrats,t5_2qn70,2016-03-29 15:52:41,0,2016,3,0.0
heterosapian,cyo2opo,"To play devils advocate, many ""rights"" are simply privileges we give to non-criminals. If someone commits  armed robbery I'm not sure I'm comfortable letting them keep all the guns they purchased prior to being a criminal - though I don't expect this to sway their recidivism or access to a gun one way or another. It's doesn't mean there shouldn't be a law in the first place though - the lack of voting almost certainly doesn't sway any potential felons away from committing crime but it's punishment for not p",Republican,t5_2qndt,2016-01-06 15:18:30,1,2016,1,-0.8892
JoeIsHereBSU,4bm9xj,Import of Assault Weapons Ban 2016 - HR4748 - (Bill Breakdown Video) ,Firearms,t5_2ryez,2016-03-23 12:38:05,44,2016,3,-0.8834
Deltervees,cz37y5y,"What time will they be, and what site can I see them on?",guns,t5_2qhc8,2016-01-18 22:22:17,2,2016,1,-0.0
billywarren1,d4tb2vs,"The mainstream media decided that since they were so successful in declaring the winner of the California Democratic primary this year - before the voting began... They might just try declaring the winner of this November's election prior to nominating the candidates...

I'm not falling for it... Bernie or Bust!",AmericanPolitics,t5_2qied,2016-06-29 23:51:17,0,2016,6,-0.9349
Murder_Boners,d4ei84t,"This isn't a compromise at all. 

Why the hell would you think progun nut jobs would be pissed off by that? Or am I just underestimating how stupid, short sighted and indoctrinated every knuckle dragging 2nd Amendment fetishizing gun humper has become? 

Because the bulk of your idea is actually removing what few gun control laws we have. ",guncontrol,t5_2rdus,2016-06-18 18:12:16,3,2016,6,-0.9569
njmaverick,d46i3wb,The GOP should be impeached for allowing the terrorist easy access to weapons of mass destruction,politics,t5_2cneq,2016-06-12 21:40:52,5,2016,6,-0.8555
michaelconfoy,d438ddn,Indeed. There will be no chance of Sanders' vision of the future if Trump wins.,Liberal,t5_2qxt5,2016-06-10 03:42:39,3,2016,6,-0.6705
Holos620,dayt0mw,"Well, people democratically decide where the funds are invested. If you believe in electric cars and want to make this economic venture succesful, you invest yours funds in it.

I know what you mean, but I don't find it practical that everyone within the workplace decides everything about their workplace. We still need division of labor, and people don't suddenly have MBAs under socialism. Goods and services also don't make themselves, if we have to hear everyone's opinion about everything, we'll have meeti",Economics,t5_2qh1s,2016-12-09 01:51:41,6,2016,12,-0.1779
gordo65,dbhblkw,"Since the ventriloquist will be in attendance, there's not much reason for the puppet to be there.",AmericanPolitics,t5_2qied,2016-12-21 21:49:01,-2,2016,12,-0.0
_sas,3zs61g,H.R.1321 - Microbead-Free Waters Act of 2015 ,environment,t5_2qh1n,2016-01-06 22:14:08,0,2016,1,0.0
Crawlarado,d4828h5,"People have notified the FBI and police on suspicion before. It didn't check out. They were labeled racists. Look it up. In San Bernardino someone said they were afraid to notify police because they would be labeled racist-political correctness which is a direct result of people like you. 

I'd say you are programmed to oppose anything to do with guns, not me. Guns don't kill people, people kill people. ",democrats,t5_2qn70,2016-06-14 00:16:08,1,2016,6,-0.5962
braxford,dbeddb7,"HR informed me we have approx or just over 50. But that's counting hires that aren't local, and work remote or in another country. We're supposedly getting health benefits ""soon"" but soon can be months from now. I need coverage or else is illegal, right? ",healthcare,t5_2qkih,2016-12-19 22:30:07,1,2016,12,-0.3612
SuperPenisIsGo,d0nxmvq,"&gt; Honestly? It's their party and they set up the rules so they can do what they want to.

This goes for all political parties too, I believe.  Democrats could do it.  Political parties are not, technically, part of the federal government and so they can do thing like this since they are independent organizations.  ",PoliticalDiscussion,t5_2sfmf,2016-03-04 23:03:27,2,2016,3,-0.9169
anutensil,40s263,Incandescent Light Bulbs May Have a Bright Future After All - Nanotechnology could turn the inefficient bulbs’ weakness into a strength ,environment,t5_2qh1n,2016-01-13 13:42:09,16,2016,1,0.5106
anutensil,4m7m62,This U.S. City Is a Sustainable Utopia—Here's What They Have Accomplished &amp; Where They Are Headed - They have set out to reduce emissions by 80%. Portland has created &amp; implemented strategies to reduce greenhouse gas emissions for over 20 yrs. ,environment,t5_2qh1n,2016-06-02 15:10:34,17,2016,6,0.5994
todayilearned83,5k5k1e,Trump isn’t prepared to be president — and that’s a dangerous thing ,Liberal,t5_2qxt5,2016-12-24 22:59:26,1,2016,12,-0.296
TrippleTonyHawk,dbqa655,"I love the sound of that, but who?  I just haven't heard of anyone that seems like they'd have a good shot, besides maybe Tulsi Gabbard, whom I like but am not so sure how successful she would be.",politics,t5_2cneq,2016-12-28 21:01:10,0,2016,12,-0.9463
Cvilledog,d1izmjt,"Immigrant and fiancée visas are all processed in Montreal. Good for them (one office to handle the paperwork instead of several), bad for you and everyone else who doesn't want to travel 4500km for an interview.",immigration,t5_2qvj0,2016-03-30 13:04:37,2,2016,3,-0.2076
MuteCook,d0l2z96,"Now I'm convinced thanks to some random poll. 

",politics,t5_2cneq,2016-03-02 19:45:45,0,2016,3,-0.6808
Mynameis__--__,511duq,John Dickerson Adds Historical Perspective to Presidential Race ,Liberal,t5_2qxt5,2016-09-03 23:26:10,1,2016,9,0.0
alllie,5i7o9f,"Just when it seems the feckless House Republican “leadership” can’t get any worse they pass a bill to implant GPS microchips in children and the elderly, and a government database – run by the Department of Justice – to track their whereabouts. ",uspolitics,t5_2qwlq,2016-12-14 01:29:18,0,2016,12,-0.0772
Localman1972,4brh8f,"TRUMP - Who are you going to believe? Me, or those lying data analytics? ",politics,t5_2cneq,2016-03-24 13:11:42,0,2016,3,-0.5803
FreedomsPower,41me7t,Here is why Ted Cruz’s attack on climate change science is hilariously wrong ,environment,t5_2qh1n,2016-01-19 02:12:20,22,2016,1,-0.7351
fosian,d83cme3,"Just an aside, because your numbers seem off, but it could simply be because of a different situation: since January I've used 260 kWh - how are solar panels ""only 4,000""? Granted, I also use gas, and it's not a standalone house... What's the average electricity consumption in the states? ",NeutralPolitics,t5_2tk0i,2016-09-26 23:32:16,3,2016,9,-0.4329
Iamabioticgod,4cmibv,Would Kim Jong Un be able to leave NK? [removed],PoliticalDiscussion,t5_2sfmf,2016-03-30 19:58:33,0,2016,3,-0.0516
flossdaily,52i1e4,[serious] Is Hillary Clinton wearing anti-seizure sunglasses? [removed],PoliticalDiscussion,t5_2sfmf,2016-09-13 01:46:58,0,2016,9,-0.0
Belle_Kaberry,4nw38k,Pointers You Should Consider to Avoid Golfer’s Elbow ,healthcare,t5_2qkih,2016-06-13 15:18:04,1,2016,6,-0.296
michaelconfoy,41jyzm,Why The GOP Candidates Are Tied In Knots Over Replacing Obamacare ,democrats,t5_2qn70,2016-01-18 17:36:41,4,2016,1,-0.0
x985hfksk5,5hsyla,"Signing affidavit of good faith for a friend Hello all - I have also posted this on r/legaladvice but figured it might make sense to post it here too.

I have a friend of ten years who is a naturalized US citizen and has been living in the US for ~13 years. I myself am a naturalized US citizen and have lived in the US for 21 years.

My friend is in graduate school and met a girl who is also from his home-country (she was also in graduate school, albeit a year ahead and has since graduated). They met approxi",immigration,t5_2qvj0,2016-12-11 22:47:32,4,2016,12,0.9267
ScotchforBreakfast,db451nv,"Since when have Republicans cared about unwritten conventions? Did you miss them refusing to take up the nomination of Supreme Court judge for a full fucking year?

Norms are broken and Republicans did it.",PoliticalDiscussion,t5_2sfmf,2016-12-12 21:37:32,24,2016,12,-0.0926
ohheyhowareyoutoday,d16h0ll,"It would likely also be helpful to bring evidence of your ties to China as well to bolster his case - job info, joint accounts etc. the B visa is the correct choice.",immigration,t5_2qvj0,2016-03-20 05:34:12,1,2016,3,0.5994
stellahmupanduki,d7b1ut3,"This anointed mind and life healing book drives away the spirit of depression. It removes bad thoughts and behaviours. It removes Suicide, Brain disorders, Psychotic behaviors, Schizophrenic disorder. It takes away brokenness and all lacking. It removes all mind brokenness, unhappiness and all fear. It drives out darkness and sadness from a person`s life . It takes away the feelings of desolation. ",healthcare,t5_2qkih,2016-09-06 02:57:14,1,2016,9,0.9756
Smash_Bernie,d4buro0,"lmao, everyone's jumping off of shriveled senile Bernard's communist dumpster fire, poor little Bernard

Not exactly surprising, why would you possibly continue backing this clown at this point?",politics,t5_2cneq,2016-06-16 17:34:16,-8,2016,6,-0.443
Catbone57,dbiuhhb,"Then you need to talk to the DNC. Gun owners didn't abandon the left - the left abandoned gun owners. When they decided to adapt Sugarmann's scam as a plank in the party platform, they created millions of dedicated Republican voters.",Firearms,t5_2ryez,2016-12-22 22:44:43,3,2016,12,0.3387
michaelconfoy,4akcxt,Jerry Falwell Jr.: Donald Trump Is America's King David ,democrats,t5_2qn70,2016-03-15 20:43:28,8,2016,3,0.0
emag,cywelxp,"When all law enforcement, military, and all other government-sanctioned forces are *exclusively* using so-called smartguns for a few years, I *may* consider them. Until that time... no. Never, not even once...",Firearms,t5_2ryez,2016-01-13 07:37:55,2,2016,1,-0.296
keypuncher,d41ixid,"The 'culture war' is being prosecuted by the left, not the right.

The left is attacking the rights of all Americans - not just those of minorities - and it is the left that insists on separating us into special interest groups to attack each other.

Further, the left's ideas on economics, energy, foreign relations, and infrastructure are antithetical to the right's positions, to individual liberties, and to good government - so there's no way for the two sides to cooperate on those without one side giving ",Republican,t5_2qndt,2016-06-08 22:22:36,-1,2016,6,-0.4792
letsplaycachecache,52ou3z,"I-765 Employment authorization? Hey there. I'm a student in the states from Canada on a B1 visa (I know, don't ask me why they required that and not a student visa) and just got married to an American classmate. So I'm working on my I-130 and my adjustment of status but am unsure about whether I need an I-765, employment authorization? And if I do, whether it needs to be done now or can wait. I'm currently in school, as I said, but will be graduating next summer and hopefully will be able to get a job. So, ",immigration,t5_2qvj0,2016-09-14 04:25:09,1,2016,9,-0.3421
WarlordNorm,czbjpc9,How did the level of human stupidity ever get this high?,environment,t5_2qh1n,2016-01-25 19:20:33,1,2016,1,-0.4404
BarnabyWoods,db1klfm,Right you are.,environment,t5_2qh1n,2016-12-11 02:30:43,3,2016,12,0.0
FreedomsPower,4ns6e9,Helping More Women Access Long-Acting Reversible Contraceptives ,prochoice,t5_2rg0n,2016-06-12 20:47:01,14,2016,6,0.296
michaelconfoy,54v3qh,Trump touts debate performance in Florida rally: Donald Trump declared himself the unquestionable winner of his first debate against Hillary Clinton during a rally Tuesday night ,democrats,t5_2qn70,2016-09-28 06:39:51,3,2016,9,0.5719
jivatman,5jr1he,Project Veritas- Undercover: Chicago Democratic Election Judges Pretend to be Republican Judges ,Conservative,t5_2qh6p,2016-12-22 15:12:35,132,2016,12,-0.1027
Trevelayan,4pt1cf,"Possible issue with new GP100, could use some help Alright, so I just got a new GP100. I haven't been able to use it yet but I've been dry firing the crap out of it to get used to it and smooth out the trigger. I noticed after a while that one of the parts on the front of the trigger changed position. [Here](https://imgur.com/6NsHgWD) is the part. At first I though it looked like it was flush with the deeper surface. I think it's the hammer dog from the manual. Which is the correct position? I'm not sure if",Firearms,t5_2ryez,2016-06-25 15:51:04,3,2016,6,-0.5176
raecatherine,54cjp3,Personal Support Workers?! [removed],healthcare,t5_2qkih,2016-09-24 23:00:48,1,2016,9,-0.4574
Cheesmanjc,43dwb8,"TIL of Vigo County, a small county in Indiana that has only voted incorrectly in two presidential elections since 1888. ",politics,t5_2cneq,2016-01-30 12:30:07,5,2016,1,-0.0
toby224,49d71b,"The media keeps claiming that Trump is using demagoguery to gain support, but isn't the media using demagoguery to scare people away from Trump? Trump is a fascist! Trump would be our last president. Trump hates immigrants. Trump is a racists! Trump will destroy America.

Seems like the media and anti-Trump people are the big demagogue to me. ",PoliticalDiscussion,t5_2sfmf,2016-03-07 15:48:39,0,2016,3,-0.963
California_Viking,cym6fg6,"It's not dog shit it's the minimum wage they can get an employee for. If they're unable to hire An employee they will increase the wage.

I think people for some reason think that most businesses pay their employees shit and then swim in their money. That isn't the case at all.

If you have no skills or experience and are doing a task that is very basic then don't be surprised that you're paid a basic wage. Also don't be surprised if you increase the wage it's cheaper to hire a robot to do it. 

",Economics,t5_2qh1s,2016-01-05 00:31:58,10,2016,1,-0.6414
michaelconfoy,553rb4,"Trump, Conway whines 'It's not nice' that Hillary's 'in Trump's words' ads make him look very weak ",democrats,t5_2qn70,2016-09-29 18:50:50,9,2016,9,-0.8087
theblackvote,d0jyn3r,"From [538](http://fivethirtyeight.com/features/super-tuesday-could-be-historic-for-trump/):

micah: And if Clinton meets/exceeds her polling today, do this one: “Hillary Clinton is the ___________ front-runner to win the Democratic nomination.”

natesilver: Overwhelming.

harry: A big scandal would need to come to light for her to lose.

natesilver: Harry: “Hillary Clinton is the a big scandal would need to come to light for her to lose front-runner to win the Democratic nomination.”

micah: Yeah, Harry isn",NeutralPolitics,t5_2tk0i,2016-03-01 22:53:04,4,2016,3,-0.1027
jerseyboard24,dbi09er,please visit http://www.aldanamedical.ae/ for more information .,healthcare,t5_2qkih,2016-12-22 09:39:56,1,2016,12,-0.3182
stopher_dude,5je1es,The Curse of Violent Crime in Democrat-Run Cities ,Republican,t5_2qndt,2016-12-20 16:10:15,2,2016,12,-0.8979
youngpaleocon,553bgq,First debate response by Constitution Party presidential candidate Darrell Castle ,Libertarian,t5_2qh63,2016-09-29 17:26:38,0,2016,9,-0.4019
tmtreat,d49o37n,"I'm not sure who is advising you to lie, but that is absolutely the worst advice possible. Unauthorized employment is forgiven when adjusting through an immediate relative.  Lying can/will result in a fraud charge.

What was put on the employment history section of the G-325A?",immigration,t5_2qvj0,2016-06-15 02:24:06,2,2016,6,-0.9428
skiman224,402g2n,Is corruption as large an issue in the U.S. government as it's cracked up to be? [removed],NeutralPolitics,t5_2tk0i,2016-01-08 18:50:32,1,2016,1,-0.0
blueberet,3z6sa1,"Lame Duck Gov. Bobby Jindal Is Using His Last Days To Screw Over 31,000 Unemployed Louisianians ",uspolitics,t5_2qwlq,2016-01-02 21:22:14,10,2016,1,-0.4939
JustinCayce,cyrjmd7,"Then let them write them *before* the law is passed. That way Congress has the opportunity to see exactly what the law will be, you know, their job. What you have now is Congress passing a law, that doesn't actually exist, with the law to be written later by those not accountable to the people. That simply isn't acceptable.",PoliticalDiscussion,t5_2sfmf,2016-01-09 05:42:06,1,2016,1,-0.2115
atomicmarc,4n5t04,A breakthrough 240 years in the making ,Liberal,t5_2qxt5,2016-06-08 16:11:31,0,2016,6,0.0
Starks,d13ar3d,You can convince enough people in the Senate to do a discharge petition if he gets shot down in committee.,PoliticalDiscussion,t5_2sfmf,2016-03-17 15:02:59,1,2016,3,-0.25
razorbeamz,4clz5b,Do you listen to any politics podcasts? [removed],PoliticalDiscussion,t5_2sfmf,2016-03-30 18:05:11,1,2016,3,-0.0
TV_abridged,czfu36i,Cruz hurt himself going after Trump the way he did.,Republican,t5_2qndt,2016-01-29 00:58:09,2,2016,1,-0.5267
congresswomanfuckyou,48zdu6,"Republicans, if you don't want Donald Trump or Hillary Clinton to be president, is Ted Cruz the only choice left? [removed]",PoliticalDiscussion,t5_2sfmf,2016-03-04 21:21:36,0,2016,3,-0.0572
ShotBot,5hed1m,"Stock market’s velocity after Trump has investors talking Dow 20,000—and beyond ",Republican,t5_2qndt,2016-12-09 15:33:30,8,2016,12,0.0
Auch999,545rum,"Trump-Clinton Debate Rules Leaked: 90 Minutes Straight, No Step-Stool, No Coughing Breaks Allowed ",uspolitics,t5_2qwlq,2016-09-23 17:08:20,0,2016,9,-0.5859
sbiswas3,4ppbza,"(USA) Work permit through spouse about to expire. Do I need to call USCIS ? Hello everyone, I had gotten married over 1.5 years ago to my wife who is an American Citizen. After applying for Adjustment of Status/ Green Card, the USCIS had sent a work permit that is about to expire in a few weeks. 

Before getting married, I was a F1 student, and had worked with the work permit I had received through OPT. That work permit already expired sometime last year. 

I have used my new work permit for jobs, but, I am",immigration,t5_2qvj0,2016-06-24 21:30:09,1,2016,6,-0.0
soybala,53q2e7,How many boxes of baby powder formula I'm allowed to bring to Usa ?? Question to custom and border people :) ? I'm travelling  to Usa with 3 month old daughter and because in America  I couldn't find  formula I'm using now I thought I will bring 4 boxes (originally sealed by manufacturer ) with baby formula. Wondering  if I would be allowed 4 boxes ... or possibly even 5 because she's using one box a week and we're going there for whole month.Thanks for answering :),immigration,t5_2qvj0,2016-09-20 22:35:12,3,2016,9,-0.7608
AllenDono,3zet7s,"China, euro zone factories suggest global economy still fragile ",Economics,t5_2qh1s,2016-01-04 13:42:07,4,2016,1,-0.0
DevonWeeks,d0phznf,378 to 295.  That's quite a lead Trump has.  It's not exactly close.  Plus if Trump wins Florida he takes all 99 of their delegates.  Him skipping CPAC to campaign in Florida may prove to be the smartest thing he could have done.,Conservative,t5_2qh6p,2016-03-06 10:55:25,-1,2016,3,-0.8271
aurelorba,d3xe351,Indeed. So universal background checks [including private sales] that bar people with felony convictions and mental health issues.,PoliticalDiscussion,t5_2sfmf,2016-06-05 23:31:07,1,2016,6,0.5423
DrJarns,48we2n,The Strangest Attack On Trump ,Republican,t5_2qndt,2016-03-04 07:26:18,0,2016,3,-0.4767
poppinroofie,5hs56m,Saw Hillary in person today! ,The_Donald,t5_38unr,2016-12-11 20:21:40,11,2016,12,0.0
