author,id,body,subreddit,subreddit_id,created_utc,score,year,month,sentiment
TrapperJon,d4f0ijw,"You think taking supressors off tbe NFA, doing away with assault weapons and handgun bans, and doing away with pistol licenses is ""batshit crazy"".  Happy?  Clear enough?  What about that is crazy?  Or do you just not have an answer?",guncontrol,t5_2rdus,2016-06-19 03:36:35,1,2016,6,-0.5803
DHerpster,d0prqmo,If the shoe fits wear it,Republican,t5_2qndt,2016-03-06 17:47:31,1,2016,3,0.0
discocrisco,53lkw6,US President Barack Obama urges China to tackle excess capacity ,Economics,t5_2qh1s,2016-09-20 03:47:31,1,2016,9,-0.0
espanabullmirror,d1c2k2z,They will issue a duplicate of his naturalization certificate. You remain a US citizen even if you lose the certificate the problem as you know is he cannot prove it. Once he receives the certificate you can get a replacement social security card. ,immigration,t5_2qvj0,2016-03-24 18:22:35,2,2016,3,-0.4588
paulen8,41hon9,"Bernie Sanders has drawn contrasts with Hillary Clinton on health care, paid family leave and Wall Street reform ",democrats,t5_2qn70,2016-01-18 06:15:05,6,2016,1,0.4588
jonfla,425rj2,"Electric vehicle turns in solid performance at Dakar rally, world's toughest ",environment,t5_2qh1n,2016-01-22 14:35:38,14,2016,1,0.0772
Ser_Davos_Cworth,41kaju,Report: Islamic State Beheads 150 Civilians in Syrian Massacre ,Conservative,t5_2qh6p,2016-01-18 18:43:46,14,2016,1,-0.0
AdamSmithLiberal,db0h4jv,Actually Wharton issues undergraduates with a Bachelor of Science in Economics.,Economics,t5_2qh1s,2016-12-10 05:05:30,2,2016,12,-0.0
wheelchairindia9,49xuhw,Tynor Universal Patellar Support For Knee ,healthcare,t5_2qkih,2016-03-11 08:07:10,1,2016,3,-0.4019
sreja712,49q3yw,Indian Hot Aunty Forced by Neighbor Her Boy Friend ,environment,t5_2qh1n,2016-03-09 20:54:39,1,2016,3,-0.0516
Acrimony01,d81h1wp,"How is the right to use self defense in any way related to the 2nd amendment? I thought that was the ""militia"" or some other malarkey that you guys believe

No right is unlimited. Yet youre attempting to ban commonly sold weaponry that's existed for a century. How do you justify that?

Oops. You just got egg on your face.

Downvote my posts like a coward. Putting your fingers in your ears and screaming. You know what's funny? Nobody is here. Nobody cares about your irrational echo chamber.",guncontrol,t5_2rdus,2016-09-25 17:08:12,5,2016,9,-0.7461
jcoguy33,d0vfkvk,"They've been doing a very good job from my perspective. Inflation is low, unemployment is low, and they did a good job avoiding an even bigger crash in 2007/8.",PoliticalDiscussion,t5_2sfmf,2016-03-11 00:45:09,32,2016,3,0.5878
thwayrp,4op8e5,The Left’s Phony War on Guns: Gun Control as Left-Wing Identity Politics ,Republican,t5_2qndt,2016-06-18 16:44:56,3,2016,6,-0.743
war_on_words,4opqzy,"Which subreddit actually spends time enjoying a discussion of libertarian ideas, rather than fellating one particular American politician during his doomed campaign? The answer is definitely not /r/Libertarian.",Libertarian,t5_2qh63,2016-06-18 18:48:06,0,2016,6,-0.4215
etchasketchist,czcwdui,"That's part of ""getting things done"". Single-subject bills would ""get less things done"". It's anti-legislation legislation. Anything that gums up the works of the process and makes it harder to make deals and pass legislation isn't a progressive measure.",politics,t5_2cneq,2016-01-26 19:42:05,0,2016,1,-0.0
ButchMFJones,52uzej,"my fellow #NeverTrump holdouts, I make but one plea in these troubles times. ",Republican,t5_2qndt,2016-09-15 06:49:17,1,2016,9,0.6124
the_ancient1,dang9xg,"Well in their defense,  no real American would order a burger with out cheese...

If you do clearly you should lose your citizenship... ;) as that is more offensive than burning the flag",Libertarian,t5_2qh63,2016-12-01 11:09:18,3,2016,12,-0.2484
CaptOblivious,d0z46jv,"If they were SMART they would change over to supplying renewable energy sources. 

Sadly enough, the owners will squander the profits they have left on paying themselves and upper management as much as possible instead of investing in becoming the energy suppliers of the future. 

That's what happens when capitalists die and leave the business to their idiot children.     

It's part of why we had the estate tax in the first place, so that we don't end up with idiots that have never had to think for themsel",AmericanPolitics,t5_2qied,2016-03-14 07:34:27,1,2016,3,-0.1697
dumpydouche,d7xfmsk,Don't tell your liberal friends. You'll probably be called every racist term in the book.,The_Donald,t5_38unr,2016-09-22 13:57:02,3,2016,9,-0.2263
conuly,525chh,"Top West Point general: ""Valid concerns"" raised about prayer after Army football game ",Liberal,t5_2qxt5,2016-09-10 21:45:15,3,2016,9,0.2023
IronPathologist,d0nei7i,There's a reason nominations last months.,Conservative,t5_2qh6p,2016-03-04 15:29:34,5,2016,3,-0.0
HenryCorp,4bi7lh,Poll Shows Bernie Sanders' Tax Plan is The Favorite of 2016 Taxpayers in Both Parties ,democrats,t5_2qn70,2016-03-22 16:44:59,1,2016,3,0.6908
wfa19,d0zbsnf,"After this exodus, Breitbart will probably just be Milo Yianopolous's playground.",Republican,t5_2qndt,2016-03-14 14:10:53,13,2016,3,-0.0
Shares_RSS,4pemki,UPDATE 1-Singapore Exchange says hikes margins amid Brexit volatility ,Economics,t5_2qh1s,2016-06-23 03:03:36,1,2016,6,-0.0
kaash3,4nt3zz,"While I don't neccesarily agree with some of the political views on this sub I just wanted to thank the people here for being the only ones with the balls to report today's news in an uncensored fashion as someone who usually gets their daily news from reddit every morning I am incredibly disappointed in certain subs that have decided to censor facts behind the Orlando shooting in a foolish attempt to shelter Islam and prevent Islamophobia.  Anyways, I first discovered the shooter was a muslim with potentia",The_Donald,t5_38unr,2016-06-13 00:23:46,447,2016,6,-0.6848
wheelchairindia9,48qezt,Galaxy AWA Ostrich Electric Wheelchair ,healthcare,t5_2qkih,2016-03-03 04:38:24,1,2016,3,-0.0
AutoModerator,d7h9848,"/r/democrats does not allow query strings in urls as they are often used to bypass duplicate article checks.  A query string is the part of the url that follows and includes the `?`  Please remove this from your url and resubmit.  

example:

    http://www.example.com/page/?query=string&amp;anotherquery=anotherstring
    
Here the query string is:  `?query=string&amp;anotherquery=anotherstring`

If your link does not function without it, please message the moderators.  


*I am a bot, and this action was p",democrats,t5_2qn70,2016-09-10 19:09:31,1,2016,9,-0.2187
areyoumydad-,d0ru1dk,"Haha. Oh shit, I did it. What's OP gonna do?",democrats,t5_2qn70,2016-03-08 07:38:26,2,2016,3,-0.1531
peteftw,db17yuk,"Hahahaha, again, that doesn't make this fake news. It's not even incorrect.

Please go to voat already. ",environment,t5_2qh1n,2016-12-10 21:09:21,52,2016,12,0.6795
wiseprogressivethink,4pvk24,Does the Brexit vote effect the U.S. presidential race? ,AmericanPolitics,t5_2qied,2016-06-26 01:47:43,2,2016,6,-0.0
anaccountant2b,d7594h8,On the website it says you can apply for naturalization (citizenship) if you have been in America as a green card holder (permanent resident) for five years. ,immigration,t5_2qvj0,2016-09-01 11:41:58,-1,2016,9,-0.0
OfBlinkingThings,db8ov7l,"You're good to go!! Nice collection

Next up is some wood gripped revolvers. ",guns,t5_2qhc8,2016-12-15 20:23:57,2,2016,12,0.7418
Allforthe2nd,dbpuu15,Sig P226. Also my winter carry. Also my bed time gun. Also my SHTF gun. So many uses. Love it.,guns,t5_2qhc8,2016-12-28 15:30:49,3,2016,12,0.1689
Sour_Badger,d0sn2qy,triangle wound almost impossible to stitch as well.,politics,t5_2cneq,2016-03-08 22:49:45,3,2016,3,-0.2732
jimrosenz,4orz5d,The real case against the minimum wage. ,Economics,t5_2qh1s,2016-06-19 04:49:16,1,2016,6,0.0
Frostshine,db07bvd,"That excuses them treating others like they have been treated themselves? Honestly disgusts me because out of all people in europe, beside jews, polish people should know what racism feels like.   ",The_Donald,t5_38unr,2016-12-10 00:25:10,-12,2016,12,-0.0516
derintellectual,553p74,"A team of top scientists is telling world leaders to stop congratulating themselves on the Paris agreement to fight climate change because if more isn't done, global temperatures will likely hit dangerous warming levels in about 35 years. ",environment,t5_2qh1n,2016-09-29 18:40:01,20,2016,9,-0.3182
Boston1212,db2aux3,They don't have the votes ,environment,t5_2qh1n,2016-12-11 18:04:49,42,2016,12,-0.0
NotSoLostGeneration,4cfhlj,Donald Trump Says It Was Okay for Him to Make Fun of Women ,uspolitics,t5_2qwlq,2016-03-29 13:48:04,1,2016,3,0.6369
OneDoesNotSimplyPass,4b6wpt,"Hillary supporters; how much would you expand the social safety net if you had free reign to do so, if at all? [removed]",PoliticalDiscussion,t5_2sfmf,2016-03-20 08:50:54,0,2016,3,-0.8834
MrMeyhem,d7k6qzr,VA does wonders. You hear about the exceptions not the rule. Anyone that's had Tricare is used to waiting their turn for care.,politics,t5_2cneq,2016-09-12 22:28:58,1,2016,9,0.4939
brzcory,dank43n,How about you write up the markings that are on the barrel/receiver for us? ,Firearms,t5_2ryez,2016-12-01 13:46:57,2,2016,12,-0.0
Tandria,d79ek2o,"&gt; A very poorly executed plan if that was their intention as they are the one who look like assholes.

It wasn't their best plan to do this in front of Democracy Now as they filmed literally everything in gruesome HD.",environment,t5_2qh1n,2016-09-04 19:19:03,2,2016,9,-0.6876
MAGA_LO_DON,d7k0uyp,You got us all interested now man. I'm devoted to turning CNN off so help a brother out.,The_Donald,t5_38unr,2016-09-12 20:19:53,8,2016,9,0.8356
optionhome,db079w4,"Hopefully she will get use to hearing....""You're fired.""",Conservative,t5_2qh6p,2016-12-10 00:23:43,1,2016,12,-0.4019
wrez,48ejmg,It’s Already Over for Rubio | The American Conservative ,Conservative,t5_2qh6p,2016-03-01 04:36:42,10,2016,3,-0.0
tarlton24,4n5gii,"Pro-Trump Folks: How Has This Last Week Affected Your Enthusiasm Level for Trump? It's been a mess of a week for Trump: The judge thing was a gaping self-inflicted wound. Then he doubled down on it, keeping it in the news instead of focusing on a crappy jobs report. Then he had that conference call where he proclaimed his staff stupid, didn't seem to know what was going down, and then tripled down on the whole judge thing.

My question is, after all that, how's your enthusiasm level for Trump: On a scale of",Conservative,t5_2qh6p,2016-06-08 15:02:30,0,2016,6,-0.6486
MephistophelesTheDog,db8ejj9,"The poor, innocent corporations just struggling to get by /s",environment,t5_2qh1n,2016-12-15 17:03:02,17,2016,12,-0.5423
casualLogic,cz7ay84,"REALITY CHECK!  That bloated, ivory tower cream puff shyster is becoming universally despised.  If you do a little research, the Trump brand is now in freefall, and his consumers are fleeing in numbers.  IMHO, I'm seeing signs that he's being set up for a HUGE fall by somebody with more $ than he has, someone he's pissed off.  

After all, what would be more humiliating to The Donald than to be rejected?  Think about it....",uspolitics,t5_2qwlq,2016-01-22 02:21:41,3,2016,1,-0.9109
Individual99991,3zyoyt,"US Media Visa (I Visa) question: How do I add sponsors? I'm in the US on an I Visa (Media Visa) with one sponsor, but as I have some free time, I want to add at least one more foreign media company to my I Visa so that I can write for them legally. 

Assuming I get a letter and contract from them, how do I apply to make this happen? To whom should I speak? Even my immigration lawyer doesn't seem to know.",immigration,t5_2qvj0,2016-01-08 01:20:21,3,2016,1,-0.7929
gunholester,5jc23h,Getting To Know the Hybrid Holster ,guns,t5_2qhc8,2016-12-20 07:44:23,1,2016,12,0.0
Lefaucheux,5jzhp2,Tiny 5mm pinfire/centerfire combo revolver! ,guns,t5_2qhc8,2016-12-23 21:26:30,41,2016,12,0.0
Euphemistica,4bvr1x,"Am I mistaken, or has Hillary Clinton donated $1,000,000+ to her own campaign? [removed]",PoliticalDiscussion,t5_2sfmf,2016-03-25 08:13:17,0,2016,3,-0.3612
Joelfor3,5konfa,I don't know if you guys have seen this but it's modern interpretation of college campuses brilliant.... and it's also really funny! ,Conservative,t5_2qh6p,2016-12-28 05:47:42,1,2016,12,0.6789
duffydaddy,4mz1za,"How to promote a politics and law class to high schoolers Hi everyone. Can the mods please remove this post if it is not within the rules. I am a Social Sciences teacher from Australia and I have been asked to promote a politics and law senior school class to 15 year olds. I have 5 minutes to present and basically need to outline in an engaging way why learning politics and law is important and beneficial to my students (job prospects, skills learnt, etc..). Hoping to get some links to some articles/media w",NeutralPolitics,t5_2tk0i,2016-06-07 13:34:59,38,2016,6,-0.9485
ScoobiusMaximus,d19zu2c,"In modern America the thought of stopping the government with even the most powerful gun is laughable, even in the hands of thousands of people. The government has drones and tanks. If anything free speech is much more likely to reign in the government than bullets are. That could influence the soldiers controlling the drones and tanks at the very least. ",PoliticalDiscussion,t5_2sfmf,2016-03-23 02:28:57,2,2016,3,-0.513
AutoModerator,d1bu9w6,"[A reminder for everyone](https://www.reddit.com/r/PoliticalDiscussion/comments/4479er/rules_explanations_and_reminders/). This is a subreddit for genuine discussion:

* Don't post low effort comments like joke threads, memes, slogans, or links without context.
* Help prevent this subreddit from becoming an echo chamber. Please don't downvote comments with which you disagree.
* The downvote and report buttons are not disagree buttons.  Please don't use them that way.

Violators will be fed to the bear.

---",PoliticalDiscussion,t5_2sfmf,2016-03-24 15:21:17,1,2016,3,0.0818
chinhtunhien,53grzp,Hướng dẫn nhanh để làm túi xách bằng vải không dệt bằng polypropylene ,environment,t5_2qh1n,2016-09-19 09:33:36,1,2016,9,-0.0
Clatsop,4bbql3,Why Everyone Should Vote for Ted Cruz ,Republican,t5_2qndt,2016-03-21 10:24:32,0,2016,3,-0.0
kyew,d4p5ddo,"Yeah, kind of. Well played. I haven't been paying close attention to the platform, I'm more interested in playing devil's advocate against all the Hillary hate permeating through Reddit.",Liberal,t5_2qxt5,2016-06-26 23:19:19,3,2016,6,0.7233
NinjaDiscoJesus,53qsme,"The ongoing loss of sea-ice cover is wreaking havoc on ecosystems across the Arctic, and may spell the end of more species than previously thought. ",environment,t5_2qh1n,2016-09-21 01:26:06,3,2016,9,-0.7351
KimLeaLane,d861w1c,"If you get a visa and don't use it, next time you apply it might look suspicious. I think this ""rule"" applies even for regular tourist visas. ",immigration,t5_2qvj0,2016-09-28 21:06:06,1,2016,9,-0.3612
JW_2,49twue,"In what ways is President Obama ""taking the country in the wrong direction""? [removed]",PoliticalDiscussion,t5_2sfmf,2016-03-10 15:36:01,26,2016,3,-0.4767
docmongre,d4e6xp8,Fuck that shit.  Japanese are some of the most well known perpetrators of atrocious [war crimes](https://en.wikipedia.org/wiki/Japanese_war_crimes).  They chose the wrong side and lost the war.  Now we get to have a base in their country.,uspolitics,t5_2qwlq,2016-06-18 11:41:58,-3,2016,6,0.9457
CoyoteBanned,d3rn795,Lover's quarrel?,guns,t5_2qhc8,2016-06-01 12:46:15,2,2016,6,-0.0
VladiMambisu,5i83ns,Who's your daddy? ,uspolitics,t5_2qwlq,2016-12-14 02:52:03,1,2016,12,-0.0
grassshrimp,5l9b18,"Obama's sabotage is against the American people, not Russia, not Israel, not Trump. Obama realizes his legacy will be destroyed.  His desire to fundamentally transform the United States has hit a wall, his foreign policy has been a disaster, the economy is bolstered by fake news and his ideology has been rejected by the American people who voted against his legacy.  He is acting like a petulant child, willing to burn the world to deflect his failures.",The_Donald,t5_38unr,2016-12-31 11:29:39,241,2016,12,-0.9201
anti-scienceWatchDog,54s4w4,20 Lies Donald Trump Told At The First Presidential Debate ,Liberal,t5_2qxt5,2016-09-27 18:49:56,52,2016,9,-0.4215
nice_try_fatty,d4hpqlh,lol,The_Donald,t5_38unr,2016-06-21 06:56:03,1,2016,6,-0.4215
Sand_Trout,d0m6qy8,"I don't think that study is saying what you think it's saying.

The summary states that applications for concealed carry permits are *subsequent* to violent crime. Which makes complete sense regardless of your stance on guns, as more people will want to carry guns if they percieve increased risk of criminal violence against themselves.

That's neither here nor there in terms of validating gun rights or gun control.",guncontrol,t5_2rdus,2016-03-03 16:59:39,5,2016,3,-0.9496
S0ckHeaven,d40ad63,"It was pure gold. To see him going after Hillary all the time for it, and now here he is. lol.",Conservative,t5_2qh6p,2016-06-08 01:40:03,3,2016,6,0.4215
HenryCorp,4qhct7,"Standing in Front of Garbage, Trump Recycles Terrible Ideas About Free Trade: But that wasn't the worst part ",uspolitics,t5_2qwlq,2016-06-29 19:18:05,1,2016,6,-0.6748
planetbyter,darxqqk,"Trevor didn't give her a fair hearing, though. He cherry picked some statements out of context, and never really gave her a full hearing at times. I wouldn't agree with either of them wholly on this point.",Liberal,t5_2qxt5,2016-12-04 16:33:30,4,2016,12,-0.4717
lurkattwork,d7z3h8c,"Prob your best and safest bet really.  I highly, highly doubt you would run into issues, but people win the lotto sometimes right?  That could have been your 1 in a million.

Either way get those papers in!  Soon as she has her card in hand you guys are all good!",immigration,t5_2qvj0,2016-09-23 17:19:02,1,2016,9,0.9532
Lord_Blathoxi,cyrzk87,"Again, you have no idea how UUs treat their religion, if that's what you think.",Liberal,t5_2qxt5,2016-01-09 18:30:15,1,2016,1,-0.128
northbud,d4jnr36,We will if these asshats gain traction. The country needs leaders not actors in a political theater.,politics,t5_2cneq,2016-06-22 17:52:29,2,2016,6,-0.5267
EJR77,daztgu6,"You don't even understand the difference that shows your level of competence thanks. Here's a place where you can look up the difference: /r/libertarian. Their motto: ""fiscally conservative, socially liberal"" It sums up your level of competence if you think they are the same thing. Dumb, just dumb. You don't even know the difference between fiscally and socially do you? bigs difference bud, and you're saying their isn't. Again, do your research and the get that head out of that bootyhole.",environment,t5_2qh1n,2016-12-09 19:21:19,1,2016,12,-0.5719
mfa_aragorn,4aykrf,"My Holiday in Rome. Darn you ISIS ! Just came from a week's holiday in Rome with my family. I am from Europe as well, and I have been there a few years back. But this is not how I remember it. Thanks to those f*&amp;^-heads , this is what you see on every important corner of this beautiful capital nowadays. The vehicle has written on it 'Operazione Strade Sicure'  ( Operation Safe Streets ) .                    
                                                                  
http://i.imgur.com/qkxjLDp.jp",Firearms,t5_2ryez,2016-03-18 14:41:12,16,2016,3,-0.9678
benthicmastadon,d78xgq4,"I'd put the maximum planetary carrying capacity at ~100 billion people, maybe more once we develop methods of living in deserts or on ocean waters. But you are right that our current systems, which are entirely profit-driven, would lower that number to about 1% of what is possible.

If no-one ate meat, all food was grown in permaculture, and we revolutionized housing, the number of people we could support would soar astronomically. We are already moving into a post-paper society, and all of the major pollut",environment,t5_2qh1n,2016-09-04 08:20:40,1,2016,9,-0.3081
sovietracism,dbczemu,"Each embassy can decide to process an interview for someone that is not a resident in their jurisdiction. Can't say whether they will or not. 

",immigration,t5_2qvj0,2016-12-18 23:39:26,1,2016,12,-0.0
RebasKradd,d7w369i,It matters with the independents.,Republican,t5_2qndt,2016-09-21 15:13:54,6,2016,9,0.0258
Godzilla1122,4o86ms,"Favorite 9mms? Like the title says, what are some of your favorite 9mms? I'm in the market for one around the $300-$500 price range, but if you have a favorite that doesn't fit in there by all means please share! ",guns,t5_2qhc8,2016-06-15 16:30:16,5,2016,6,-0.9097
dvidsilva,d19fjrr,There's an L-1 visa but those are usually meant for employees that will be in the country a lot. Id say get started with a b1 and on your first visit to the us talk to an agent or an attorney about your options. ,immigration,t5_2qvj0,2016-03-22 18:21:57,1,2016,3,-0.0
keypuncher,dbq8ek0,"The funny thing is, Democrats have spent the last century loving the Russians and their genocides.  It took Trump liking Putin to bring them to their senses.  The Trumpsters of course, had already lost theirs.",Republican,t5_2qndt,2016-12-28 20:23:54,-3,2016,12,0.802
PIDomain,5in5at,What exactly can Obama do against Russia during his last few weeks in office? As a reprisal against the [Russian influencing of the 2016 election](http://www.nytimes.com/2016/12/09/us/obama-russia-election-hack.html)?,NeutralPolitics,t5_2tk0i,2016-12-16 08:06:37,243,2016,12,-0.0
JonEverhart,4cnu0y,Is this real evidence of voter fraud in New York? [removed],NeutralPolitics,t5_2tk0i,2016-03-31 01:17:56,1,2016,3,-0.5859
avengingturnip,cz2bsvu,If only she weren't Filipino.  She must hate herself.,AmericanPolitics,t5_2qied,2016-01-18 03:49:23,1,2016,1,-0.5719
IslandEcon,51wy4e,A Lesson in Unintended Consequences: How Clinton’s Policies Would Raise Effective Tax Rates for the Middle Class ,politics,t5_2cneq,2016-09-09 11:40:30,0,2016,9,-0.4767
thebrightsideoflife,d0uz5ec,"&gt;They are already working to coopt his campaign

that's [old news](http://www.thenewamerican.com/usnews/politics/item/21764-ted-cruz-s-closest-counsellors-are-neocon-cfr-vips).",AmericanPolitics,t5_2qied,2016-03-10 18:23:53,2,2016,3,-0.0
decatur8r,d84cogn,Just a reminder ...even less people voted for anybody else. ,AmericanPolitics,t5_2qied,2016-09-27 17:30:40,1,2016,9,-0.0
propshaft,43goan,"DMR poll results , trump 28 - Cruz 23 - Rubio 15 - Carson 10 - Paul 5 - Christie 3 ",Republican,t5_2qndt,2016-01-31 00:01:49,10,2016,1,0.0
f0me,d4nzqex,"Woman* 

sorry for the typo",guncontrol,t5_2rdus,2016-06-25 22:26:59,5,2016,6,-0.0772
HenryCorp,5jrka2,Corruption is the Family Business: Selling Access to The President was Trump's Son's Idea ,uspolitics,t5_2qwlq,2016-12-22 16:49:10,16,2016,12,-0.0
Laneel,5fziot,CaliExit - Lets Join Them! Kick Cali Out! ,Libertarian,t5_2qh63,2016-12-01 22:06:13,17,2016,12,0.4184
michaelconfoy,4b42ln,"FL bill to defund Planned Parenthood would send women to dentists, school nurses for healthcare needs ",Liberal,t5_2qxt5,2016-03-19 18:02:19,109,2016,3,-0.0
neoikon,d3w7d9t,"&gt;My biggest concern would be how good my data is protected against Google itself?

That was my primary point. 

However, the rest of your points are also valid.

",NeutralPolitics,t5_2tk0i,2016-06-04 22:54:29,1,2016,6,0.7003
propshaft,52h4si,Ted Cruz calls on BOYCOTT of ‘rich spoiled athletes’ who protest during National Anthem ,Conservative,t5_2qh6p,2016-09-12 22:33:14,41,2016,9,-0.6166
MomentOfXen,d43nn7w,"Keep it civil. Do not personally insult other Redditors, or make racist, sexist, homophobic, or otherwise discriminatory remarks. Constructive debate is good; name calling is not.",PoliticalDiscussion,t5_2sfmf,2016-06-10 14:28:32,1,2016,6,0.1536
Slipdickgreg,cyvk6yr,Good. Maybe they will wipe each other out and bring a little stability to the area,uspolitics,t5_2qwlq,2016-01-12 18:11:41,1,2016,1,0.4404
Brogelicious,4m8b8r,B. Rizzini Artemis Special 12b ,guns,t5_2qhc8,2016-06-02 17:31:36,94,2016,6,-0.4019
BlameTheFirst,41ecg3,Republicans aren’t even pretending they care about cutting spending anymore ,Conservative,t5_2qh6p,2016-01-17 17:05:45,37,2016,1,-0.4767
perverted_alt,d141418,"They are the same bro.  Da *same*.

Hell, Trump had a phoneconference with Bill Clinton to discuss strategy only weeks before he announced his presidential bid.

It was reported in WSJ and admitted to by both.

Trump is at best a shill designed to hand the election to Hillary and at worse even worse than Hillary because he combines all her policies with unmatched authoritarianism.

No thanks.",Republican,t5_2qndt,2016-03-18 01:37:46,3,2016,3,-0.3818
HyogoHammer,3z3q0x,"US citizen marrying a foreign national in US: Applying for green card required? My fiance is a Japanese national on a work visa. When we get married, is she required to apply for a green card? Alternatively, can she stay on her work visa?",immigration,t5_2qvj0,2016-01-02 04:44:17,1,2016,1,-0.0
mrregmonkey,d7u82sl,"Mankiw (the professor in question) has the go to book for econ 101. 

He's become rich off that.",Economics,t5_2qh1s,2016-09-20 05:02:19,3,2016,9,0.5574
bobloblaw32,cyru44k,My parents are and people in my area seem to like me more if they know I'm a republican. I honestly don't care too much,Republican,t5_2qndt,2016-01-09 15:43:01,2,2016,1,-0.4352
