author,id,body,subreddit,subreddit_id,created_utc,score,year,month,sentiment
Trumpropriation,db7r3ov,"1.The NAZI's (the German public) owned the means of production while allowing private management. http://archive.adl.org/braun/dim_13_2_forgetting.html
http://www.jewishvirtuallibrary.org/jsource/Holocaust/germancos.html

",NeutralPolitics,t5_2tk0i,2016-12-15 04:00:41,-8,2016,12,-0.0
purpleslug,d4bd71t,Frustrating troglodyte.,uspolitics,t5_2qwlq,2016-06-16 09:04:33,1,2016,6,-0.4404
Swiftly_The_Octopus,davk3pj,Lead by example,environment,t5_2qh1n,2016-12-06 23:31:18,1,2016,12,0.0
snokesapprentice,49q014,"GOP superlawyer on contested convention rule: 'In fact, that's not a rule' ",Conservative,t5_2qh6p,2016-03-09 20:33:15,6,2016,3,-0.0
sku4u,4p6m2u,Howard Stern Radio Personality Defends Right to Own Guns in Response to Orlando Shooting ,guncontrol,t5_2rdus,2016-06-21 19:58:44,1,2016,6,-0.0
Reeding_Ra1nbow,d11ou0s,From season 2 right? This is definitely who he means. She didn't do anything of substance than beat the guy who won like every challenge. ,PoliticalDiscussion,t5_2sfmf,2016-03-16 06:19:48,2,2016,3,-0.8481
r4816,413li2,"Europe's orca whales are at risk of extinction, ecologists say ",environment,t5_2qh1n,2016-01-15 15:44:18,1,2016,1,-0.2732
braxford,dbei11p,"Thank you! I'm on my mobile device so I'm not going to get too wordy. You've been a great help, and I'm currently looking at plans. ",healthcare,t5_2qkih,2016-12-20 00:10:54,1,2016,12,0.8622
desarbes,cytkwhm,"No one who can actually be taken seriously thinks we should ban all firearms.  Most liberals I know call for common-sense restrictions on things like extended clips, mandatory background checks, and a national firearm registry.",Conservative,t5_2qh6p,2016-01-11 02:12:36,2,2016,1,-0.5719
StonerMeditation,dbthaf2,"You might not care if Donald Trump says Muslims must register with the government, because you’re not one.  And you might not care if Donald Trump says he’s going to round up all the Hispanic immigrants, because you’re not one.  And you might not care if Donald Trump says it’s OK to rough up black protesters, because you’re not one.  And you might not care that Donald Trump wants to suppress journalists, because you’re not one.

But think about this.  If he keeps going and he actually becomes president, he ",Liberal,t5_2qxt5,2016-12-31 02:14:56,2,2016,12,-0.5775
IBiteYou,d0mwgm9,"""He's trying to do to the American voter what he did to these people at Trump U.""  GREAT LINE MARCO!",Republican,t5_2qndt,2016-03-04 03:12:44,7,2016,3,0.729
bilged,d79v5w9,"To be fair, the Laffer Curve suggests that if tax rates are higher than the optimal rate, then cutting them will increase revenue. However most actual economist estimates of that optimal rate put it much higher than current US marginal rates. So its more an intentional misrepresentation of the theory to justify lower rates than it is a true misunderstanding.",Economics,t5_2qh1s,2016-09-05 03:21:32,2,2016,9,-0.3892
iamdrmario,d15h3ox,As if he will read all of that. He is a shill from /pol/ and The_Donald. Guarantee this protofascist doesn't even understand what libertarians stand for.,Libertarian,t5_2qh63,2016-03-19 06:48:54,1,2016,3,-0.2732
LordyDolphin,d82qeun,"Yeah I know, but I'd rather not pay more for something I don't want",guns,t5_2qhc8,2016-09-26 15:30:30,1,2016,9,-0.1806
autotldr,dapd01a,"This is the best tl;dr I could make, [original](http://observer.com/2016/11/bernie-sanders-presidential-run-was-sabotaged-by-fake-news/) reduced by 78%. (I'm a bot)
*****
&gt; Fake news may indeed have played a role in electing Trump, but no one in the media seemed to care when the the lies were benefiting Hillary Clinton-and attacking Bernie Sanders.

&gt; Goodman added, &amp;quot;Bernie Sanders is breaking every record. It&amp;#039;s the only reason he&amp;#039;s getting any coverage right now. He is sham",uspolitics,t5_2qwlq,2016-12-02 17:18:43,1,2016,12,-0.6059
ultra_blue,darvnwa,"False dichotomy much?

",uspolitics,t5_2qwlq,2016-12-04 15:36:22,1,2016,12,-0.0
ash_poke_master,4nd681,Chris Christie: Tennis Needs Attractive Women ,Liberal,t5_2qxt5,2016-06-09 21:58:17,2,2016,6,-0.4404
CaptOblivious,d7kjzck,"Oh please, unless you were complaining when the shrub did it, and when Powell did it you have no standing to say 2 wrongs do not make a right.       

This whole thing is nothing but partisan BS.",AmericanPolitics,t5_2qied,2016-09-13 03:47:44,0,2016,9,-0.09
ilikeoldpeople,4by02v,"Canadian applying for TN visa. When exactly do I apply? Do I need an appointment? Hello!

I'm hoping to fly direct from Vancouver to Newark exactly 1 week before my start date. My question is, where will I apply for the visa? Will I apply in Vancouver before my flight (as I have to pre-clear customs anyway)?

Do I have to make an appointment or can I just show up a couple hours before my flight? My potential flight is 8:30am but, from what I can tell, immigrations opens at 4:30am so it should be okay?

I tr",immigration,t5_2qvj0,2016-03-25 19:32:59,3,2016,3,-0.6707
fishytaquitos,cz8qsjw,"I'm from Latin America. If Mexico is anything like Brazil, the real power is in whoever has the most dollars. ",environment,t5_2qh1n,2016-01-23 07:16:18,3,2016,1,0.3612
badgerfluff,4ncckw,"Are there any large independent polls that say what will happen if Bernie runs independent or green? I haven't found anything myself yet.
",uspolitics,t5_2qwlq,2016-06-09 19:03:22,2,2016,6,-0.0
douloskerux,4pcw5f,"[Long Read] ""Why is it that among “beltway libertarian” Cato Institute &amp; Reason Mag leaders there seems to be a sense of hostility toward the Mises Institute (and others like Ron Paul)? [X-post from /r/paleolibertarian] ",Libertarian,t5_2qh63,2016-06-22 20:37:52,1,2016,6,-0.25
DEYoungRepublicans,5jrtdq,How Fast Could GOP Congress Get Obamacare Repeal To Trump's Desk? ,Republican,t5_2qndt,2016-12-22 17:34:25,5,2016,12,-0.0
PraiseBeToScience,d4eolli,"Since you're having problem, my deal is the mirror of your deal but the other way around.   Your ""compromise"" is a progun extremist's wet dream with crumbs in return.  This proposal (which isn't really what I actually want) is as much of a full ban as yours is zero gun control whatsoever.   Your ""compromise"" is insulting, and the only value it is to me is using it to demonstrate to others the kind of ""compromises"" gun nuts what.  

Your deal is like walking into dealership and offering $100 out the door for",guncontrol,t5_2rdus,2016-06-18 21:20:11,6,2016,6,-0.9072
hhhnnnnnggggggg,d0w3j6b,"You don't need vaccinations to go to school in many states, just have to fill out an opt out form.",prochoice,t5_2rg0n,2016-03-11 16:27:13,2,2016,3,-0.0
I-the-Person,53n09j,Austin Petersen Would Have Made the Presidential Debates ,Libertarian,t5_2qh63,2016-09-20 12:03:52,0,2016,9,-0.0
Grim-Sleeper,cyk8yh6,"The tricky bit with estate planning is that you are trying to predict what the laws will look like some forty years from now. The current limits are several million dollars ... do you want to bet that they'll be in the same ballpark region by the time this actually matters to you?

For example, if the limits don't get adjusted for inflation, and if you own a house with your spouse that is currently worth $1.5M (pretty common in the Bay Area), then by the time of your death, your house could easily push the ",immigration,t5_2qvj0,2016-01-03 09:58:32,1,2016,1,-0.1779
travistee,4nlpd4,There are two types of Socislist in this world. Those who want to benefit from labor they have not performed and those who want the feeling of power and importance obtained by distributing from labor they have not performed. ,Conservative,t5_2qh6p,2016-06-11 14:57:53,42,2016,6,-0.765
monkeydeluxe,4nfttc,Johnson Rising! Libertarian Party Candidate Hits 12 Percent in New Fox Poll ,AmericanPolitics,t5_2qied,2016-06-10 11:19:35,8,2016,6,0.5983
AceOfSpades70,db49a12,"&gt; But right now they are threats to bring countries to the table for better trade deals.

They did... And Trump attacked Romney from the left on Immigration....

&gt;This is true. Yet I don't hear a peep from Romney or Bush on this issue today.

Why should you?

&gt;Yeah, don't enter conflicts you can't win or don't have the political capital to win.

You got that based on what?  His no boots on the ground position or his boots on the ground position?

Mattis is a neo-con when it comes to interventionism",Conservative,t5_2qh6p,2016-12-12 23:03:59,1,2016,12,-0.8729
Hotblack_desiato1,d13n4jk,"Wait, you are democrat that doesn't value transparency. I didn't think about it until someone else posted it, but there is a real possibility that many of the Hillary supporters don't see anything wrong with the way we prosecute whistleblowers. This is probably a fundamental difference I can't see us talking out. ",politics,t5_2cneq,2016-03-17 19:44:23,34,2016,3,-0.4789
Walrushippo23,542m11,Mike Pence: Trump and I believe there's “far too much talk” about racism in policing ,AmericanPolitics,t5_2qied,2016-09-23 02:26:11,2,2016,9,-0.6249
BillBarilko5,43gtxc,Mezzo institutes diversity training based on false allegations of racism ,Conservative,t5_2qh6p,2016-01-31 00:40:15,1,2016,1,-0.6249
PANTSONMIXTAPE,d7b41xn,B-but i *feel* thats the way things are,Conservative,t5_2qh6p,2016-09-06 04:01:36,2,2016,9,0.0
DGAgainstDV,49oatm,Britain's young men are falling further and further behind. Does anyone care? ,Conservative,t5_2qh6p,2016-03-09 14:34:33,12,2016,3,-0.3818
madazzahatter,4oayqp,"There's a new plan to stop climate change: turn CO2 emissions into stone. Scientists have turned an Icelandic power plant's carbon dioxide gases into minerals, a discovery that could represent a big step in efforts to curb climate change due to fossil fuels. ",environment,t5_2qh1n,2016-06-16 01:48:01,1,2016,6,-0.296
ReligiousFreedomDude,5jg32g,'Open Season on Christians': Benham Brothers Sound Alarm Over Expected Repeal of Anti-LGBT Law HB2 ,AmericanPolitics,t5_2qied,2016-12-20 22:01:03,1,2016,12,0.34
DLeibowitz,cylg1wx,"As far as I'm aware though, Hamas controls Gaza and the PA controls the West Bank. Israel doesn't just pluck you off the street and shoot you or bring you in to military court, you have to do something, such as rock throwing or storing weapons in order to bring the wrath of Israel on you in the West Bank. Besides, the people of Palestine don't really want peace (I don't think the Israeli gov't wants peace either). If Palestine becomes an independent country, one rocket attack (which happens regularly) would",Liberal,t5_2qxt5,2016-01-04 12:21:28,-1,2016,1,-0.9319
tvmalerts,4bbtfw,"Apply for Your Compensation, if You are Suffering from Trans Vaginal Mesh ",healthcare,t5_2qkih,2016-03-21 10:59:08,1,2016,3,-0.4767
paulavery183,d88yoo8,"In South Carolina, a 14-year-old boy shot and killed his father and then went on a shooting rampage in the playground of the Townville Elementary School in Anderson County, about 100 miles from Atlanta, on Wednesday. 

He shot and injured two boys, as well as a teacher, before being arrested. One of the boys, who was shot in the leg, is in critical condition. The shooter has not been named.",guncontrol,t5_2rdus,2016-09-30 23:31:05,1,2016,9,-0.8885
Plowbeast,d3yknp9,The investigation is in the hands of the FBI who has been grilling everyone under the sun on top of the highly visible reports from the State Department on potential wrongdoing.,AmericanPolitics,t5_2qied,2016-06-06 21:03:13,1,2016,6,-0.2023
pheonix200,40xorx,RNC Gears Up For A Contested Convention ,AmericanPolitics,t5_2qied,2016-01-14 14:06:53,1,2016,1,-0.0
DonVito1950,3zbiu8,"""Armed ""militia"" has taken over a federal building in Oregon"" ",Firearms,t5_2ryez,2016-01-03 21:15:13,1,2016,1,-0.0
rhyno37,4ambxa,"WASR, SKS, or VZ 58/2008? I've come to realize what my safe is missing: some commie love. I want a rifle chambered in 7.62x39, plain and simple. I'd love to take advantage of the cheap surplus ammo. No specific purpose for the rifle besides plinking and filling a spot in my safe. I'd like to keep it around $600 and under After doing some research, I've come down to these three rifles:

1) WASR 10 from Atlantic Arms: I actually had a WASR 10 back in 2011/2012, and wasn't the most impressed. Wobbly mag wells ",guns,t5_2qhc8,2016-03-16 04:58:37,2,2016,3,-0.9304
no-mad,d7a5cnq,What is he going to do about all the fucks who hire illegals? They are the real source of illegal immigration.,uspolitics,t5_2qwlq,2016-09-05 11:27:46,3,2016,9,-0.7717
i_love_oedipus_mom,545qyv,Register To Vote Campaign Coming from anti trump site ,Republican,t5_2qndt,2016-09-23 17:03:29,0,2016,9,-0.3182
Exigent_,41sagn,"Vote for the Democrats in New York in the /r/ModelUSGov elections! Hello! It is time for the midterm elections in /r/ModelUSGov! The Democratic Party is running house and senate candidates to promote our innovative political agenda. In ModelUSGov elections, every vote counts, which makes your support to us so vital. Here is the link to vote. Vote in the state of New York if possible! Thanks so much, and have a great day!",democrats,t5_2qn70,2016-01-20 02:49:36,2,2016,1,0.968
Homerpaintbucket,d19ycq5,"Too be honest, you might be right.  I didn't read that chart too carefully.  It was fucking hard on the eyes.  But realistically, I don't think it's too much to ask for people to keep their guns secured.  It's obviously not most, but there are way too many gun owners who think they live in an action movie and bad guys are going to burst in the door any minute.  ",guncontrol,t5_2rdus,2016-03-23 01:51:20,7,2016,3,-0.5017
JamarcusRussel,d4b6pcu,a great piece came out recently refuting that. it talks about his atlantic city casinos and how they were essentially a series of bad business decicisions by trump,PoliticalDiscussion,t5_2sfmf,2016-06-16 04:15:49,3,2016,6,0.1531
crippled_squid,4awxty,"We are Harry Potter. Now here is my explanation for why Trump is Severus Snape. (SPOILERS) If any of you are familiar with the Harry Potter books or movies, you will find this interesting, or at least enjoy a good laugh at some nerd who compares the political landscape to the mountainous hills behind Hogwarts. So let's get started. 

In this analogy, we the people are Harry Potter. Not just US, but all Americans, and to an extent, the people of the world. In this world, there are many people to watch out fo",The_Donald,t5_38unr,2016-03-18 05:02:50,13,2016,3,0.7015
N0T_an_ape,4c433s,Why aren't people talking about super-delegates for Trump the same way they are for Bernie? [removed],PoliticalDiscussion,t5_2sfmf,2016-03-27 02:42:37,1,2016,3,-0.0
WiseCynic,d493jap,"The gunners fear this subreddit something awful - which is why they show up to downvote everything they can find.  The mere discussion of gun control makes them shit their pants, so they do what they can to beat this place to hell.

If they could shoot us and get away with it, they certainly would do so.

Now, go upvote all you can!
",guncontrol,t5_2rdus,2016-06-14 18:38:22,4,2016,6,-0.9523
Farcin,d77y3fl,"You'll need to call Medi-cal and have them tell you if you're on it or not. Do not go to the doctor before speaking with Medi-cal. 
",healthcare,t5_2qkih,2016-09-03 13:22:52,2,2016,9,-0.0
kaydaryl,d4dzh54,"It's run by John Stossel's moustache, which is inherently infallible.",AmericanPolitics,t5_2qied,2016-06-18 04:53:28,1,2016,6,-0.0
drakal30,dape1zw,We need to hate all organized region equally ,Conservative,t5_2qh6p,2016-12-02 17:38:49,2,2016,12,-0.5719
save_the_last_dance,db53bs5,"Are Wall Street guys such a bad thing?  As a Dem, I wasn't scared of it with Hillary (mostly because I never believed she'd appoint them, despite the political rumours) and with Trump, it's...mildly reasurring.  At least he dumped the Christies, Ghouliani's and Palins and is going with some top private sector people.  Are they unprincipled scumbags who might loot America blind?  Maybe.  But at least they won't start a nuclear war or something.  We handled unprincipled scumbags looting America with President",Republican,t5_2qndt,2016-12-13 14:16:54,2,2016,12,-0.4082
HoldMyWater,d0p7bp4,He should drop out ASAP.,politics,t5_2cneq,2016-03-06 03:03:49,-1,2016,3,-0.2732
RhythmofChains,d4pw4ha,"To put that in perspective, about 3000 were killed in the September 11th attacks. ",environment,t5_2qh1n,2016-06-27 14:55:00,1,2016,6,-0.8126
BoomBoomChuck13,40wuts,"Question concerning Neoliberalism that the /r/explainlikeimfive sub flamed me for asking... I'm in a Gender &amp; Women studies class, and throughout the semester, my teacher has told me that I sprinkle the term ""neoliberal"" for good measure rather than always using it correctly. This is true. I understand how neoliberalism affected the economic, through free market capitalism, but how does it apply to a class concerning Feminism and the Media. For example, one of our questions spoke on shows such as 16 &am",Libertarian,t5_2qh63,2016-01-14 09:08:09,0,2016,1,0.5719
DonnieS1,d13ior0,Reality is a bitch.,AmericanPolitics,t5_2qied,2016-03-17 18:05:12,-2,2016,3,-0.5859
Coregame3,d3umn9m,"**[WE HAVE THE WORST LIBERALS, DON'T WE FOLKS] (http://youtu.be/P4-2NubbOM4)** ",The_Donald,t5_38unr,2016-06-03 16:24:20,37,2016,6,-0.7034
rcglinsk,d7hot0w,"I think this sentiment bodes well for Trump.  If people write off their political opponents as moral degenerates they're not likely to defeat them. It's the Sun Tsu thing, know your enemy to win.  Completely misunderstand your enemy to lose.",PoliticalDiscussion,t5_2sfmf,2016-09-11 02:04:27,1,2016,9,-0.6265
TracyMorganFreeman,dayxj8u,It's unjust if it's via robbery.,Economics,t5_2qh1s,2016-12-09 03:32:47,3,2016,12,-0.5106
trot-trot,4b6a1u,"""General Mills' announcement on Friday [18 March 2016] that it will start labeling products that contain genetically modified ingredients to comply with a Vermont law shows food companies might be throwing in the towel, even as they hold out hope Congress will find a national solution."" ",environment,t5_2qh1n,2016-03-20 04:01:07,47,2016,3,-0.4404
thisisthse,4byzpt,"I'm looking for a real, American political discussion from those who are against Trump...what are your reasons? [removed]",PoliticalDiscussion,t5_2sfmf,2016-03-25 23:41:51,0,2016,3,-0.0
houinator,42mers,"Which Obama Administration officials do you believe have been particularly successful, possibly to the point they would be retained even if a GOP candidate takes the White House? Sort of like how Robert Gates was retained by President Obama, despite being a Republican.",PoliticalDiscussion,t5_2sfmf,2016-01-25 17:03:51,28,2016,1,-0.7778
Paddy_Tanninger,daq3kbw,They want to take my guns so they can use them on babies for fuck's sake!,politics,t5_2cneq,2016-12-03 03:15:15,19,2016,12,-0.1511
solonballa41,40szr3,IWI US Introduces Tavor SAR in .300 Blackout at 2016 SHOT Show ,Firearms,t5_2ryez,2016-01-13 17:19:11,150,2016,1,0.0
bokono,43ix0n,Bernie Sanders Is Making Surprising Gains With Less Affluent Whites ,Liberal,t5_2qxt5,2016-01-31 12:38:12,72,2016,1,0.5423
travistee,4nt8ra,Orlando Killer Worked For Company Transporting Illegal Immigrants Inside US; Was Interviewed By FBI 3 Times ,uspolitics,t5_2qwlq,2016-06-13 00:57:04,19,2016,6,-0.836
manofthewild07,dao0xzt,Yes a 401k is managed by your company. You'd need a Roth IRA for your own investments. ,Economics,t5_2qh1s,2016-12-01 19:40:57,1,2016,12,-0.4019
KhazarKhaganate,42p1tx,"What the Australian gun ban and confiscation looked like. ""Personal protection is NO reason to have a gun"" ",Firearms,t5_2ryez,2016-01-26 01:30:28,132,2016,1,-0.8331
Spyder_J,41qi7a,‘Weiner’ could become another unwelcome distraction for Hillary Clinton ,politics,t5_2cneq,2016-01-19 20:17:11,2,2016,1,-0.6486
Hrodrik,d0nl4z4,Oil magnates out of touch? Preposterous.,environment,t5_2qh1n,2016-03-04 18:05:02,6,2016,3,-0.0
artyfoul,d1fpare,"Well it wouldn't be the first time Americans voted against their own best interests. 


Or what I perceive their best interests to be, I guess.",Republican,t5_2qndt,2016-03-27 22:52:18,0,2016,3,-0.926
thegayrepublican,5l4810,Obama Knew Russian Spies Infiltrated Government ,politics,t5_2cneq,2016-12-30 16:21:23,1,2016,12,-0.0
iaglia,d11t2aj,"ahh yes, youtube is such a reputable source",politics,t5_2cneq,2016-03-16 10:41:30,0,2016,3,-0.4019
No_big_whoop,dbq741u,It's shocking to me how much anger and bitterness there is in here for a guy whose policy positions seem to align so closely with Clinton's. It's almost like they don't care about what Clinton wanted to accomplish just that she was the one to do it,democrats,t5_2qn70,2016-12-28 19:56:44,-1,2016,12,-0.7731
KevanKing,4c1hi5,What the Ex-Pat Primary Tells Us About the Bernie Blackout ,democrats,t5_2qn70,2016-03-26 15:08:05,1,2016,3,-0.0
Automation_station,4p610f,"Democratic congressman Chaka Fattah convicted on racketeering, fraud and money laundering charges for using federal grant money to pay back an illegal campaign loan ",politics,t5_2cneq,2016-06-21 18:08:43,21,2016,6,-0.8126
charlesm5295,d79h2rn,"Florida gun laws are passable. Not much approval on open carry, only to hunting, range, and whatnot. And that's about it.",guns,t5_2qhc8,2016-09-04 20:26:49,1,2016,9,-0.6065
greensheets51,d1146vs,"So much for Germany and it's phasing out of nuclear technology... If there was proper energy storage technology renewables could and should take over immediately. Unfortunately that technology doesn't exist yet on a massive scale and removing nuclear leaves little option to meet energy demands besides fossil fuels.

http://www.climatechangenews.com/2016/03/14/german-co2-emissions-rise-10-million-tonnes-in-2015/",environment,t5_2qh1n,2016-03-15 21:17:14,3,2016,3,-0.2023
michaelconfoy,49conn,"Who Won the Debate? Hillary Clinton Is Given the Edge: Commentators did not see any campaign-altering moments, but many thought Bernie Sanders occasionally lost his cool and stumbled a bit discussing race. ",democrats,t5_2qn70,2016-03-07 13:51:37,4,2016,3,-0.3386
JIDF-Shill,cyrpplz,"Critics are going to ravage this movie holy shit they're already getting angry. Supposedly the film doesn't even mention the Mohammad youtube video that the liberals insisted was the reason for this whole incident. That's a real slap.

This, and American Sniper, are a threat to the SJW monopoly in Hollywood. That being said Michael Bay is no Clint Eastwood, so I objectively expect this to not be as good as American Sniper. But Bay can actually make a decent movie if it isn't a giant bloated sci-fi fest, I e",Conservative,t5_2qh6p,2016-01-09 11:54:08,4,2016,1,-0.8049
Creamigirl,5ifupl,Star Wars Is and Always Has Been Political ,politics,t5_2cneq,2016-12-15 05:49:17,1,2016,12,0.5574
Betterwithcheddar,d4k6ae6,"That Clinton name protection, unlike anything else in America. Break all the laws you want and never see indictment. ",politics,t5_2cneq,2016-06-23 00:42:11,2,2016,6,0.0772
ketcomp,4mo3fu,"Is it possible to update DS-160 form after biometric scans and confirmation of visa interview appointment? - Heading to Boston from Mumbai, India this fall.
- Question on DS-160 asked if I had been outside India in the last 5 years. I forgot a business related trip to Dubai.
- Bio-metric scanning is done and now I also have a date for the visa interview. Is there anything that I can do?",immigration,t5_2qvj0,2016-06-05 16:20:37,1,2016,6,-0.0
Shares_RSS,4plnl7,Saxo says content with current margin requirements for traders ,Economics,t5_2qh1s,2016-06-24 07:26:53,1,2016,6,0.0
bobodod,41caev,"What's behind the sudden narrowing in the polls between Bernie Sanders and Hillary Clinton? I'm looking at Real Clear Politics' latest averages, and Clinton has suddenly dropped, while Sanders has gained. Why the recent change?

http://www.realclearpolitics.com/epolls/2016/president/us/2016_democratic_presidential_nomination-3824.html",NeutralPolitics,t5_2tk0i,2016-01-17 05:46:43,125,2016,1,-0.6767
harryvdesign,4oadxc,Obama - Don't judge the many for the actions of a few. ,Firearms,t5_2ryez,2016-06-15 23:33:31,36,2016,6,0.0
3kool5you,4qh9l5,"Is increasing the minimum wage to be ""livable"" a viable solution? [removed]",PoliticalDiscussion,t5_2sfmf,2016-06-29 19:00:51,5,2016,6,-0.3182
Dylan-Baddour,4cpwbt,Divisive GOP presidential race ventures into unknown territory ,politics,t5_2cneq,2016-03-31 12:58:54,8,2016,3,-0.0
paintin_closets,cynytfe,"But why should your liberty lead to my death? 

Isn't that the perpetual argument about personal freedom: that your right to swing your arms with clenched fists ends at my nose? 

Canadian here so I'm probably posting in the wrong sub to start. ",Conservative,t5_2qh6p,2016-01-06 13:00:34,-4,2016,1,-0.4039
leapfbrasgiasa,439t3z,This Site Likely Contains Sexual-ly Explicit Photos Of Someone You Kno-w! my alst ,Republican,t5_2qndt,2016-01-29 17:28:59,1,2016,1,-0.0
beckett360,dbh00xn,"&gt; Obama has done nothing about Standing Rock

[Obama was the one who ordered the Army Corps of Engineers to investigate the planned pipeline proposal.](http://www.npr.org/sections/thetwo-way/2016/12/04/504354503/army-corps-denies-easement-for-dakota-access-pipeline-says-tribal-organization) Obama artfully stopped the DAPL without getting personally involved, imo. ",environment,t5_2qh1n,2016-12-21 17:57:42,66,2016,12,-0.2263
The_Man_In_Blue,d4i7hg7,"how the hell is your soul in another place, specifically the U.S.?",immigration,t5_2qvj0,2016-06-21 17:15:13,1,2016,6,-0.6808
conuly,4nzffz,"Legal Medical Abortions Are Up In Texas, But So Are DIY Pills From Mexico ",prochoice,t5_2rg0n,2016-06-14 03:07:36,10,2016,6,-0.0644
IronPathologist,42lt9m,Eminent Domain: Socialism for the rich - Thomas Sowell ,Conservative,t5_2qh6p,2016-01-25 15:12:48,74,2016,1,0.5574
