author,id,body,subreddit,subreddit_id,created_utc,score,year,month,sentiment
Yosoff,4cf8zc,Brussels Attacks: Why America Needs Ted Cruz ,Conservative,t5_2qh6p,2016-03-29 12:43:42,6,2016,3,-0.4404
CarolinaPunk,4p7y6z,Walker Endorses Delegate Freedom to Choose ,Conservative,t5_2qh6p,2016-06-22 00:35:02,8,2016,6,0.765
Sbalich,4naot8,Guns in america ,guns,t5_2qhc8,2016-06-09 13:03:03,1,2016,6,-0.0
JakeF12345,5i94l8,"""I will not vote for any budget that doesn't balance"" - Rand Paul ",Libertarian,t5_2qh63,2016-12-14 06:37:39,119,2016,12,-0.0
commentsrus,d7yxmew,wut,Economics,t5_2qh1s,2016-09-23 15:15:50,6,2016,9,-0.0
ruskeeblue,4otmeg,Bernie Sanders and God ,uspolitics,t5_2qwlq,2016-06-19 14:59:39,1,2016,6,0.2732
rotj,d84djor,"Asher seems to be walking back on Blumenthal explicitly sharing the birther issue with him.  Now he's only saying that Blumenthal suggested looking into Obama's ""connections"" and ""roots"" to Kenya.

http://www.mcclatchydc.com/news/politics-government/election/article102828747.html
&gt; In a statement to McClatchy on Monday, Asher said:

&gt; “Blumenthal visited the Washington Bureau of McClatchy, where he and I met in my office. During that conversation and in subsequent communications, we discussed a number",NeutralPolitics,t5_2tk0i,2016-09-27 17:48:58,9,2016,9,-0.4767
BrindlyPibbly,d4id0ob,Beautiful weapon!,guns,t5_2qhc8,2016-06-21 19:10:20,2,2016,6,0.4574
skilless,cyynq6y,"You can tell you aren't a scientist/are an economist when a statement like ""climate change will dry California and cause flooding in Texas"" sounds like it disagrees with itself.",Economics,t5_2qh1s,2016-01-15 01:21:41,1,2016,1,-0.4019
juddweiss,52hgzn,"Let's support this ACLU campaign to pardon Edward Snowden, he should be recognized as a national hero to the America population. ",Libertarian,t5_2qh63,2016-09-12 23:45:00,721,2016,9,0.8225
linkns86,51zucf,Libertarian Star Trek ,Libertarian,t5_2qh63,2016-09-09 21:38:24,19,2016,9,-0.2263
toss_it_account,43arnm,"Why don't states give convicted felons different colored IDs to show that they can't buy a firearm? So recently it's come to light that there are millions of convicted felons that aren't in NICS because the states aren't reporting them. Ohio recently started giving yellow plates to drivers who have a previous DUI offense. Why not carry the same logic over to the ID itself? If you're an FFL and you sell to a prohibited person that's not in NICS because they were never reported, then it could end horribly for",Firearms,t5_2ryez,2016-01-29 20:46:12,51,2016,1,-0.5204
reaper527,d4joy9t,"&gt;125 times in an hour and a half? What did that even sound like?

like this:

https://www.youtube.com/watch?v=mdeo7Q2E5cE",politics,t5_2cneq,2016-06-22 18:16:14,0,2016,6,-0.6747
Buck-Nasty,5l2vgp,Obama Urged to Take U.S. Nukes Off High Alert Before Trump Takes Office ,politics,t5_2cneq,2016-12-30 10:48:37,344,2016,12,-0.296
kk141,dbd7uge,"At the last 2 places I worked at, they were restaurants (and one was Christian owned too), and all of my managers insisted that I said ""Happy Holidays"".

It's probably not going to offend someone unless they're one of ""those people"" (AKA super fucking abrasive and easily triggered), but it does impact how someone views a restaurant, and it seems like business owners/managers like it being used because they want to ensure returning customers.

I'm not sure if it works, and it's a really unstudied topic, but ",Conservative,t5_2qh6p,2016-12-19 02:58:51,3,2016,12,0.9323
VirginWizard69,41n0fp,[Info-graphic] Sanders' Health Plan ,Conservative,t5_2qh6p,2016-01-19 04:51:02,8,2016,1,-0.0
beastboi27,dbqerdr,"Sorry. I just assumed that everyone knew I meant domestically since, you cannot travel internationally without a passport.",immigration,t5_2qvj0,2016-12-28 22:41:41,1,2016,12,-0.0772
TennisEnnis19,d0my4zy,God I wish Kasich was more popular,Republican,t5_2qndt,2016-03-04 03:54:35,18,2016,3,-0.7841
Rhusher,d7vt3ok,"Well that's a relief. 

",immigration,t5_2qvj0,2016-09-21 09:47:24,1,2016,9,0.6369
Chainmail_Danno,d16o9bp,"I'll see what they have to say, thanks. When I checked a week or so ago, the wait time was 2-4 weeks. Now that it's 3-6 months, I'm not sure what that means for the quality available. ",guns,t5_2qhc8,2016-03-20 13:13:56,2,2016,3,-0.2354
yo2sense,d4qyo5r,If you are a Republican with libertarian tendencies and you can't vote for Trump then why not vote Libertarian? Or don't vote at all. Just don't expect to keep Hillary Clinton out of the White House. ,AmericanPolitics,t5_2qied,2016-06-28 07:44:13,1,2016,6,-0.0603
rsurapaneni,4qe76h,The Answer to Cancer Prevention: Study ,healthcare,t5_2qkih,2016-06-29 06:51:19,1,2016,6,0.6597
SkepticalJohn,4asyu8,Wetland enhancement in Midwest could help reduce catastrophic floods of the future | News and Research Communications ,environment,t5_2qh1n,2016-03-17 13:26:34,10,2016,3,-0.128
fullmoonhermit,d17jny1,"Actually, I think people were far more offended by your seeming dismissal of bisexuality as an identity to be taken seriously. You put it in quotes, as if it's a made up orientation (""the 'bisexual' thing"") and then go on to imply that only ridiculous young people say they're bisexual, which is patently untrue.

Maybe you have no anecdotal evidence of people telling you about their bisexuality precisely because of your negative attitude towards us. 

As to your point, I agree that it would be tougher to be ",PoliticalDiscussion,t5_2sfmf,2016-03-21 04:58:56,0,2016,3,-0.8016
Thedailystarbd,4pwide,From waste to health insurance ,environment,t5_2qh1n,2016-06-26 06:10:12,1,2016,6,-0.4215
typewritertrew,d1477bp,Then the gun isn't registered to you any more? Pretty basic.,guncontrol,t5_2rdus,2016-03-18 04:55:56,6,2016,3,-0.2716
jimlah,d19il44,"Of course the AIPAC condemned Trump's remarks. The audience went *fucking nuts* when he talked about Obama.

You can't have the leading Israel lobby being seen as shitting on the sitting president of the US. Which is exactly how it appeared, which is why they had to ""officially"" condemn Trumps remarks.",Republican,t5_2qndt,2016-03-22 19:28:12,2,2016,3,-0.802
jdepps113,dbbedjz,"Yeah, that's why [this single racist comment](https://www.reddit.com/r/Libertarian/comments/5ir3is/expectations_vs_reality/dbadq2o/) in here was downvoted to hell... oh wait, no, that disproves what you're saying.",Libertarian,t5_2qh63,2016-12-17 19:48:13,1,2016,12,-0.6124
AutoModerator,db7dnv4,"
As a reminder, this subreddit [is for civil discussion.](https://www.reddit.com/r/politics/wiki/rulesandregs#wiki_please_be_civil)

* Do not call other users trolls, morons, children, or anything else clever you may think of. [Personal attacks, whether explicit or implicit, are not permitted.](https://www.reddit.com/r/politics/wiki/rulesandregs#wiki_no_personal_attacks)

* Do not accuse other users of being shills. If you believe that a user is a shill, the proper conduct is to report the user or send us a",politics,t5_2cneq,2016-12-14 22:52:05,1,2016,12,-0.1551
keanoodle,52knuq,"Clinton Campaign Unloads On NBC For Covering Hillary's ""Coughing Attack"" | Zero Hedge [removed]",NeutralPolitics,t5_2tk0i,2016-09-13 14:13:36,1,2016,9,-0.4767
decatur8r,cyr4ny9,"&gt; So it has happened, and those on the left just ignore it.

No it didn't...first that is a discredited report...secondly it deals with YOUTH UNEMPLOYMENT not overall unemployment something that the very report this quotes says it was unchanged.

Here is the report if you want to read it...

http://www.nber.org/papers/w0790



&gt;Not for the ones that get fired

Let me repeat.. **It has never happened**

http://www.businessforafairminimumwage.org/news/00135/research-shows-minimum-wage-increases-do-not-c",uspolitics,t5_2qwlq,2016-01-08 22:02:04,1,2016,1,-0.7796
SchlangeHatRecht,db4e4us,"""I heard a lot of Da and Nyet and I was suspicious that the recount was hacked.""",uspolitics,t5_2qwlq,2016-12-13 00:50:46,1,2016,12,-0.3612
skekze,czdix38,hate endorses hate.  News at 11.  ,AmericanPolitics,t5_2qied,2016-01-27 05:04:10,2,2016,1,-0.7184
nclh77,db5ccc6,Nope.  This certainly dosen't account for all the wealth created by increased productivity. It's all gone to wage earners? Too funny.  ,Economics,t5_2qh1s,2016-12-13 17:23:31,2,2016,12,-0.8
Sbaked,czaq2d6,"This article is acting as if there isn't another democratic presidential candidate.  
I'm not one of those ""Bernie or bust"" people, but I see him being a whole lot better for progressive causes than she is.  ",Liberal,t5_2qxt5,2016-01-25 01:56:15,4,2016,1,-0.5927
acusticthoughts,40ukit,"Clean energy investment surged to a record $329.3bn, up 4% from 2014’s $315.9bn. 2015 was the highest ever for installation of renewable power capacity, with 64GW of wind and 57GW of solar PV commissioned during the year, a 30% increase over 2014. ",environment,t5_2qh1n,2016-01-13 22:39:20,6,2016,1,0.7269
mathpoet,czfyh1y,Probably the toughest question Rubio has ever been asked by Kelly. Handled it well enough. ,Republican,t5_2qndt,2016-01-29 03:03:01,7,2016,1,0.2023
jlew24asu,51fzql,Draghi Nears His QE3 as ECB Seen Relying on More Stimulus ,Economics,t5_2qh1s,2016-09-06 16:15:06,14,2016,9,-0.0
spartan2600,4q5tee,"DNC Platform Leaves Door Open for No-Fly Zone in Syria, Refuses to Call for End to Israeli Occupation ",democrats,t5_2qn70,2016-06-27 21:31:32,1,2016,6,-0.0
horoblast,dartyms,They're like a suicide cult,The_Donald,t5_38unr,2016-12-04 14:43:35,266,2016,12,-0.4588
endlessinavictory,d4dmps4,"I have this feeling about ""family-oriented"" religions. They all lose me when they dictate what, exactly, you're allowed to do with your genitals. I feel that this is somehow [relevant](https://www.youtube.com/watch?v=sw8nc48agJk).",prochoice,t5_2rg0n,2016-06-17 22:12:17,6,2016,6,-0.296
Spurty,d1ccg99,"As someone who does exactly what you're describing (i.e. working with international clients from home), you don't need a visa to conduct business with foreign companies as a contractor/freelancer if you go back to Canada. 

Also, there aren't really any requirements to becoming an independent contractor. You are just treated as a business and you file taxes accordingly as such. You might need a business license depending on where you conduct most of your business but it's usually pretty simple to do in most",immigration,t5_2qvj0,2016-03-24 22:11:01,1,2016,3,-0.6486
iamkratom711,d7bs9ye,https://www.youtube.com/watch?v=2IzuXqjE7jw&amp;list=PLn-ZbndJg2TOzdA0l3bIegAZ7gpvH2Wrh,healthcare,t5_2qkih,2016-09-06 18:42:11,1,2016,9,-0.0
Phredex,cz0sji9,And worse.,Conservative,t5_2qh6p,2016-01-16 21:53:40,9,2016,1,-0.4767
platapus112,d45f5w0,"Oh my fucking god, the first one you drop is often confused. Good one bud hahahaha ",The_Donald,t5_38unr,2016-06-11 23:38:15,8,2016,6,-0.2247
jewface123,5h7sx0,annihilating islam [removed],PoliticalDiscussion,t5_2sfmf,2016-12-08 16:21:37,1,2016,12,-0.0
parakmahi,48w8gn,All You Need to Know About Kidney Care ,healthcare,t5_2qkih,2016-03-04 06:30:21,1,2016,3,-0.4939
SargonOfAkkad,d1kg5rv,"&gt;Thomas Jefferson called this natural law

So if someone violates your property rights nature will punish them?",Libertarian,t5_2qh63,2016-03-31 14:36:40,1,2016,3,-0.6235
IBiteYou,d4dxhyo,"&gt; Additionally trump signed the same pledge everyone else did 

He reneged on the pledge in the last debate and continues to threaten a third party run.",Republican,t5_2qndt,2016-06-18 03:41:11,8,2016,6,-0.0258
AlanHeadbloom,4ptmko,"In deeply touching interview, fitness expert Jorge Rodriguez talks about his own challenges with health and the surprising generosity of others. ",immigration,t5_2qvj0,2016-06-25 18:07:35,1,2016,6,0.7943
Eyegore138,42bjaj,What would be the upside of a national firearm registry? [removed],NeutralPolitics,t5_2tk0i,2016-01-23 16:42:17,1,2016,1,-0.0
bobbelcher,5g5w0s,Trump’s Trickle-Down Populism ,uspolitics,t5_2qwlq,2016-12-02 21:27:24,1,2016,12,-0.0
superhaus,d45jahv,I just made the first political donation of my life. I am 43 years old.,Libertarian,t5_2qh63,2016-06-12 01:49:17,9,2016,6,0.0
IBiteYou,41ath0,Bernie Sanders would likely raise taxes to pay for universal health care ,Republican,t5_2qndt,2016-01-16 23:08:42,13,2016,1,-0.4215
pspence75,d0ya4gu,"Lol yeah, grenades are made out of plastic",guns,t5_2qhc8,2016-03-13 15:52:37,3,2016,3,-0.6124
morpheushealthcare,d7fccwz,Sleep Disorder diagnostic and Treatment health care center in Delhi.,healthcare,t5_2qkih,2016-09-09 06:29:16,1,2016,9,-0.128
Jur,db3419y,Сука Блят,The_Donald,t5_38unr,2016-12-12 04:15:06,14,2016,12,0.0
Ragnar__Danneskjold,4amj42,I'll never forgive Rubio for this I will never forgive Rubio for choosing his own ego over the good of the county and sticking in this long. He could have and should have gotten out weeks ago and helped Cruz. Same with Kasich. Both of them only stayed in to satisfy their arrogance. Rubio has permanently lost my support for the rest of his life. That man has no honor or decency in him.,Conservative,t5_2qh6p,2016-03-16 06:07:09,0,2016,3,-0.312
andersenkeen,40lhkq,Medical Billing and Denial Management - Interrelationship ,healthcare,t5_2qkih,2016-01-12 07:24:48,1,2016,1,0.0
walterwhite413,d0u652w,A liberal democrat,Libertarian,t5_2qh63,2016-03-10 01:56:49,0,2016,3,0.0
Havik5,d0s41zb,"""Destroying life to potentially save life is as hypocritical as it is ineffective.""

Well I hope you only eat rocks and never need a limb amputated otherwise I've got bad news for you. Also society already ""treats the potential for life as disposable"" unless you believe every sperm is sacred or think I should hold a wake every time I flush a tampon. I could have had dozens of children by now who could have potentially grown up to be incredible people, but my choices snuffed out that potential. Abortion is j",prochoice,t5_2rg0n,2016-03-08 15:37:01,7,2016,3,-0.2382
UHSpartan,51k61q,Johnson Snow ,Libertarian,t5_2qh63,2016-09-07 07:55:38,226,2016,9,0.0
thecrazing,d157rjn,Okay.,democrats,t5_2qn70,2016-03-19 00:59:19,1,2016,3,0.2263
zombie_loverboy,d3ryxwp,"I edited and added this pic showing yes it does cost $18T initially but saves $36.8T as well for a net savings of $18.8T. http://i.imgur.com/ePspU6t.jpg

Bernie wants to spend a Trillion on our aging infrastructure to get it up to par, which will be very useful and help businesses. How much will Trump's wall cost? And how will businesses use that wall? ",Libertarian,t5_2qh63,2016-06-01 17:29:07,1,2016,6,-0.9201
wifesaysnoporn,cyr39jf,"http://thehill.com/blogs/pundits-blog/presidential-campaign/264023-in-blockbuster-poll-sanders-destroys-trump-by-13

http://www.huffingtonpost.com/entry/sanders-beats-republican-candidates-poll_565ee12ce4b079b2818c95fc

http://www.rollingstone.com/politics/news/poll-against-bernie-sanders-donald-trump-would-get-schlonged-20151223

http://blogs.wsj.com/washwire/2016/01/05/campaign-dont-worry-bernie-sanders-can-beat-clinton-then-beat-gop/",Liberal,t5_2qxt5,2016-01-08 21:28:34,2,2016,1,-0.0
cheezman111,cz4em9f,Did you look at his tax plan? ,Libertarian,t5_2qh63,2016-01-19 21:32:39,0,2016,1,-0.0
tuck5649,49fdz7,Is Trump the first candidly pro-torture presidential candidate in the US? [removed],NeutralPolitics,t5_2tk0i,2016-03-07 23:12:32,1,2016,3,-0.0
PinkoCommieman,4o05tm,"UnReddit r/Lesbians: The Carpet Munchers Remove a Post detailing proof the alleged Orlando Pulse Nightclub shooting was as fake as a three dollar bill - That calls for the trial &amp; execution of Barak Obama and his entire administration as 911 traitors, and John Kennedy assassination co conspirators ",Libertarian,t5_2qh63,2016-06-14 06:39:39,0,2016,6,-0.7906
wiseprogressivethink,4bt5tx,Chelsea Hits Obamacare's 'Crushing Costs' ,Conservative,t5_2qh6p,2016-03-24 19:38:12,13,2016,3,-0.3612
iSunMonkey,d81nnz0,"And how does that compare to white, hispanic, etc. deaths in america?

Also, what is your source on that number?",Conservative,t5_2qh6p,2016-09-25 19:32:13,-7,2016,9,-0.168
RomanNumeralVI,5g18c4,"Will Castro's death advance or deny Trump's vision for human rights regarding human rights in Cuba, (especially for LGBT human rights)? [removed]",NeutralPolitics,t5_2tk0i,2016-12-02 04:04:23,1,2016,12,-0.6486
vanburen1845,d75wxu9,I think you are right. It's one thing to reluctantly support Trump over Clinton but defending every little thing like the pro trump pundits on cable tv is embarrassing. ,Republican,t5_2qndt,2016-09-01 21:03:14,8,2016,9,-0.0213
samoto22,49o543,"Are there any real arguments against marijuana legalization left? I'm sure most of us know the benefits of Marijuana legalization, such as increased tax revenue, medication, [cancer treatment](https://www.youtube.com/watch?v=vMZCq56tToc&amp;ab_channel=VICELAND), less people in prison, less fatherless homes, and less paranoid highs :) That being said, are there any real arguments left against marjuana legalization?",PoliticalDiscussion,t5_2sfmf,2016-03-09 13:55:10,0,2016,3,-0.2375
anutensil,4nftfo,"The Media Rightly Denounces Trump’s Racism, But What About His Climate Denial? - The Media’s ‘Murrow Moment’ Missed Trump’s Dangerous Climate Views ",environment,t5_2qh1n,2016-06-10 11:15:17,29,2016,6,-0.8873
_Decimation,5fv47h,Why are universities and their students mostly liberal? [removed],NeutralPolitics,t5_2tk0i,2016-12-01 06:27:28,1,2016,12,-0.0
janethefish,d7d6cpt,Wait can they invest the money or does the ups need to have it in liquid cash format? Please tell me they can at least do some low risk investments.,politics,t5_2cneq,2016-09-07 19:15:38,3,2016,9,-0.2263
OTS-Solicitors,5glmlc,Deportation – Balancing Article 8 Rights and the Public Interest ,immigration,t5_2qvj0,2016-12-05 12:22:35,1,2016,12,0.4588
SynapticSight,dbatggd,I personally wash mine fairly frequently (at least weekly) and avoid wearing a tie for that reason. I also tend to not wear my white coat unless absolutely needed just because it turned into a contagious mess.,healthcare,t5_2qkih,2016-12-17 06:44:35,3,2016,12,-0.7269
jse803,d4tn94s,Isn't this right where the government wants then to be? Things that make you go hummmm....,Economics,t5_2qh1s,2016-06-30 05:57:43,-1,2016,6,-0.0
Phalanxrising,cysw6z1,It is the Wapo after all. Easy mistake,Firearms,t5_2ryez,2016-01-10 14:57:28,2,2016,1,-0.128
cajunmagic,41kxkw,"Sig 238/938 vs kimber micro carry? What opinions do you guys have on these guns? Likes, dislikes I'm trying to figure out what I want next. 


Edit: Why all the kimber hate? Why does gunnit hate kimber?",guns,t5_2qhc8,2016-01-18 20:50:38,1,2016,1,-0.8385
thinkonthebrink,dazm2hp,"Like conservatism is about conservation, right? But if you progressive bastards didn't adopt Christianity and were more true to your actual pagan European roots, well... we were queer as fuck before. You're not real conservatives, you were just progressive until a certain time and then want to say you're conserving that. Which is silly. ",Conservative,t5_2qh6p,2016-12-09 16:58:28,-3,2016,12,-0.5977
monkeydeluxe,d7oc0fd,"
&gt;The U.S. political system was once the envy of many nations. Over the last two decades, however, it has become our greatest liability. Americans no longer trust their political leaders, and political polarization has increased dramatically. Americans are increasingly frustrated with the U.S. political system. Independents now account for 42% of Americans, a greater percentage than that of either major party

And that 42% is growing.  In many states ""independent"" has gained more voter registrations sinc",AmericanPolitics,t5_2qied,2016-09-15 20:46:32,-1,2016,9,-0.8625
pcarenza,d0k5wbg,He's not so smart after all.,Conservative,t5_2qh6p,2016-03-02 01:53:24,2,2016,3,-0.4298
hrgrimer,5iafx4,How could Russia have 'Hacked' the Election? [removed],NeutralPolitics,t5_2tk0i,2016-12-14 13:01:46,1,2016,12,-0.0
nice_try_fatty,d46gfr4,**hippopotomonstrosesquipedaliophobia is alive and well tho.**,The_Donald,t5_38unr,2016-06-12 20:57:54,2,2016,6,0.5719
DonDunst,41qcr2,"Ted Cruz - ""Merrr! Me Republican! Me build wall, keep 'bad guys' out!"" ",Liberal,t5_2qxt5,2016-01-19 19:42:59,1,2016,1,-0.6571
Firsmith,d75xhsf,who cares about cumulative? What's done is done. Fixing what we are doing moving forward is all that matters.,environment,t5_2qh1n,2016-09-01 21:16:18,1,2016,9,-0.4767
joshball6,5ghq2t,"HOW TO GET BACK INTO USA I attended school for 4.5 years &amp; graduated in December 2015. Moving back to Canada after graduation. I have recently decided to start looking into getting back to the states for work &amp; living. I have some connections into the workplace &amp; my gf of a few years is an American citizen. Any idea of how I can get back legally to begin work or if there are any shortcuts for being someone who studied in the states? Or any idea of the costs entailed for acquiring a visa, lawyer ",immigration,t5_2qvj0,2016-12-04 21:09:46,0,2016,12,-0.1027
wheelchairindia9,4bgz8n,Walker Boot With Air Inflation System for Ankle Sprain by Manish Batra ,healthcare,t5_2qkih,2016-03-22 11:16:26,1,2016,3,-0.0
traplordzz,dana2l6,"I'm an atheist as well. I'm all for being critical of religion but the problem with maher and the ""new atheist"" movement in general is that all the problems of Islamic countries and people are caused by the religion. This is not the case. Removing the role of the west in the current and past conflicts in the Middle East is just factually irresponsible. Islamaphobia doesn't apply to the religion as a whole the way I see it, it applies to its people. The new atheist view is that these people are backwards idi",Liberal,t5_2qxt5,2016-12-01 06:17:20,15,2016,12,-0.9377
sube_fresh,49wrvt,Bought a German counterpart for my Czech beauty tonight. Can't wait to shoot! ,Firearms,t5_2ryez,2016-03-11 02:20:21,59,2016,3,0.7293
WillieM96,d0rgpiq,You win.  You refuse to put in any effort into understanding what science is and how it works so I'll agree the sky is green just to end this conversation.  Good day.,Republican,t5_2qndt,2016-03-08 00:50:04,1,2016,3,0.8062
tugIyfe,dau04mx,"**ALEC IS A MESS  
A  
BIG  
FAT  
MESS**
",The_Donald,t5_38unr,2016-12-05 23:19:09,43,2016,12,-0.3612
0454,cyzusm1," &gt; “As long as I am speaker of this House, I will not use any of our valuable time taking away the constitutional rights of our citizens,” Ralston told reporters at an impromptu news conference, making the end of the first five days of the 40-day legislative session.

Later in the article... 

&gt; Ralston said the press conference “is about as much energy and time as you will see utilized” on the topic of an assault weapons ban.

Must be nice to live where assault weapon bans get smacked down just like ",Firearms,t5_2ryez,2016-01-16 00:08:29,41,2016,1,-0.7783
mynameisethan182,4c178g,"Cruz denies tabloid’s adultery allegations, blames ‘garbage’ on Trump ",politics,t5_2cneq,2016-03-26 13:44:18,33,2016,3,-0.6705
muddypaws,d7w31ks,They're afraid he'll call them mean names on twitter. ,uspolitics,t5_2qwlq,2016-09-21 15:11:11,1,2016,9,-0.0
HenryCorp,5i21g6,"PolitiFact: Trump is Lying, Russia DID Swing Election in his Favor ",uspolitics,t5_2qwlq,2016-12-13 06:11:38,4,2016,12,-0.1779
Notorious_Dave,d7s8lbx,For plinking sure. But some people like to have guns as a preparedness thing and in a SHTF type situation you might have to lend mags out or whatnot. ,guns,t5_2qhc8,2016-09-18 20:40:31,-1,2016,9,-0.5994
Odog,4bx8gn,Hallie Jackson Renders Ted Cruz Speechless ,Liberal,t5_2qxt5,2016-03-25 16:42:30,19,2016,3,-0.0
manwithoutaguitar,d1f29kt,"Yes, if you want jobs starting a war is also good. That doesn't mean it's a good idea to start a war.",Economics,t5_2qh1s,2016-03-27 07:54:25,5,2016,3,-0.0
June1994,d19cvqf,Republicans do not care about it.,Republican,t5_2qndt,2016-03-22 17:23:09,4,2016,3,-0.3875
drewiepoodle,41qpwu,Southern GOP Lawmaker Defends Medical Pot: 'We've Never Had An Overdose On Marijuana' ,politics,t5_2cneq,2016-01-19 21:02:50,202,2016,1,0.0
Shares_RSS,4oy7ky,Nigeria's central bank says will clear backlog of currency demand through forward trades ,Economics,t5_2qh1s,2016-06-20 11:07:02,1,2016,6,-0.2732
Trillamanjaroh,42nm5k,"Trump: Al Sharpton loves me because ""He knows I get him, other don't!"" ",Conservative,t5_2qh6p,2016-01-25 20:46:41,29,2016,1,0.6114
Stockinglegs,cz1mcex,"It just means ""outside"" money. ",NeutralPolitics,t5_2tk0i,2016-01-17 16:47:11,2,2016,1,-0.0
justcallmezach,dbpvoew,"I bought that rationale for a minute or two after the election. Then I realized I can't imagine a damn person (I certainly don't know any, and living in South Dakota, I know lots of Trump voters) that went ""Oh, man! I was totally going to vote for Clinton until they called Trump supporters racist! I'm totally voting for him, now!""

Moderates or anyone outside of people already voting for Trump wouldn't switch votes to Trump because of that.",politics,t5_2cneq,2016-12-28 15:51:14,3,2016,12,-0.5321
HeinieKaboobler,5l9v6a,‘Oh f*ck off!’ Internet buries ‘absolute sociopath’ Trump for bizarre New Year’s Eve message ,Liberal,t5_2qxt5,2016-12-31 14:30:44,192,2016,12,-0.3802
salmoneric,dbr18zb,"The law requires that the FBI be used to conduct background checks on all private party gun sales. 

But basically the FBI is telling Nevada that it won't conduct background checks because Nevada can conduct comprehensive background check without it.

Without the FBI component of this law in effect; the law is rendered unenforceable.
",Firearms,t5_2ryez,2016-12-29 09:41:26,58,2016,12,-0.3919
sleekgreek,dbo31qz,"Remember during Katrina, the refugees at reliant, all those mom and pop cafe and restaurants brought food and were turned away because star had the contract, that's when I realized it was illegal to help fellow man, also when I realized fuck this country. Now I save to leave it.",Libertarian,t5_2qh63,2016-12-27 04:58:15,16,2016,12,-0.2263
